"color-count","goods-title-link--jump","goods-title-link--jump href","rank-title","rank-sub","price","discount","selling_proposition","goods-title-link"
"4","","","","","$11.21","-12%","1.5k+ sold recently","Tween Girl Colorblock Bikini Swimsuit With Coconut Tree Print Cover Up Set"
"4","","","","","$3.95","-29%","1.3k+ sold recently","SHEIN Tween Girl Short Sleeve Round Neck T-Shirt With Letter Print"
"","","","#7 Best Sellers","in Kids Jewelry & Watches","$1.70","-6%","","3pcs/set Girls Unicorn Charm Beaded Bracelet"
"","","","#5 Best Sellers","in Tween Boys Bottoms","$6.84","-19%","","SHEIN Tween Boy Paisley Print Drawstring Waist Shorts"
"4","","","","","$5.53","-53%","300+ sold recently","Tween Girl Sports Street Style Loose Knitted Solid Color Pleated Skort"
"4","","","#4 Best Sellers","in Tween Girls Shorts","$3.60","-14%","","SHEIN Tween Girl Summer Casual Floral Elastic Waist Shorts"
"14","","","","","$9.90","-7%","900+ sold recently","Tween Girl Patchwork Floral Print Bikini Set With Separated Top And Bottom"
"5","","","","","$7.10","-14%","400+ sold recently","SHEIN Young Girl Notched Neckline Tank Top & Shorts"
"6","","","","","$3.40","-13%","1.0k+ sold recently","SHEIN Tween Girl Contrast Trim Dolphin Hem Shorts"
"4","","","","","$12.40","-14%","2.5k+ sold recently","SHEIN Genkimix Kids Young Boy Letter Graphic Colorblock Sweatshirt & Sweatpants"
"","","","#2 Best Sellers","in Teen Girls Skirts","$11.10","-5%","","SHEIN Teen Girl Blue & White Porcelain Printed Patchwork Skirt With Ruffle Hem For Holiday"
"","","","","","$10.40","-7%","1.7k+ sold recently","Tween Boy Letter & Tropical Print Beach Swimsuit"
"7","","","","","$8.40","-13%","700+ sold recently","SHEIN Young Girl Spring/Summer Knit Solid Color Spaghetti Strap Jumpsuit For Holiday & Leisure"
"4","","","","","$4.65","-17%","1.5k+ sold recently","SHEIN Young Girls' Cartoon & Striped Colorblock Ruffle Armhole Dress"
"6","","","","","$15.70","-13%","700+ sold recently","SHEIN Tween Girl Casual Sports Style Simple Color Block Multiple Shorts Sets"
"4","","","","","$15.40","-7%","1.8k+ sold recently","SHEIN Tween Girl Star Print Flare Leg Jeans"
"","","","#9 Best Sellers","in Young Girls Beachwear","$8.50","-15%","","Young Girl Solid Color Top & Strawberry Print Bottom Swimwear Set"
"","","","","","$9.80","-13%","2.4k+ sold recently","SHEIN Tween Girls' Casual Geometric Print Halter Neck Sleeveless Top And Skirt Set"
"","","","#1 Best Sellers","in Kids Learning & Education Toys","$1.54","-50%","","1set Children's Number Counting Finger Math Learning Board Toy For Early Education And Intelligence Development"
"6","","","#3 Best Sellers","in Teen Girls Denim Skirts","$12.00","-6%","","Teen Girl Flap Pocket Denim Skirt"
"","","","","","$9.30","-11%","80+ sold recently","Teen Girl Summer Casual Sunglasses & Coconut Tree/Letter Printed Short Sleeve Shorts Set"
"","","","","","$5.10","-12%","600+ sold recently","Tween Girl White Shirt, Summer Tops, Summer, Casual Simple English Printed Short Sleeve Round Neck T-Shirt, Suitable For Spring And Summer"
"","","","","","$3.72","-15%","500+ sold recently","Young Girl Tie-Dye Slogan T-Shirt, Casual Minimalist Letter Print Round Neck Short Sleeve T-Shirt, Summer"
"","","","","","$12.20","-13%","700+ sold recently","SHEIN Tween Girls' Summer Vacation Style Cold Shoulder Multi-Layered Lace Top And Floral Printed Skirt Two-Piece"
"","","","","","$12.00","-7%","2.6k+ sold recently","Young Girl Denim-Like Floral Print Shorts 3pcs/Pack"
"","","","#1 Best Sellers","in Kids Ankle Chain","$1.50","-12%","","3pcs Bohemian Beach Style Love Heart & Rice Bead Design Elastic Anklet For Kids"
"","","","","","$8.30","-14%","1.8k+ sold recently","SHEIN Tween Girl Tie Dye Twist Hem Tank Top & Bow Front Shorts"
"4","","","","","$9.10","-7%","1.0k+ sold recently","SHEIN 3pcs/Set Tween Girls' Flower Printed Swimsuit With Casual & Party Outfits For Beach Vacation, Spring And Summer, Bathing Suit Vacay Vibe"
"4","","","","","$12.10","-15%","900+ sold recently","SHEIN Tween Girls' Casual Striped Short Sleeve Shirt And Skirt Set In Multi-Colors"
"","","","","","$6.00","-6%","1.4k+ sold recently","SHEIN Tween Girl Stretchy Knit Geometric Patterned Bodycon Slip Dress With Non-Adjustable Shoulder Straps For Vacation And Leisure"
"","","","","","$5.20","-15%","300+ sold recently","SHEIN Tween Girls' Streetwear Athletic Knit Colorblock Raglan Sleeve Top"
"","","","","","$3.84","-60%","100+ sold recently","SHEIN Young Girl Knitted Plain Color Alphabet & Car Pattern Loose Round Neck Casual T-Shirt With Knitted Checkered Shorts Set"
"6","","","","","$10.30","-6%","7.0k+ sold recently","SHEIN Teen Girls Ripped Raw Trim Denim Shorts"
"","","","","","$4.20","-7%","600+ sold recently","Tween Girl 1pc White Knitted Ribbed Tank Top Casual Simple Style"
"","","","","","$11.74","-16%","1.0k+ sold recently","SHEIN Teen Boys' Streetwear Ink-Splash Digital Print T-Shirt And Solid Color Drawstring Waist Pocket Shorts Set"
"4","","","","","$6.84","-60%","100+ sold recently","Tween Girl Casual Street Style Cool Pink Washed Ripped Loose Fit Cropped Straight Leg Jeans"
"6","","","","","$4.88","-20%","1.2k+ sold recently","SHEIN Tween Girl Funny Boba Milk Tea & Cat Pattern Round Neck Short Sleeve T-Shirt"
"","","","","","$4.30","-50%","400+ sold recently","SHEIN Tween Girl Casual Round Neck Drop Shoulder T-Shirt With Bear And Letter Pattern"
"","","","","","$8.82","-10%","100+ sold recently","Young Girl Letter Print Round Neck Short Sleeve T-Shirt And Long Pants Sports Set"
"5","","","","","$5.70","-40%","1.6k+ sold recently","2pcs Young Boy Casual Patchwork Letter Print Comfortable Crewneck Short Sleeve T-Shirt And Shorts Set For Summer"
"5","","","","","$10.60","-15%","2.6k+ sold recently","Tween Girl Striped Print Shirt & Shorts & Cami Top"
"","","","","","$7.20","-14%","2.5k+ sold recently","SHEIN Tween Girl Letter Graphic Tie Dye Drop Shoulder Tee"
"5","","","","","$5.10","-12%","400+ sold recently","SHEIN Teen Girls Solid Ruched Cami Top & Scrunchie"
"","","","","","$6.50","-16%","2.2k+ sold recently","SHEIN Young Girls' Denim-Look Fabric Cute Unicorn Printed Cropped Jacket"
"","","","","","$6.40","-14%","700+ sold recently","Young Girl Solid Color Rib-Knit Ruffle Armhole T-Shirt And Tie-Waist Shorts Set For Summer"
"","","","","","$4.12","-14%","1000+ sold recently","Tween Girl Casual Simple Short Sleeve T-Shirt With Letter Pattern, Suitable For Summer"
"","","","","","$11.40","-14%","30+ sold recently","Tween Girl 6pcs Sports Multicolored Basic Crop Tops With Strap"
"7","","","","","$10.00","-13%","400+ sold recently","Tween Girl Casual Solid Color Ribbed Round Neck Top, Summer"
"6","","","","","$12.54","-18%","1.9k+ sold recently","Tween Boy Casual Basketball Themed Print Short Sleeve Top And Number Print Shorts Knitted Two-Piece Set"
"8","","","#1 Best Sellers","in Tween Girls Leggings","$3.55","-15%","","SHEIN Tween Girl Spring/Summer Casual High Waist Solid Color Ribbed Knit Cycling Shorts Leggings"
"6","","","","","$4.80","-16%","1.8k+ sold recently","SHEIN Young Girl Casual And Vacation Butterfly Element Printed Jumpsuit With One-Shoulder Strap, Summer"
"6","","","","","$5.00","-9%","3.6k+ sold recently","Young Girl Summer New Arrival Fashionable Dress With Ruffle Cuffs And Pocket Design, Featuring Floral Print And Striped Patchwork Details"
"4","","","","","$11.88","-8%","2.2k+ sold recently","Tween Girls' Denim Mini Skirt"
"","","","","","$9.90","-7%","700+ sold recently","Tween Girl Two Piece Set Of Cute Bubble Pleated Cherry Print Pajamas, Comfortable Fabric And Lapel Design, Perfect For Pajama Parties And Relaxing Nights"
"4","","","#7 Best Sellers","in Tween Boys Clothing","$12.90","-15%","","Tween Boys' Loose Fit Casual Round Neck Pattern Short Sleeve T-Shirt & Shorts Set"
"4","","","","","$10.20","-6%","2.2k+ sold recently","Tween Girl Two Tone Wrap Cross Bikini Swimsuit & Butterfly Print Beach Skirt"
"","","","","","$16.20","-14%","400+ sold recently","SHEIN Tween Girl Cool Street Spring And Summer Knit Pure Color Round Neck Sleeveless Vest With Straight Shorts Three-Piece Set"
"4","","","#4 Best Sellers","in Tween Boys T-Shirts","$20.58","-16%","","SHEIN Tween Boy 5pcs Loose Fit Casual Round Neck Seagull Print Short Sleeve T-Shirts"
"","","","#8 Best Sellers","in Kids Stuffed Animals & Toy Figures","$1.31","-18%","","1pc Blue Baby Bathing Toy For Boys And Girls, Turtle Shaped, Suitable For Children's Bathing, Swimming And Water Playing"
"4","","","","","$11.50","-14%","900+ sold recently","Tween Boys' Holiday Style Loose Fit Round Neck Short Sleeve Knit Top And Woven Shorts Set With All-Over Letter Print"
"8","","","","","$9.60","-15%","2.0k+ sold recently","SHEIN Young Girl Rainbow Cherry Blossom Colorblock Trimmed Cami Jumpsuit, Summer, 2pcs"
"","","","","","$19.31","-8%","800+ sold recently","SHEIN 3pcs/Set Tween Girl'S Daily Casual Knit Round Neck Short-Sleeved T-Shirt With Slogan Print And Shorts And Long Pants For Home"
"5","","","","","$5.50","-11%","900+ sold recently","SHEIN Tween Girl Solid Color Round Neck Long Sleeve T-Shirt"
"5","","","#10 Best Sellers","in Kids Waist Bags","$3.40","-8%","","1pc Girl's Cute One Shoulder Bag With 24 Letters Chest Pack Hanging Crossbody Bag, Ideal For Daily Use, Outdoor, Travel, Hiking, Easy To Carry, Ideal Gifts"
"11","","","","","$11.59","-18%","4.8k+ sold recently","SHEIN Tween Boy Basketball Pattern Tee & Letter Patched Detail Shorts"
"4","","","","","$11.20","-13%","1.0k+ sold recently","Girls' Cute And Stylish Sparkly Slip-On Flat Sandals, Comfortable And Lightweight Slippers, Suitable For Parties, Outdoor Activities And Beach. Random Pattern Outsole Design."
"","","","#3 Best Sellers","in Kids Sneakers","$16.20","-19%","","Children's Simple But Comfortable Waterproof Sports Shoes"
"","","","#9 Best Sellers","in Tween Girls Blouses","$6.50","-16%","","SHEIN Tween Girl Loose Casual Turn-Down Collar Ruffle Hem Short Sleeve Shirt With Cute Pattern"
"4","","","","","$3.25","-54%","500+ sold recently","SHEIN Tween Boy Letter Graphic Colorblock Tee"
"7","","","","","$10.00","-13%","2.5k+ sold recently","SHEIN Tween Girls' Green/Yellow/Blue/Purple 4-Color Solid Color Vest Set"
"4","","","","","$11.59","-18%","5.3k+ sold recently","SHEIN Tween Boy Slogan & Palm Tree Print Tee & Shorts"
"4","","","","","$12.80","-15%","1.6k+ sold recently","SHEIN Tween Girl Drop Shoulder Blouse & Cami Top & Shorts"
"","","","","","$11.30","-14%","300+ sold recently","Tween Girl 2pcs/Set Iridescent Coated Fabric Sleeveless Crop Top And Shorts Set, Summer"
"","","","","","$10.30","-7%","1.3k+ sold recently","SHEIN Tween Girl Block Striped Halter Neck Dress"
"4","","","","","$10.40","-12%","2.0k+ sold recently","SHEIN Teen Girl Summer Trendy Casual Design Print T-Shirt With Pleated Skirt Set, Perfect For Daily Wear And Sister Gatherings"
"","","","","","$12.90","-15%","2.2k+ sold recently","SHEIN Tween Girls' Spring Summer Boho 2 Pieces Solid Short Sleeve T Shirt & White Distressed Ripped Raw Hem Denim Jeans Shorts Set,Summer Girls Clothes Outfits"
"5","","","","","$8.40","-13%","1.4k+ sold recently","SHEIN Tween Girl Slogan Graphic Drop Shoulder Tee & Biker Shorts"
"5","","","","","$5.60","-13%","1.0k+ sold recently","SHEIN Tween Boy 1pc Funny And Interesting Printed Basic Round Neck Short Sleeve T-Shirt, Youth"
"","","","","","$7.60","-14%","100+ sold recently","Tween Girl Tie-Dye Beach Vacation Vibes, Casual Simple Short Sleeve Shirt And Shorts Set Ideal For Summer"
"4","","","","","$2.85","-34%","600+ sold recently","Young Girl Colorful Design Slogan & Cartoon Unicorn Print Short Sleeve T-Shirt"
"","","","","","$2.60","-7%","3.6k+ sold recently","3pcs Cute Colorful Flower & Heart Hairbands For Girls Of Different Ages"
"","","","","","$4.51","-16%","1.0k+ sold recently","TEENAGE MUTANT NINJA TURTLES X SHEIN Young Boy Casual Cartoon Letter Print Round Neck Short Sleeve T-Shirt, Summer"
"","","","","","$8.50","-14%","1.0k+ sold recently","SHEIN Tween Girl Tropical Print Cami Top & Shorts & Tee"
"11","","","","","$3.27","-9%","500+ sold recently","SHEIN Teen Girl Solid Color Ribbed Camisole, Suitable For Summer"
"6","","","","","$8.93","-17%","1.5k+ sold recently","Tween Girl Solid Color Knitted Short Sleeve Round Neck Top And Loose Shorts Casual Two-Piece Outfit"
"","","","#3 Best Sellers","in Teen Girls Tops","$7.50","-11%","","Teen Girl Casual Minimalist Flower Pattern Knitted Oversized T-Shirt Suitable For Summer"
"","","","","","$10.70","-13%","800+ sold recently","SHEIN Teen Girl Off-Shoulder Doll Collar High-Waisted Floral Orange Tone Loose Shorts Set For Leisure And Vacation"
"","","","","","$6.05","-16%","100+ sold recently","Young Girl Beautiful Intelligent Pattern Short Sleeve T-Shirt And Floral Printed Shorts Outfits"
"","","","","","$11.30","-7%","1.2k+ sold recently","Tween Girl Tropical Print Ruffle Hem Bikini Swimsuit With Beach Skirt"
"","","","#1 Best Sellers","in Kids Jewelry Sets","$1.90","-10%","","4pcs/set Girls' Lovely Mermaid Pendant Beaded Bracelet & Necklace Set For Daily Wear, All Seasons, Random Color"
"","","","#6 Best Sellers","in Kids Hair Accessories","$2.91","-12%","","266pcs Girls Multicolored Hair Ties Set, Beautiful Hair Accessories Bowknot Hairbands, Elastic Rubber Bands Collection For Ponytail Hairstyling"
"","","","","","$10.99","-15%","3.1k+ sold recently","SHEIN Tween Boys' Casual Plant Patterned Short Sleeve Button-Up Shirt & Solid Color Shorts Woven 2pcs/Set"
"4","","","","","$6.70","-7%","300+ sold recently","Young Girls' 2pcs/Set Double-Layered Ruffle Edge Camisole Top & Wide Leg Pants Summer Outfits"
"","","","","","$4.24","-23%","500+ sold recently","Young Girl Summer Holiday Beach Playtime Purple Small Crinkled Blossom Pattern Sleeveless Loose Fit Mid-Length A-Line Strap Dress, Summer"
"","","","","","$6.70","-14%","100+ sold recently","Young Boy Night-Glow Shark Print Knit Short Sleeve Tight-Fit Two-Piece Pajama Set"
"","","","#2 Best Sellers","in Young Girls Underwear","$16.70","-16%","","10pcs Young Girl Underwear Set Printed With Letter & Unicorn Pattern"
"","","","","","$3.80","-10%","300+ sold recently","Young Boy Cartoon & Letter Graphic Tee For Summer"
"","","","","","$7.90","-13%","800+ sold recently","SHEIN Tween Girl Casual Simple Cartoon Letter Print Short Sleeve T-Shirt And Shorts 2pcs Set Suitable For Summer"
"","","","","","$7.90","-8%","1.2k+ sold recently","Young Boy Coconut Tree Printed Short Sleeve T-Shirt And Solid Color Elastic Waist Shorts, Summer"
"","","","","","$10.60","-14%","200+ sold recently","SHEIN Tween Girl Knit Solid Color Off Shoulder Top With Pleated Casual Skirt"
"","","","","","$7.10","-14%","2.2k+ sold recently","Young Girl Color Block Elegant College Style Simple Polo Collar Regular Sleeve Dress For Summer"
"9","","","","","$9.22","-17%","3.8k+ sold recently","SHEIN Tween Boy Letter Patched Detail Hooded Tank Top & Drawstring Waist Shorts"
"8","","","","","$2.80","-10%","10k+ sold recently","28pcs Girl's Pink Flower, Fruit, Rainbow & Princess Design Hair Clip, Barrette & Headband Set"
"","","","","","$6.05","-32%","600+ sold recently","SHEIN Tween Girl Chinese Dragon Graphic Flare Leg Pants"
"4","","","","","$7.60","-14%","1.8k+ sold recently","SHEIN Young Girls' Cool Black Street Style Cute Swag Camo Leggings And Sports Suit"
"","","","","","$11.30","-7%","1.7k+ sold recently","Tween Girl Tropical Print Ruffle Trim Bikini Swimsuit With Cover Up Pants"
"","","","","","$15.30","-7%","400+ sold recently","SHEIN Tween Girl Cute Sweet Short Sleeve And Long Pants Knit Flame Retardant Pajamas Set"
"","","","","","$10.10","-14%","100+ sold recently","SHEIN Genkimix Kids BOY Casual Sporty College Street Style Mesh Patchwork Shorts, 4pcs/Set Gray+Navy Blue+Sky Blue+Black Sports Shorts Suitable For Everyday Wear, Travel, Exercise, Spring And Summer Seasons"
"4","","","","","$5.70","-14%","1.6k+ sold recently","SHEIN Young Girl's American Vintage Style Love Heart Printed Tie Dyed Knitted Short Sleeve T-Shirt"
"","","","","","$8.93","-20%","1.5k+ sold recently","SHEIN Young Boy Color-Block Trim Short Sleeve T-Shirt And Shorts Set For Summer"
"","","","","","$6.00","-8%","1.3k+ sold recently","2pcs/Set Young Girls' 4th Of July Outfits Casual Star & Heart Print Cami Top And Shorts Set For Festivals, Beach & Holiday In Spring/Summer"
"6","","","#6 Best Sellers","in Tween Girls Tank Tops & Camis","$9.00","-14%","","Tween Girl Set Of 3 Knitting Solid Color Sleeveless Tops For Daily Wear & Leisure In Spring And Summer"
"","","","#3 Best Sellers","in Kids Toy Kitchen Products","$14.17","-69%","","1set Children's Girls Simulated Dishwashing Sink With Running Water Loop, Kitchen Sink For Pretend Play, Suitable For Daily Use"
"","","","#2 Best Sellers","in Young Girls Sweatshirts","$6.30","-14%","","Young Girl Letter Graphic Drop Shoulder Sweatshirt"
"","","","","","$5.35","-16%","500+ sold recently","Tween Girl Pom-Pom Decor Cover Up"
"9","","","","","$8.50","-8%","200+ sold recently","Young Girl Summer Cool Striped Camisole Top And Long Pants Set"
"","","","","","$8.97","-25%","1.1k+ sold recently","SHEIN Young Girl Casual Street Style Sweatshirt And Waistband Denim Effect Pants With Belt, 2pcs/Set"
"","","","#9 Best Sellers","in Teen Boys T-Shirts","$6.20","-13%","","Teen Boy Casual Fashionable Summer Coconut Tree Print T-Shirt"
"","","","","","$7.70","-13%","50+ sold recently","Girls' (Big) Casual T-Shirt And Tight Shorts 2pcs/Set"
"","","","","","$11.80","-7%","100+ sold recently","Tween Girl Fashionable Casual Color Block Denim Shorts"
"9","","","","","$15.70","-13%","3.4k+ sold recently","SHEIN Teen Girls' Knit Ribbed Pleated T-Shirt And Bell Bottom Pants Casual Two-Piece Outfit"
"7","","","","","$3.00","-14%","500+ sold recently","SHEIN Tween Girl Slim Elegant Solid Color Sleeveless Round Neck Crop Top"
"","","","#7 Best Sellers","in Doll Accessories","$25.99","-30%","","23 Pcs 18 inch Doll Clothes and Accessories - Suitcase Luggage , Pillow, Sunglasses, Camera, Passport, Mobile Phone , Computer Doll Travel Gear Play Set Fit 18 inch Girl Doll (No Doll)"
"8","","","","","$8.00","-7%","1.5k+ sold recently","Tween Girls' Detachable Padded Asymmetrical Neck Separates Swimsuit Set, Safe"
"","","","#10 Best Sellers","in Kids Flat Sandals","$10.90","-13%","","Kids Comfortable Lightweight Flat Sandals With Flower Detailing For Girls Fashionable Trendy Shoes"
"","","","","","$3.25","-24%","3.8k+ sold recently","Young Boy Casual Slogan Print Round Neck Short Sleeve T-Shirt"
"9","","","#5 Best Sellers","in Young Boys Jackets","$10.60","-15%","","SHEIN Young Boy Casual Colorblock Long Sleeve Jacket With Spider Printed Pattern"
"","","","","","$7.70","-7%","400+ sold recently","Young Girl 2pcs Cute Printed Outfit Set, Summer"
"","","","","","$21.90","-8%","2.2k+ sold recently","Tween Boy Ripped Jeans"
"9","","","","","$8.90","-7%","2.2k+ sold recently","SHEIN Tween Girl Ruffle Trim Wrap Belted Dress"
"9","","","","","$10.15","-25%","1.0k+ sold recently","SHEIN Young Girl 3pcs Striped Ruffle Trim Tee"
"","","","#2 Best Sellers","in Young Girls Cover Ups","$7.87","-16%","","Young Girl Cartoon Graphic Hooded Cover Up"
"6","","","","","$10.70","-14%","700+ sold recently","Tween Girl Casual Knitted Round Neck Short-Sleeved T-Shirt With Letter Print And Color Block Shorts Set, Daily Wear"
"6","","","","","$6.30","-13%","800+ sold recently","SHEIN Tween Girl Tie Dye Cami Top & Shorts"
"","","","","","$11.90","-13%","1.0k+ sold recently","SHEIN Teen Boys' Casual Positive Letter Print T-Shirt And Color Block Shorts Set"
"5","","","","","$5.60","-13%","900+ sold recently","SHEIN Tween Girl Summer Casual Slogan Printed Short Sleeve T-Shirt"
"","","","","","$10.00","-7%","3.2k+ sold recently","SHEIN Tween Girl Allover Print Belted Maxi Cami Dress"
"","","","","","$5.80","-58%","80+ sold recently","SHEIN 3pcs Teen Girl Black/Pink/White Cropped T-Shirt With Ruched & Frilled Design"
"","","","","","$15.90","-14%","800+ sold recently","SHEIN Tween Girl 2pcs/Set Sporty Knitted Solid Color Stand Collar Long Sleeve Top And Solid Color Pants Outfits"
"","","","#4 Best Sellers","in Young Boys T-Shirts","$3.70","-16%","","Spider & Young Boy Casual Spider Pattern Short Sleeve Round Neck T-Shirt Suit For Summer"
"","","","","","$3.48","-19%","2.4k+ sold recently","SHEIN Young Girl Knitted Floral Print Cami Dress"
"","","","","","$8.30","-13%","600+ sold recently","Fashion Children Sandals Elegant Girls"" Princess Shoes Spring And Summer Heart Jelly Shoes Vacation Flat Beach Shoes"
"","","","","","$6.30","-9%","700+ sold recently","2pcs Young Girl Casual 3D Deer Printed Short Sleeve T-Shirt And Shorts Set For Summer"
"","","","","","$9.20","-12%","300+ sold recently","Tween Girls' Casual Simple OK Bear Printed Short Sleeve T-Shirt And Shorts Set, Suitable For Summer"
"","","","","","$3.50","-24%","700+ sold recently","SHEIN Young Girl Cute Short Sleeve T-Shirt With Graphic Text"
"","","","","","$10.60","-8%","2.3k+ sold recently","Young Girls' Cartoon Printed Short Sleeve T-Shirt And Denim Shorts Set For Summer"
"5","","","#10 Best Sellers","in Tween Girls T-Shirts","$6.30","-7%","","Tween Girls' Casual Letter Print Round Neck Short-Sleeve T-Shirt, Summer"
"","","","","","$12.20","-13%","200+ sold recently","SHEIN Teen Girl Casual Fit Pink Letter Printed T-Shirt & Cycling Shorts, Sports Streetwear Casual 2pcs/Set"
"","","","","","$6.10","-9%","10+ sold recently","Girls' Solid Color Bell Bottom Pants Sleeveless Vest Ins Style Outfit"
"","","","","","$6.90","-8%","3.0k+ sold recently","Young Girl 2pcs/Set Casual Style Lighweight Knitted T-Shirt And Flared Pants, Featuring 3D Printed Giraffe Pattern, Spring Summer"
"","","","","","$8.50","-12%","300+ sold recently","SHEIN Tween Girl Letter Graphic Thermal Lined Sweatshirt"
"","","","","","$7.51","-17%","2.7k+ sold recently","SHEIN Palm Tree And Sunset Vintage Western Scenery Pattern, 2pcs/Set Tween Girls Casual Summer Short Sleeve T-Shirt And Shorts Outfits"
"","","","","","$7.50","-5%","100+ sold recently","Teen Girl Beach Letter Print Fashionable Casual And Comfortable Casual Top, Summer"
"","","","","","$5.80","-15%","1.4k+ sold recently","Young Girl Summer Cool Cami Top & Floral Printed Shorts 2pcs Holiday Outfits"
"","","","","","$3.80","-14%","200+ sold recently","Young Girl Casual Colorful Letter And Plaid Pattern Printed Short Sleeve T-Shirt"
"","","","","","$8.70","-13%","10+ sold recently","Teen Girls' Casual Colorful Bowknot & Heart-Shaped Pattern Short Sleeve T-Shirt Plus Legging Set"
"","","","","","$1.86","-11%","80+ sold recently","2pcs Children's Colorful American Flag Pendant Beaded Necklace And Bracelet Set, Suitable For Boys And Girls Daily Wear, Festival Party"
"","","","","","$6.30","-14%","5.2k+ sold recently","SHEIN Young Girl Striped Asymmetrical Neck Top & Paperbag Waist Belted Shorts"
"","","","#1 Best Sellers","in Tween Girls Tankinis","$10.40","-6%","","Tween Girl New Fashion Printed Bikini Set With Lace Trim"
"4","","","","","$11.40","-13%","500+ sold recently","SHEIN Tween Girl Knit Face Print Loose Fit Casual Sweatshirt With Round Neck"
"10","","","","","$4.86","-24%","600+ sold recently","SHEIN Young Girls' (Little) Fashionable One Shoulder Ruffle Overlay Jumpsuit For Summer"
"","","","","","$13.60","-13%","900+ sold recently","Teen Girl Loose Crew Neck Sweater"
"","","","#6 Best Sellers","in Teen Girls Underwear","$12.60","-6%","","Teen Girl 8 Pieces Underwear Comfortable Panties Briefs"
"","","","","","$11.60","-15%","3.3k+ sold recently","SHEIN Young Girl Summer Cartoon Girl Printed Round Neck Short Sleeve T-Shirt And Ripped Shorts Casual Twopiece Set"
"4","","","","","$13.50","-15%","3.8k+ sold recently","SHEIN Young Boy Contrast Trim Polo Shirt & Knot Waist Shorts"
"8","","","","","$12.40","-14%","4.4k+ sold recently","Summer 2pcs Young Girl Round Neck Short Sleeve Strawberry & Letter Print T-Shirt With Embroidery Design, Elastic Waistband Denim Shorts With Pockets And Belt"
"","","","","","$12.70","-13%","900+ sold recently","Teen Girl Holiday Leisure Solid Color Sleeveless Ruffled Hem Shorts Two-Piece Set"
"","","","","","$10.20","-6%","1.3k+ sold recently","SHEIN Teen Girl Lemon Print Bikini Swimsuit With Beach Skirt"
"5","","","","","$2.60","-10%","3.9k+ sold recently","2pcs Girls Bow Decor Hair Clip For Daily Life"
"","","","","","$5.12","-20%","200+ sold recently","Tween Boy Casual Printed White Round Neck Pullover Short Sleeve T-Shirt For Summer"
"4","","","","","$9.20","-14%","400+ sold recently","Tween Girls' Flower Printed Short Sleeve T-Shirt And Skirt Set"
"4","","","#6 Best Sellers","in Young Girls Jeans","$12.00","-14%","","SHEIN Streecool Kids Young Girl New Casual Fashionable Vintage Sense Distressed Straight Leg Jeans With Washed Effect"
"","","","#10 Best Sellers","in Tween Girls Pants","$11.20","-13%","","SHEIN Tween Girl Button Detail Knot Front Wide Leg Pants"
"9","","","","","$10.79","-15%","4.4k+ sold recently","SHEIN Tween Girls' Knit Letter Printed T-Shirt + Woven Utility Shorts Sports Casual Two Piece Set, Summer"
"","","","","","$1.50","-32%","500+ sold recently","2pcs Girls' Cute Neutral Tone Flower Hair Claw, Suitable For Daily Use"
"","","","#2 Best Sellers","in Teen Girls Leggings","$9.90","-12%","","SHEIN Teen Girl Knitted Overlap Waistband, Mesh Patchwork, Multi-Pocket Base Layer Leggings Two Piece Set"
"","","","#3 Best Sellers","in Tween Girls Skirts","$9.10","-7%","","SHEIN Tween Girl Solid Pleated Skirt"
"","","","","","$5.85","-43%","1.9k+ sold recently","SHEIN Tween Girl Letter Graphic Tank Top & Striped Flare Leg Pants"
"","","","#3 Best Sellers","in Teen Girls Pants","$5.18","-44%","","SHEIN Teen Girls Star Print Flare Leg Pants"
"7","","","","","$9.50","-17%","600+ sold recently","Tween Girl Solid Color Simple Daily Sleeveless Tank Top"
"","","","","","$14.90","-14%","3.0k+ sold recently","SHEIN Tween Girl Casual Comfortable Simple Car & Letter Print Top And Denim Shorts Set"
