"color-count","goods-title-link--jump","goods-title-link--jump href","rank-title","rank-sub","price","discount","selling_proposition","goods-title-link"
"9","SHEIN Teen Girl Knitted Ribbed Pleated T-Shirt And Accordion Pocket Casual Long Pants Set","https://us.shein.com/SHEIN-Teen-Girl-Knitted-Ribbed-Pleated-T-Shirt-And-Accordion-Pocket-Casual-Long-Pants-Set-p-33489107.html?src_identifier=fc%3DKids%60sc%3DKids%60tc%3D0%60oc%3D0%60ps%3Dtab05navbar05%60jc%3DitemPicking_017185550&src_module=topcat&src_tab_page_id=page_select_class1718911041796&mallCode=1&pageListType=2","#5 Best Sellers","in Teen Girls Sets","$15.80","-13%","",""
"14","SHEIN Tween Girl Solid Tank Top & Knot Waist Shorts","https://us.shein.com/SHEIN-Tween-Girl-Solid-Tank-Top-Knot-Waist-Shorts-p-14246189.html?src_identifier=fc%3DKids%60sc%3DKids%60tc%3D0%60oc%3D0%60ps%3Dtab05navbar05%60jc%3DitemPicking_017185550&src_module=topcat&src_tab_page_id=page_select_class1718911041796&mallCode=1&pageListType=2","","","$7.40","-13%","8.2k+ sold recently",""
"5","SHEIN Young Girl Butterfly & Letter Graphic Tee & Shorts","https://us.shein.com/SHEIN-Young-Girl-Butterfly-Letter-Graphic-Tee-Shorts-p-18401531.html?src_identifier=fc%3DKids%60sc%3DKids%60tc%3D0%60oc%3D0%60ps%3Dtab05navbar05%60jc%3DitemPicking_017185550&src_module=topcat&src_tab_page_id=page_select_class1718911041796&mallCode=1&pageListType=2","","","$4.54","-45%","3.6k+ sold recently",""
"","SHEIN Teen Girl White Knitted Pintuck Fitted Bandeau Cami Top","https://us.shein.com/SHEIN-Teen-Girl-White-Knitted-Pintuck-Fitted-Bandeau-Cami-Top-p-34790698.html?src_identifier=fc%3DKids%60sc%3DKids%60tc%3D0%60oc%3D0%60ps%3Dtab05navbar05%60jc%3DitemPicking_017185550&src_module=topcat&src_tab_page_id=page_select_class1718911041796&mallCode=1&pageListType=2","#5 Best Sellers","in Teen Girls Tank Tops & Camis","$4.70","-11%","",""
"7","Young Girl Casual Loose Fit Simple Camouflage Print Multi-Pocket Denim Skirt","https://us.shein.com/Young-Girl-Casual-Loose-Fit-Simple-Camouflage-Print-Multi-Pocket-Denim-Skirt-p-27084269.html?src_identifier=fc%3DKids%60sc%3DKids%60tc%3D0%60oc%3D0%60ps%3Dtab05navbar05%60jc%3DitemPicking_017185550&src_module=topcat&src_tab_page_id=page_select_class1718911041796&mallCode=1&pageListType=2","#8 Best Sellers","in Young Girls Denim","$9.70","-14%","",""
"7","SHEIN Young Boy Letter Graphic Striped Trim Baseball Collar Shirt & Shorts Without Tee","https://us.shein.com/SHEIN-Young-Boy-Letter-Graphic-Striped-Trim-Baseball-Collar-Shirt-Shorts-Without-Tee-p-24387660.html?src_identifier=fc%3DKids%60sc%3DKids%60tc%3D0%60oc%3D0%60ps%3Dtab05navbar05%60jc%3DitemPicking_017185550&src_module=topcat&src_tab_page_id=page_select_class1718911041796&mallCode=1&pageListType=2","","","$11.10","-15%","7.6k+ sold recently",""
"10","Young Girl Casual Basic Street Fashion Romper , Pack Of 3","https://us.shein.com/Young-Girl-Casual-Basic-Street-Fashion-Romper-Pack-Of-3-p-30509243.html?src_identifier=fc%3DKids%60sc%3DKids%60tc%3D0%60oc%3D0%60ps%3Dtab05navbar05%60jc%3DitemPicking_017185550&src_module=topcat&src_tab_page_id=page_select_class1718911041796&mallCode=1&pageListType=2","#6 Best Sellers","in Young Girls Bodysuits & Jumpsuits","$11.90","-15%","",""
"","Baby Bath Toy Yellow Duck Shower Spray Toy For Boys, Girls, Children's Pool Swimming Water Play","https://us.shein.com/Baby-Bath-Toy-Yellow-Duck-Shower-Spray-Toy-For-Boys-Girls-Children-s-Pool-Swimming-Water-Play-p-28904903.html?src_identifier=fc%3DKids%60sc%3DKids%60tc%3D0%60oc%3D0%60ps%3Dtab05navbar05%60jc%3DitemPicking_017185550&src_module=topcat&src_tab_page_id=page_select_class1718911041796&mallCode=1&pageListType=2","#3 Best Sellers","in Kids Play Animal Figures","$0.64","-62%","",""
"4","SHEIN Tween Girls' Woven Solid Color Camisole Top & Wide Leg Pants Set For Casual Wear","https://us.shein.com/SHEIN-Tween-Girls-Woven-Solid-Color-Camisole-Top-Wide-Leg-Pants-Set-For-Casual-Wear-p-28325902.html?src_identifier=fc%3DKids%60sc%3DKids%60tc%3D0%60oc%3D0%60ps%3Dtab05navbar05%60jc%3DitemPicking_017185550&src_module=topcat&src_tab_page_id=page_select_class1718911041796&mallCode=1&pageListType=2","","","$8.72","-15%","1.5k+ sold recently",""
"","SHEIN Tween Boy Paisley Print Drawstring Waist Shorts","https://us.shein.com/SHEIN-Tween-Boy-Paisley-Print-Drawstring-Waist-Shorts-p-10245158.html?src_identifier=fc%3DKids%60sc%3DKids%60tc%3D0%60oc%3D0%60ps%3Dtab05navbar05%60jc%3DitemPicking_017185550&src_module=topcat&src_tab_page_id=page_select_class1718911041796&mallCode=1&pageListType=2","#2 Best Sellers","in Tween Boys Shorts","$7.33","-15%","",""
"","SHEIN Young Girls' Casual 2pcs Set, Round Neck Cartoon Printed Short Sleeve Top And Elastic Waist Shorts, Summer","https://us.shein.com/SHEIN-Young-Girls-Casual-2pcs-Set-Round-Neck-Cartoon-Printed-Short-Sleeve-Top-And-Elastic-Waist-Shorts-Summer-p-36103054.html?src_identifier=fc%3DKids%60sc%3DKids%60tc%3D0%60oc%3D0%60ps%3Dtab05navbar05%60jc%3DitemPicking_017185550&src_module=topcat&src_tab_page_id=page_select_class1718911041796&mallCode=1&pageListType=2","","","$7.80","-14%","800+ sold recently",""
"6","1pc English Initial Letter Charm Golden Twist Necklace For Boys Girls Name Customized Alphabet Choker For Children Birthday Gift","https://us.shein.com/1pc-English-Initial-Letter-Charm-Golden-Twist-Necklace-For-Boys-Girls-Name-Customized-Alphabet-Choker-For-Children-Birthday-Gift-p-30890941.html?src_identifier=fc%3DKids%60sc%3DKids%60tc%3D0%60oc%3D0%60ps%3Dtab05navbar05%60jc%3DitemPicking_017185550&src_module=topcat&src_tab_page_id=page_select_class1718911041796&mallCode=1&pageListType=2","#1 Best Sellers","in Kids Jewelry & Watches","$2.20","-8%","",""
"","SHEIN Streecool Kids Tween Girl Raw Hem Flare Leg Jeans","https://us.shein.com/SHEIN-Streecool-Kids-Tween-Girl-Raw-Hem-Flare-Leg-Jeans-p-24485247.html?src_identifier=fc%3DKids%60sc%3DKids%60tc%3D0%60oc%3D0%60ps%3Dtab05navbar05%60jc%3DitemPicking_017185550&src_module=topcat&src_tab_page_id=page_select_class1718911041796&mallCode=1&pageListType=2","","","$10.06","-37%","1.5k+ sold recently",""
"7","Tween Girl Casual Slogan Print Round Neck Pullover Short Sleeve T-Shirt For Summer","https://us.shein.com/Tween-Girl-Casual-Slogan-Print-Round-Neck-Pullover-Short-Sleeve-T-Shirt-For-Summer-p-31854599.html?src_identifier=fc%3DKids%60sc%3DKids%60tc%3D0%60oc%3D0%60ps%3Dtab05navbar05%60jc%3DitemPicking_017185550&src_module=topcat&src_tab_page_id=page_select_class1718911041796&mallCode=1&pageListType=2","","","$4.68","-28%","5.4k+ sold recently",""
"","Tween Girl Vacation Striped Sleeveless Vest, Pants And Sweater Set With Halter Neck","https://us.shein.com/Tween-Girl-Vacation-Striped-Sleeveless-Vest-Pants-And-Sweater-Set-With-Halter-Neck-p-34529790.html?src_identifier=fc%3DKids%60sc%3DKids%60tc%3D0%60oc%3D0%60ps%3Dtab05navbar05%60jc%3DitemPicking_017185550&src_module=topcat&src_tab_page_id=page_select_class1718911041796&mallCode=1&pageListType=2","#7 Best Sellers","in Tween Girls Cover Ups","$10.77","-24%","",""
"4","1pc Kids Popular Cubic Zirconia Initial Letter & Crown Pendant Twisted Rope Necklace For Boys Girls For Christmas Party Banquet For Children Birthday Gift","https://us.shein.com/1pc-Kids-Popular-Cubic-Zirconia-Initial-Letter-Crown-Pendant-Twisted-Rope-Necklace-For-Boys-Girls-For-Christmas-Party-Banquet-For-Children-Birthday-Gift-p-26843979.html?src_identifier=fc%3DKids%60sc%3DKids%60tc%3D0%60oc%3D0%60ps%3Dtab05navbar05%60jc%3DitemPicking_017185550&src_module=topcat&src_tab_page_id=page_select_class1718911041796&mallCode=1&pageListType=2","#4 Best Sellers","in Teen Necklaces","$2.50","-7%","",""
"","1pair Girls' Knitted Ribbed Leg Warmers, Perfect For Party Accessory","https://us.shein.com/1pair-Girls-Knitted-Ribbed-Leg-Warmers-Perfect-For-Party-Accessory-p-20702709.html?src_identifier=fc%3DKids%60sc%3DKids%60tc%3D0%60oc%3D0%60ps%3Dtab05navbar05%60jc%3DitemPicking_017185550&src_module=topcat&src_tab_page_id=page_select_class1718911041796&mallCode=1&pageListType=2","","","$2.24","-20%","200+ sold recently",""
"","1 pc Boys girls middle and big kids square acrylic anti-blue light classic rice nail fashion flat lens for daily use","https://us.shein.com/1-pc-Boys-girls-middle-and-big-kids-square-acrylic-anti-blue-light-classic-rice-nail-fashion-flat-lens-for-daily-use-p-23722386.html?src_identifier=fc%3DKids%60sc%3DKids%60tc%3D0%60oc%3D0%60ps%3Dtab05navbar05%60jc%3DitemPicking_017185550&src_module=topcat&src_tab_page_id=page_select_class1718911041796&mallCode=1&pageListType=2","#3 Best Sellers","in Kids Eyeglasses","$2.20","-8%","",""
"6","SHEIN Young Girl Eyeglasses & Letter Print T-Shirt With Flower Print Shorts Set","https://us.shein.com/SHEIN-Young-Girl-Eyeglasses-Letter-Print-T-Shirt-With-Flower-Print-Shorts-Set-p-27400638.html?src_identifier=fc%3DKids%60sc%3DKids%60tc%3D0%60oc%3D0%60ps%3Dtab05navbar05%60jc%3DitemPicking_017185550&src_module=topcat&src_tab_page_id=page_select_class1718911041796&mallCode=1&pageListType=2","","","$3.74","-54%","4.2k+ sold recently",""
"4","SHEIN Tween Girl 2pcs/Set Knitted Casual Heart Printed T-Shirt And Shorts","https://us.shein.com/SHEIN-Tween-Girl-2pcs-Set-Knitted-Casual-Heart-Printed-T-Shirt-And-Shorts-p-16273449.html?src_identifier=fc%3DKids%60sc%3DKids%60tc%3D0%60oc%3D0%60ps%3Dtab05navbar05%60jc%3DitemPicking_017185550&src_module=topcat&src_tab_page_id=page_select_class1718911041796&mallCode=1&pageListType=2","","","$6.15","-32%","2.1k+ sold recently",""
"6","Teen Girl Flap Pocket Denim Skirt","https://us.shein.com/Teen-Girl-Flap-Pocket-Denim-Skirt-p-20890864.html?src_identifier=fc%3DKids%60sc%3DKids%60tc%3D0%60oc%3D0%60ps%3Dtab05navbar05%60jc%3DitemPicking_017185550&src_module=topcat&src_tab_page_id=page_select_class1718911041796&mallCode=1&pageListType=2","#1 Best Sellers","in Teen Girls Denim Skirts","$11.90","-6%","",""
"","2pcs/Set Kids' Summer New Pure Color Sleeveless Basketball Pattern Printed Vest Shorts Sports Set For Young Boys","https://us.shein.com/2pcs-Set-Kids-Summer-New-Pure-Color-Sleeveless-Basketball-Pattern-Printed-Vest-Shorts-Sports-Set-For-Young-Boys-p-29362139.html?src_identifier=fc%3DKids%60sc%3DKids%60tc%3D0%60oc%3D0%60ps%3Dtab05navbar05%60jc%3DitemPicking_017185550&src_module=topcat&src_tab_page_id=page_select_class1718911041796&mallCode=1&pageListType=2","","","$3.75","-44%","800+ sold recently",""
"4","30pcs Girls Random Color Butterfly Design Hair Claw For Hair Decoration","https://us.shein.com/30pcs-Girls-Random-Color-Butterfly-Design-Hair-Claw-For-Hair-Decoration-p-17516481.html?src_identifier=fc%3DKids%60sc%3DKids%60tc%3D0%60oc%3D0%60ps%3Dtab05navbar05%60jc%3DitemPicking_017185550&src_module=topcat&src_tab_page_id=page_select_class1718911041796&mallCode=1&pageListType=2","#1 Best Sellers","in Kids Accessories","$1.70","-11%","",""
"","SHEIN Tween Girls' Casual Straight Fit Knee-Length, Soft Washed Denim Shorts","https://us.shein.com/SHEIN-Tween-Girls-Casual-Straight-Fit-Knee-Length-Soft-Washed-Denim-Shorts-p-29513195.html?src_identifier=fc%3DKids%60sc%3DKids%60tc%3D0%60oc%3D0%60ps%3Dtab05navbar05%60jc%3DitemPicking_017185550&src_module=topcat&src_tab_page_id=page_select_class1718911041796&mallCode=1&pageListType=2","#5 Best Sellers","in Tween Girls Denim Shorts","$13.00","-7%","",""
"6","Young Girl 3pcs/Set Fashionable Cute Cartoon Printed Short Sleeve T-Shirt And Leggings","https://us.shein.com/Young-Girl-3pcs-Set-Fashionable-Cute-Cartoon-Printed-Short-Sleeve-T-Shirt-And-Leggings-p-31862244.html?src_identifier=fc%3DKids%60sc%3DKids%60tc%3D0%60oc%3D0%60ps%3Dtab05navbar05%60jc%3DitemPicking_017185550&src_module=topcat&src_tab_page_id=page_select_class1718911041796&mallCode=1&pageListType=2","#1 Best Sellers","in Young Girls Clothing","$17.20","-14%","",""
"5","Tween Girls' Casual Simple Cartoon Graphic Short Sleeve T-Shirt Suitable For Summer","https://us.shein.com/Tween-Girls-Casual-Simple-Cartoon-Graphic-Short-Sleeve-T-Shirt-Suitable-For-Summer-p-28282093.html?src_identifier=fc%3DKids%60sc%3DKids%60tc%3D0%60oc%3D0%60ps%3Dtab05navbar05%60jc%3DitemPicking_017185550&src_module=topcat&src_tab_page_id=page_select_class1718911041796&mallCode=1&pageListType=2","","","$3.25","-32%","2.1k+ sold recently",""
"4","1pc Children's Personality Cool Sunglasses For Boys And Girls, Anti-Uv, Stylish Summer Sunshade Sunglasses","https://us.shein.com/1pc-Children-s-Personality-Cool-Sunglasses-For-Boys-And-Girls-Anti-Uv-Stylish-Summer-Sunshade-Sunglasses-p-30669974.html?src_identifier=fc%3DKids%60sc%3DKids%60tc%3D0%60oc%3D0%60ps%3Dtab05navbar05%60jc%3DitemPicking_017185550&src_module=topcat&src_tab_page_id=page_select_class1718911041796&mallCode=1&pageListType=2","","","$1.17","-44%","300+ sold recently",""
"7","SHEIN Genkimix Kids Tween Girl 6pcs/Set Casual Sport T-Shirt And Sweatpants Outfits, Multicolor","https://us.shein.com/SHEIN-Genkimix-Kids-Tween-Girl-6pcs-Set-Casual-Sport-T-Shirt-And-Sweatpants-Outfits-Multicolor-p-26615280.html?src_identifier=fc%3DKids%60sc%3DKids%60tc%3D0%60oc%3D0%60ps%3Dtab05navbar05%60jc%3DitemPicking_017185550&src_module=topcat&src_tab_page_id=page_select_class1718911041796&mallCode=1&pageListType=2","","","$25.00","-13%","3.1k+ sold recently",""
"","2pcs/Set Girls' Sweet & Elegant Sleeveless Top And Lightweight Trousers, Summer","https://us.shein.com/2pcs-Set-Girls-Sweet-Elegant-Sleeveless-Top-And-Lightweight-Trousers-Summer-p-36052510.html?src_identifier=fc%3DKids%60sc%3DKids%60tc%3D0%60oc%3D0%60ps%3Dtab05navbar05%60jc%3DitemPicking_017185550&src_module=topcat&src_tab_page_id=page_select_class1718911041796&mallCode=1&pageListType=2","","","$9.20","-8%","",""
"6","Tween Girl Knit Solid Color Loose Fit Short Sleeve Top And Shorts, Casual Outfit Set","https://us.shein.com/Tween-Girl-Knit-Solid-Color-Loose-Fit-Short-Sleeve-Top-And-Shorts-Casual-Outfit-Set-p-34341314.html?src_identifier=fc%3DKids%60sc%3DKids%60tc%3D0%60oc%3D0%60ps%3Dtab05navbar05%60jc%3DitemPicking_017185550&src_module=topcat&src_tab_page_id=page_select_class1718911041796&mallCode=1&pageListType=2","#6 Best Sellers","in Tween Girls Sets","$9.30","-13%","",""
"4","Young Girl's Floral Print Halter Top And Multi-Layer Ruffled Hem Skirt Set With Hat","https://us.shein.com/Young-Girl-s-Floral-Print-Halter-Top-And-Multi-Layer-Ruffled-Hem-Skirt-Set-With-Hat-p-29852820.html?src_identifier=fc%3DKids%60sc%3DKids%60tc%3D0%60oc%3D0%60ps%3Dtab05navbar05%60jc%3DitemPicking_017185550&src_module=topcat&src_tab_page_id=page_select_class1718911041796&mallCode=1&pageListType=2","","","$10.60","-15%","2.7k+ sold recently",""
"7","SHEIN Tween Girl Spring/Summer Casual Solid Round Neck Ribbed Tank Top","https://us.shein.com/SHEIN-Tween-Girl-Spring-Summer-Casual-Solid-Round-Neck-Ribbed-Tank-Top-p-33104298.html?src_identifier=fc%3DKids%60sc%3DKids%60tc%3D0%60oc%3D0%60ps%3Dtab05navbar05%60jc%3DitemPicking_017185550&src_module=topcat&src_tab_page_id=page_select_class1718911041796&mallCode=1&pageListType=2","#1 Best Sellers","in Tween Girls Tank Tops & Camis","$9.70","-14%","",""
"","Casual Cartoon Printed Multi-Piece T-Shirt Set For Tween Girls, Suitable For Summer","https://us.shein.com/Casual-Cartoon-Printed-Multi-Piece-T-Shirt-Set-For-Tween-Girls-Suitable-For-Summer-p-36152443.html?src_identifier=fc%3DKids%60sc%3DKids%60tc%3D0%60oc%3D0%60ps%3Dtab05navbar05%60jc%3DitemPicking_017185550&src_module=topcat&src_tab_page_id=page_select_class1718911041796&mallCode=1&pageListType=2","","","$11.80","-13%","600+ sold recently",""
"","Multi-Pack (5pcs) Solid Color Wide-Mesh Knitted Loose Sports Shorts For Tween Boys, One In Each Color","https://us.shein.com/Multi-Pack-5pcs-Solid-Color-Wide-Mesh-Knitted-Loose-Sports-Shorts-For-Tween-Boys-One-In-Each-Color-p-33794860.html?src_identifier=fc%3DKids%60sc%3DKids%60tc%3D0%60oc%3D0%60ps%3Dtab05navbar05%60jc%3DitemPicking_017185550&src_module=topcat&src_tab_page_id=page_select_class1718911041796&mallCode=1&pageListType=2","","","$14.06","-18%","1.9k+ sold recently",""
"4","SHEIN Tween Girl Flower Patchwork Pleated Back Tie Waist Cami Dress, Summer","https://us.shein.com/SHEIN-Tween-Girl-Flower-Patchwork-Pleated-Back-Tie-Waist-Cami-Dress-Summer-p-15588145.html?src_identifier=fc%3DKids%60sc%3DKids%60tc%3D0%60oc%3D0%60ps%3Dtab05navbar05%60jc%3DitemPicking_017185550&src_module=topcat&src_tab_page_id=page_select_class1718911041796&mallCode=1&pageListType=2","#2 Best Sellers","in Tween Girls Dresses","$11.30","-7%","",""
"4","Tween Boy Ripped Washed Jeans","https://us.shein.com/Tween-Boy-Ripped-Washed-Jeans-p-20835800.html?src_identifier=fc%3DKids%60sc%3DKids%60tc%3D0%60oc%3D0%60ps%3Dtab05navbar05%60jc%3DitemPicking_017185550&src_module=topcat&src_tab_page_id=page_select_class1718911041796&mallCode=1&pageListType=2","#5 Best Sellers","in Tween Boys Denim","$12.32","-26%","",""
"12","2 Pcs/Set New Baby Girls Boys Cute Solid Color Bowknot Hairband Round Sunglasses Set Children Sunglasses Kids Hair Accessories","https://us.shein.com/2-Pcs-Set-New-Baby-Girls-Boys-Cute-Solid-Color-Bowknot-Hairband-Round-Sunglasses-Set-Children-Sunglasses-Kids-Hair-Accessories-p-30585402.html?src_identifier=fc%3DKids%60sc%3DKids%60tc%3D0%60oc%3D0%60ps%3Dtab05navbar05%60jc%3DitemPicking_017185550&src_module=topcat&src_tab_page_id=page_select_class1718911041796&mallCode=1&pageListType=2","","","$2.08","-20%","100+ sold recently",""
"","SHEIN Teen Girls Ripped Roll Up Hem Denim Shorts","https://us.shein.com/SHEIN-Teen-Girls-Ripped-Roll-Up-Hem-Denim-Shorts-p-16332538.html?src_identifier=fc%3DKids%60sc%3DKids%60tc%3D0%60oc%3D0%60ps%3Dtab05navbar05%60jc%3DitemPicking_017185550&src_module=topcat&src_tab_page_id=page_select_class1718911041796&mallCode=1&pageListType=2","#1 Best Sellers","in Teen Girls Denim Shorts","$11.80","-6%","",""
"","Young Girl Summer Solid Pink Single-Breasted Short Sleeve Shirt + Shorts Casual Outfit Set","https://us.shein.com/Young-Girl-Summer-Solid-Pink-Single-Breasted-Short-Sleeve-Shirt-Shorts-Casual-Outfit-Set-p-34182448.html?src_identifier=fc%3DKids%60sc%3DKids%60tc%3D0%60oc%3D0%60ps%3Dtab05navbar05%60jc%3DitemPicking_017185550&src_module=topcat&src_tab_page_id=page_select_class1718911041796&mallCode=1&pageListType=2","#3 Best Sellers","in Young Girls Clothing","$7.80","-7%","",""
"4","","","#1 Best Sellers","in Tween Girls Bodysuits & Jumpsuits","$9.90","-7%","","SHEIN Tween Girls' Summer Casual Striped Sleeveless Romper With Round Neckline And Long Sleeves"
"","","","","","$3.90","-50%","70+ sold recently","2pcs Boy's Blue Lightning Print Short Sleeve T-Shirt And Shorts Set - Comfy And Stretchable Outfit For Children"
"5","","","","","$6.20","-7%","3.5k+ sold recently","Young Girl 2-Piece Cute Bubble Texture Short Sleeve Top And Shorts Set For Summer"
"19","","","#4 Best Sellers","in Tween Girls Bodysuits & Jumpsuits","$6.80","-7%","","SHEIN Big Girls' Knitted All-Match Solid Color Jumpsuit, Short Sleeve, Black, Street Style, Spring/Summer"
"","","","#10 Best Sellers","in Tween Girls Jeans","$20.00","-7%","","SHEIN Streecool Kids Tween Girl Heavy Washed Irregular Waist Multi-Pocket Loose Jeans"
"","","","#3 Best Sellers","in Tween Girls Denim","$13.10","-7%","","SHEIN Tween Girl Flap Pocket Solid Denim Skirt"
"","","","#3 Best Sellers","in Teen Girls Sets","$8.04","-13%","","Teen Girl Character Print Simple Round Neck Short-Sleeved Two-Piece Set"
"4","","","","","$6.65","-18%","7.0k+ sold recently","SHEIN Young Girl Slogan Print Short Sleeve T-Shirt And Shorts 2pcs/Set"
"7","","","#2 Best Sellers","in Teen Girls Bottoms","$8.10","-11%","","SHEIN 2pcs Teen Girl Elastic Waist Stretchy Undershorts"
"","","","","","$3.70","-14%","1.0k+ sold recently","Girls' Casual Fashionable Colorful Letter Slogan Printed Short Sleeve T-Shirt"
"","","","#1 Best Sellers","in Teen Girls Tops","$4.90","-13%","","SHEIN Teen Girls' Knitted Mesh Floral Pattern Crop Top With Split Hem, Ruched Bust"
"4","","","","","$14.60","-14%","2.3k+ sold recently","SHEIN Tween Girls' Cool Street Style Knit Star Print Round Neck Top And Drawstring Jogger Pants Concert Outfit"
"","","","","","$9.60","-6%","30+ sold recently","SHEIN Teen Girl White Loose Split Band Jacquard Beach Vacation Semi-Sheer Sunscreen Knitted Cover Up Cover-Up"
"6","","","","","$4.05","-29%","1.8k+ sold recently","SHEIN Tween Girl Heart & Slogan Graphic Tee"
"7","","","","","$1.69","-16%","2.4k+ sold recently","200 Pcs/Bag Mix Color Children Cute Cartoon Elastic Hair Bands Baby Girls Lovely Srunchies Rubber Bands Kid Hair Accessories Set Bag Only Show ,Random Packing"
"","","","","","$7.80","-15%","1.0k+ sold recently","SHEIN Young Girl Daily Casual Home Wear Solid Color Sleeveless Vest And Shorts Set"
"","","","","","$2.42","-44%","100+ sold recently","Young Girl Knitted Casual Cartoon Letter Printed Round Neck T-Shirt, Suitable For Daily Wear In Spring And Summer"
"4","","","#1 Best Sellers","in Young Girls Jeans","$12.20","-14%","","Young Girl's Heart Pattern Distressed Jeans"
"","","","","","$12.60","-15%","","Girls' Elegant And Versatile Double-Layer Peter Pan Collar Fringe Long-Sleeved Shirt And Suspender Skirt Set, Perfect For Autumn Picnic, Outdoor Activities And School"
"7","","","","","$6.40","-16%","5.5k+ sold recently","SHEIN Tween Girls' Casual Solid Color Sleeveless Woven Top And Shorts Set, Spring/Summer"
"8","","","#1 Best Sellers","in Young Girls Dresses","$4.40","-15%","","SHEIN Young Girl Knitted Solid Color Round Neck Butterfly Patterned Casual Dress"
"","","","#5 Best Sellers","in Tween Girls Tank Tops & Camis","$13.20","-15%","","SHEIN Tween Girl Casual And Colorful Candy-Coloured Soft And Comfortable Tank Top"
"4","","","","","$5.56","-47%","1.1k+ sold recently","SHEIN Young Boy Comfortable Casual Color-Blocking Top And Shorts Set"
"6","","","#5 Best Sellers","in Tween Girls Dresses","$6.90","-7%","","Tween Girl Summer Fresh Striped Flare Sleeve V-Neck Belted Dress"
"","","","","","$10.30","-13%","","SHEIN Teen Girl Summer Casual Floral Cropped Ruched T-Shirt And Skirt Two Piece Set"
"4","","","#1 Best Sellers","in Kids Bags & Luggage","$6.00","-8%","","1pc Leisure And Fashion Crossbody Walking Bag With Mobile Phone Cloth Bag Vertical Coin Purse For ,Girl,Travel,Back To School,Gifts"
"7","","","","","$2.22","-40%","40+ sold recently","Set Of 3 Vintage Small Frame Round Sunglasses For Men And Women With Round Face"
"4","","","","","$4.94","-24%","500+ sold recently","SHEIN Tween Boy Summer Knitted Short Sleeve Sports Style Round Neck T-Shirt , Easy Bear Graphic Print"
"","","","#4 Best Sellers","in Tween Girls Dresses","$9.30","-7%","","SHEIN Tween Girls' Summer Casual Sleeveless Long Geometric Patterned Side Split Dress"
"8","","","#4 Best Sellers","in Tween Girls Activewear","$10.00","-7%","","SHEIN Tween Girl Knit Solid Color Pocketed Sports Skirt With Safety Short"
"","","","","","$6.00","-6%","10+ sold recently","Tween Girl Casual Slogan Graphic Short Sleeve Tee For Summer"
"7","","","","","$7.70","-13%","4.9k+ sold recently","SHEIN Tween Girls' Cartoon Print Short Sleeve Set"
"6","","","","","$8.30","-14%","3.7k+ sold recently","SHEIN Young Girl Portrait Print Tank Top And Pleated Skirt"
"4","","","#5 Best Sellers","in Tween Girls Bottoms","$12.73","-17%","","SHEIN Tween Girl Knit Solid Color Bowknot Decor Casual Shorts 3pcs/Set For Summer"
"11","","","","","$5.55","-34%","3.8k+ sold recently","SHEIN Young Girl Heart Print Tee & Contrast Binding Shorts"
"8","","","#3 Best Sellers","in Young Girls Tank Tops & Camis","$3.20","-16%","","Young Girl's Casual Cartoon Printed Stand Collar Tank Top For Summer Suitable For Summer"
"12","","","","","$6.64","-27%","200+ sold recently","SHEIN Young Girl Rib-Knit Drop Shoulder Curved Hem Tee & Leggings"
"4","","","#1 Best Sellers","in Tween Girls Pants","$8.40","-13%","","SHEIN Tween Girls' Sports Street Fashion Knitted Solid Color Flare Pants For Spring/Summer"
"8","","","","","$9.11","-15%","5.0k+ sold recently","SHEIN Tween Girl's Knitted Tie-Dye Heart Printed T-Shirt + Color-Block Shorts Vacation Casual Sets"
"","","","#10 Best Sellers","in Tween Girls Denim","$10.36","-12%","","SHEIN Tween Girl Spring And Summer Boho Ripped High Waist Wrap Front Denim Skort, Summer Break Outfits"
"","","","","","$10.80","-14%","70+ sold recently","Tween Girl 3pcs Knit Solid Color V-Neck Pintuck Short Sleeve T-Shirt Set, Casual"
"12","","","#3 Best Sellers","in Young Girls Bodysuits & Jumpsuits","$5.40","-16%","","SHEIN Young Girl Ditsy Floral & Heart Print Belted Tank Romper"
"","","","","","$9.80","-15%","","SHEIN Mommy And Me Matching Outfits (2 Pieces Sold Separately) - Woven Red Vacation Beach Maxi Dress With Ruffle Hem And Bow For Young Girls, Perfect For Summer, Travel, And Mother-Daughter Outfits"
"","","","#1 Best Sellers","in Tween Girls Clothing","$6.00","-6%","","Tween Girl 1pc Casual Printed Crewneck Pullover Short Sleeve T-Shirt, Summer, Youth Clothing"
"","","","#2 Best Sellers","in Tween Girls Denim Skirts","$12.90","-7%","","SHEIN Tween Girl Solid Pleated Denim Skirt"
"5","","","","","$11.80","-6%","10k+ sold recently","SHEIN Teen Girls Ripped Raw Hem Denim Shorts"
"","","","","","$6.45","-33%","100+ sold recently","Little Girls' Simple Letter Printed T-Shirt And Belted Shorts 2pcs/Set"
"","","","","","$18.00","-8%","800+ sold recently","Young Girl Summer Solid Color Heart Pattern Shorts Set, Multiple Pieces For Daily Outfits"
"","","","","","$10.30","-6%","","SHEIN Teen Girl Floral Knit V-Neck Swimsuit & Swim Trunks Set"
"12","","","","","$11.46","-33%","9.1k+ sold recently","SHEIN Young Girl Letter Printed Short-Sleeved Shorts Three-Color Casual Suit Summer"
"","","","","","$3.80","-14%","1.9k+ sold recently","1pc Young Boy Slogan Printed Short Sleeve T-Shirt"
"6","","","#9 Best Sellers","in Young Girls Clothing","$5.50","-8%","","Young Girl Elegant And Flower Patterned Button Design Tank Top With Elastic Shorts Set, Suitable For Vacation And Travel In Spring And Summer"
"4","","","","","$5.56","-38%","900+ sold recently","Tween Girl Floral Print Round Neck Short Sleeve T-Shirt And Shorts Casual Outfit For Summer"
