"goods-title-link","rank-title","rank-sub","price","selling_proposition","discount"
"About 5400pcs 1 Box 18 Colors Polymer Clay Round Beads, Including Face Beads & Flat Beads, With Heishi Disc Beads & Letter Beads For Girls Ages, Making Friendship Bracelets","","","$9.40","600+ sold recently",""
"61Pcs Fat Cat Stickers For Water Bottle,Cute Vinyl Stickers For Laptop,Water Bottle, Envelopes, Crafts Scrapbooking,Merry Aesthetic Decorations,Stickers","","","$1.80","500+ sold recently",""
"1set PVC Wall Sticker, Modern Flower Pattern Wall Sticker For Home","","","$4.40","600+ sold recently",""
"1set Adjustable Table Balloon Arch Stand Holder, Bow Birthday Wedding Party Decor Balloon Base Halloween Gifts","","","$6.12","600+ sold recently","-38%"
"1PC Silicone Makeup Sponge Holder Shatterproof Beauty Egg Organizer Egg Storage Egg Holder Beauty Eggs Sponge Storage Box Sponge Box For Women Girl For Travel Holiday Vacation Travel Essentials Travel Accessories, Silicone Blender Case Portable Travel Cosmetic Case Makeup Sponge Blender Silicone Case","","","$2.50","1.3k+ sold recently","-11%"
"50pcs Duck Graffiti Pattern Cartoon Anime Guka Stickers for Kids Cute Fashion Love Graffiti Waterproof Stickers Suitable for Laptops Water Bottles Skateboards Mobile Phones","","","$0.87","200+ sold recently","-54%"
"1pc Transparent PVC Lace Floral Waterproof Tablecloth","","","$12.00","50+ sold recently",""
"1pc Bubble Pattern Random Sticker","","","$1.80","400+ sold recently",""
"1pc Anti-Slip Entryway Hallway Kitchen Bathroom Carpet Runner Mat, Floor Rug Pad","","","$7.70","40+ sold recently",""
"1pc Garden Weeding Tool - Weeding Puller, L-Shaped Manual Crack Weeder.  Extractor Removal, Agricultural Bonsai Supplies Hand Tool","","","$4.37","100+ sold recently","-25%"
"120PCS Double Sided Dot Stickers Removable Round Clear Sticky Tack No Trace Sticky Putty Waterproof Small Stickers for Festival Decoration and  Hanging Picture Poster Decorations, Dots for Balloon, Photo, Clear Museum Putty for Art Craft, Party Supplies, Multipurpose (20mm, 120PCS)","","","$1.92","700+ sold recently","-20%"
"11pcs Travel Cosmetic Lotion Refillable Bottle Set Cosmetic Empty Liquid Container","#3 Best Sellers","in Storage Boxes , Bottles & Jars","$5.30","",""
"2pcs/Pack Country Style Black Metal Wheat & Harvest Napkin Ring Suitable For Home, Kitchen, Restaurant, Event, Festival, Wedding, Party, Hotel, Cottage, Family Gathering Table Decoration","","","$1.80","50+ sold recently","-10%"
"30pcs Lace Pattern Sticker","","","$1.80","800+ sold recently",""
"1PC/2PCS/4PCS Artificial Flowers Hydrangea Bouquet DIY Birthday Party Party Party Decoration, Wedding Flower Basket, Bride Holding Flowers, Home Furnishings, Dining Room, Bedroom, Windowsill Decoration, Vase Decorations, Valentine'S Day, New Year Decoration, Outdoor Garden Opening Season","","","$2.60","900+ sold recently",""
"1pc Green Round Stainless Steel Lunch Box, Multilayer Insulated Food Container With Lid, Portable & Suitable For Outdoor Use, All Seasons","","","$4.13","100+ sold recently","-25%"
"1pc 5-layer Plastic Multifunctional Pants Hanger For Storing Ties Scarves And Pants","#2 Best Sellers","in Laundry Products Newest Trend","$2.07","","-10%"
"5pcs Hand Towels, Super Soft Absorbent Towels, Quick Drying White Bath Towels, Bathroom Kitchen Use, Ideal Bathroom Supplies, Simple White Face Towels, Household Towels, Soft Face Towels, Home Bathroom Absorbent Towels Hotel Beauty Salon, Bathroom Supplies Travel Accessories Bathroom Accessories","#4 Best Sellers","in Hand Towels","$3.10","",""
"1pc Bathroom Trash Can, Household Creative Gap Waste Bin, Press Type Garbage Can With Lid, Simple Paper Basket, 2.64gal Large Capacity Trash Bin, Home Essential, Cleaning Supplies","#3 Best Sellers","in Bathroom Trash Bin","$11.30","",""
"12pcs 3D Butterfly Sticker, Black Hollow Paper Butterfly Wall Decoration For Home Decor","","","$1.50","300+ sold recently",""
"1pc 500ml Green Manual Garlic Press Mini Chopper With Pull Cord Handle, Suitable For Chopping Garlic, Onion, Ginger And Chili, Etc.","#1 Best Sellers","in Blenders","$2.24","","-67%"
"1pc Multifunctional Transparent Light Luxury Travel Portable Toothbrush Cup With Toothpaste Holder For Outdoor Use","#3 Best Sellers","in Bathroom Tumblers","$0.83","","-69%"
"1pc 550ml Or 400ml Clear Straw Bottle, Modern Glass Coffee Cup For Home, Office","","","$2.80","1.8k+ sold recently",""
"1pc/3pcs Home Kitchen Cutting Board Set, Plastic Cutting Board, Food Supplement Cutting Board For Fruits And Vegetables, Non-Slip Handle, Essential Kitchen Utensils For Apartments, Dormitory And Back-To-School Supplies","#3 Best Sellers","in Kitchen Knives & Accessories","$3.45","","-39%"
"1pc/Exquisite Jewelry Storage Box Three-Layer Drawer Style Jewelry Organizer, Dust-Proof & Anti-Oxidation For Necklace, Ring, Bracelet, Earring And Other Accessories Storage","","","$7.65","70+ sold recently","-45%"
"1box Colorful Cute Alphabet Number Decorative Sticker Self-Adhesive Letters For Scrapbooking Journal","","","$1.50","200+ sold recently",""
"8PCS Black Crochet Hooks Set  For  Hands,Ergonomic Crochet Hook Soft Crochet Needle,2.5-6.0mm Crochet Kit For Beginners Crocheting Yarn Craft","#3 Best Sellers","in Knitting & Crochet Supplies","$3.70","",""
"12 Inch Handmade Front Door Wreath For Home, Outdoor And Indoor Decor, Housewarming Gift","","","$7.47","400+ sold recently","-10%"
"Pink Oven Mitts and Pot Holders 4 pcs Set,High Heat Resistant 500 Degree Extra Thicken Long Kitchen Oven Glove for Cooking","","","$6.27","1.1k+ sold recently","-33%"
"30pcs/Pack Vintage Coffee Themed Scrapbooking Stickers, Creative Aesthetic Decals, Diy Decorative Collage Material For Handmade Festival Gift, Personalized Scrapbook School Stationery Supply","","","$1.90","100+ sold recently",""
"999 PCS Water Balloons Quick Fill Set,Summer Splash Fun Water Party Game,Family Outdoor Swimming Pool Water Toys,Outdoor Water Toys For Outdoor, Friends, Summer Fun","#2 Best Sellers","in Party Games & Activities","$1.50","",""
"1pc 'Bajame!' Toilet Decorative Sticker","","","$1.35","300+ sold recently","-10%"
"50pcs Slogan Graphic Biscuit Bag,Transparent Thank You Letter Self-Adhesive Cookies Packaging Bag,For Baking Candy Bread Wedding Party Gift Bags","","","$0.55","50+ sold recently","-61%"
"1pc Crevice Cleaning Brush For Kitchen, Bathroom, Plastic Long Brush For Tile Gap","#9 Best Sellers","in Household Brushers Customer Favorite List","$1.10","",""
"1pc, ""Warning - Shopaholic Lives Here"" Funny Metal Tin Sign (11.81""X7.87""/30x20cm) , Novelty Home Decor, Room Decor, Wall Decor, Bathroom Decor, Bar Decor, Cafe Decor, Garage Decor, Farmhouse Decor","","","$5.00","500+ sold recently",""
"6pcs Silicone Kitchenware Set, Kitchen Supplies, Baking Supplies, Large Scraper, Small Scraper, Large Scraper, Small Scraper, Oil Brush, Spatula, Baking Tools, Cake Cream Spatula, Kitchen Tool Set","#5 Best Sellers","in Icing & Decorating Spatulas","$5.67","","-41%"
"1pc Corner Shelves , Boho Handmade Woven White Rope Beige Hanging Floating Shelf Decor Display Storage Organizer For Bedroom Bathroom Office Living Room","","","$9.50","800+ sold recently",""
"5/10/20pcs Travel Hangers - Portable Folding Clothes Hangers For Traveling, Cruise, And Drying Clothes (Random Color)","","","$3.90","10+ sold recently",""
"5pcs Detangling Brush Set 9-Row Cushion Nylon Styling Brushes, Rattail Comb Cutting Comb Set For African Hair Textured Kinky Wavy/ Curly/ Coily/ Wet/ Dry/ Oil/ Thick/ Long Hair Detangling Brush For Curly Hair Brush For Afro America 3a To 4c Kinky Wavy, Curly, Coily Hair, Detangle Easily With Wet/Dry , Mist Spray Bottle For Hair Bottle200ml","","","$3.60","1.3k+ sold recently","-5%"
"50pcs/Pack Flower Bicycle Bow Clock Violin Retro Element Stickers For Guitar Skateboard Water Bottles Bumper Helmet Snowboard Laptop Phone Case Fridge Door Luggage Motorcycles Car Accessories Toys For Gifts","","","$1.80","1.1k+ sold recently",""
"1pack Artificial Rose Petal, Artificial Flower Petal For Valentine Day Wedding Flower Decoration","","","$0.66","","-40%"
"1pc/2pcs/3pcs/4pcs/5pcs/10pcs  Shading Sleep Eye Mask Imitation Silk Ice Feel Comfortable, Relaxing Fatigue, Lunch Rest, Sleeping","#7 Best Sellers","in Daily Home Essentials","$1.90","",""
"1pc Double Layer Jewelry Box For Necklace, Earring, Bracelet & Ring Storage, Portable Travel Jewellry Organizer, Minimalist Style, Gift For Valentine's Day","","","$4.40","1.3k+ sold recently",""
"1 Set 2D Coffee Bar Tiered Tray Decor For Table Ornament , Rustic Coffee Is Always A Good Idea Wood Sign Home Kitchen Coffee Shop Decoration ,Without Tray","","","$2.90","1.7k+ sold recently",""
"1pc Classroom Encouragement Poster, Daily Progress Leads To Great Achievements, Children's Room Decoration, Mental Health Canvas Print, Inspirational Office Decoration, Rainbow Educational Wall Art Print, Unframed","","","$1.98","500+ sold recently","-10%"
"1/2/3pcs Wall-Mounted Triangular/Long Storage Rack, No Drilling Bathroom Shelf Organizer For Toilet, Shower Room, Wash Basin","#2 Best Sellers","in Bath Hardware Sets","$4.80","",""
"90-120cm Artificial Palm Tree With Imitation Bird's Nest Fern & Turtleback Bamboo & Bird Of Paradise, Plastic Indoor/outdoor Plant Decoration For Home Garden Wedding","#4 Best Sellers","in Artificial Plants","$8.90","",""
"1pc Gold-color Flame & Moon Shaped Crystal Pendant Sun Catcher Outdoor Garden Ab Color Hanging Decoration Ornament","","","$3.90","1.7k+ sold recently",""
"1pc Rechargeable Usb Fan Folding Handheld Portable Fan With Three Speed Settings","","","$1.62","1.1k+ sold recently","-56%"
"1pc Canvas Floral Girl Decoration Painting, Bohemian Style Flower Art Wall Poster, Artwork Home Decoration For Bathroom Bedroom Office Living Room, No Frame","","","$1.02","40+ sold recently","-40%"
"Water Balloon Set With Quick Fill Nozzle, Fun Water Bomb Party Toy For Outdoor Games","#9 Best Sellers","in Balloons","$12.05","","-2%"
"1pc Polyester Crinkle Table Runner, Cheesecloth Table Runner, Gauze Tablecloth, Boho Rustic Decorations For Wedding Decor Reception Bridal Shower Holiday Party","#4 Best Sellers","in Table Runners","$3.90","",""
"1pc Simple Light Pink Slow Rebound Memory Sponge Water Absorbing Non-slip Bath Mat For Bathroom","","","$5.00","700+ sold recently",""
"A Large Capacity Cute Sardine Can Shape Storage Bag  Cosmetic Bag Toiletry Bag Makeup Storage Creative Catfish Can Makeup Bag Autumn Must-Have Fashion PortableMultifunctional  Suitable For Travel  Suitable For School Travel Simple Style For Bathroom For Women","","","$5.34","100+ sold recently","-47%"
"2pcs Stainless Steel Wall Hook, Silver Adhesive Sink Drain Rack For Kitchen","","","$2.00","80+ sold recently",""
"1pc Bride To Be Veil For Wedding Party Bridal Or Bachelorette Party","#1 Best Sellers","in Photobooth Props","$2.10","",""
"1000pcs 2mm Cross Stitch Beads Mix Color Dyed Rice Beads Set, Suitable For DIY Bracelet Necklace Jewelry Making","","","$1.10","20+ sold recently",""
"1pc Colorful English Inspirational Wall Stickers For Children's Bedroom And Living Room Decoration Stickers","","","$2.80","200+ sold recently",""
"1pc Oil Proof Parchment, Non-Stick Baking Paper, Multifunction Ovenproof Paper For Baking Air Fryer Kitchen Air Fryer Liners Air Fryer Paper Airfryer Air Frier","","","$2.10","1.9k+ sold recently","-50%"
"1pc Plush Sleep Faux Silk Eye Mask, Soft Breathable Light-blocking Eye Mask For Afternoon Nap And Tie-dye Style/blue Gradient","","","$1.44","100+ sold recently","-10%"
"4pcs Artificial Potted Plants, Mini Fake Plants For Indoor Home Decoration, Faux Flowers For Windowsill, Bathroom, Wall, Desk, Office, Kitchen, Farmhouse Decor","","","$2.50","100+ sold recently",""
"1pc Random Color Kitchen Storage Rack","","","$8.80","",""
"50pcs Cat Emoji Cartoon Stickers, Waterproof Decals For Luggage, Laptop, Guitar, Diy Decoration","#3 Best Sellers","in Stickers","$1.90","",""
"1pc Cute Pig Shaped Hanging Hand Towel, Kitchen Cleaning Cloth, Slouchy Wiping Towel, Plain Color Kids Handkerchief For Household Use","#1 Best Sellers","in Kitchen Towels","$1.88","","-1%"
"1 Pc Compact Portable Mini Daisy Candy Air Cushion Comb,Detangling Hair Brush With Handle,Styling&Hairdressing Tool,Hair Care,Girl Gift(Green)","","","$1.90","1.0k+ sold recently","-5%"
"1pc High-Capacity Glass Cup For Female Students With Lid & Straw, Suitable For Summer Drinks And Coffee","","","$7.30","1.2k+ sold recently",""
"1PC (M/L Size A4 A5)Transparent Pvc  Personalized First Name Outdoor Convenient Large Capacity Toiletry Bag Water-Resistant Cosmetic Bag With Nylon Zipper And Color Letter Print, Beach Pouch Monogram Bikini Swim Bag SPF Bag, Personalized SPF Bag Snack Bag Pool Bag Waterproof First-AID Bag Transparent Storage Bag Beach Survival Cosmetic Bag , Waterproof Bag,Portable Storage Bag Basics Swim Bag ,Cruise Essentials Sport Bag Sports Bag, Summer Outdoor Sports Universal Waterproof Pouches ,  Swim Dive Protective Cover Sports Bag School Supplies School Stuff For School For Student ,Personalized Gifts Perfect For Music Festival ,Fit For Business Travel, Outdoor Sports Beach Phone Protective Bag , Beach Accessories, For Boating Swimming Snorkeling Kayaking Beach Pool Water Park Sport Bag ,Swimmers Tropical Coastal Vibes Beach Bag For Swimming Summer Island Holiday Vacation Beach Accesories Beach Wedding Supplies Pool Party Supplies For Girl Boy Men Woman","","","$2.20","",""
"4pcs Tassel Decor Placemat, Woven Design Round Table Mat For Dining Table","","","$7.20","1.5k+ sold recently",""
"1pc Transparent PVC Lace Floral Waterproof Tablecloth","","","$12.00","50+ sold recently",""
"1pc Bubble Pattern Random Sticker","","","$1.80","400+ sold recently",""
"1pc Anti-Slip Entryway Hallway Kitchen Bathroom Carpet Runner Mat, Floor Rug Pad","","","$7.70","40+ sold recently",""
"1pc Garden Weeding Tool - Weeding Puller, L-Shaped Manual Crack Weeder.  Extractor Removal, Agricultural Bonsai Supplies Hand Tool","","","$4.37","100+ sold recently","-25%"
"120PCS Double Sided Dot Stickers Removable Round Clear Sticky Tack No Trace Sticky Putty Waterproof Small Stickers for Festival Decoration and  Hanging Picture Poster Decorations, Dots for Balloon, Photo, Clear Museum Putty for Art Craft, Party Supplies, Multipurpose (20mm, 120PCS)","","","$1.92","700+ sold recently","-20%"
"11pcs Travel Cosmetic Lotion Refillable Bottle Set Cosmetic Empty Liquid Container","#3 Best Sellers","in Storage Boxes , Bottles & Jars","$5.30","",""
"2pcs/Pack Country Style Black Metal Wheat & Harvest Napkin Ring Suitable For Home, Kitchen, Restaurant, Event, Festival, Wedding, Party, Hotel, Cottage, Family Gathering Table Decoration","","","$1.80","50+ sold recently","-10%"
"30pcs Lace Pattern Sticker","","","$1.80","800+ sold recently",""
"1PC/2PCS/4PCS Artificial Flowers Hydrangea Bouquet DIY Birthday Party Party Party Decoration, Wedding Flower Basket, Bride Holding Flowers, Home Furnishings, Dining Room, Bedroom, Windowsill Decoration, Vase Decorations, Valentine'S Day, New Year Decoration, Outdoor Garden Opening Season","","","$2.60","900+ sold recently",""
"1pc Green Round Stainless Steel Lunch Box, Multilayer Insulated Food Container With Lid, Portable & Suitable For Outdoor Use, All Seasons","","","$4.13","100+ sold recently","-25%"
"1pc Simple Light Pink Slow Rebound Memory Sponge Water Absorbing Non-slip Bath Mat For Bathroom","","","$5.00","700+ sold recently",""
"2pcs Stainless Steel Wall Hook, Silver Adhesive Sink Drain Rack For Kitchen","","","$2.00","80+ sold recently",""
"1pc Oil Proof Parchment, Non-Stick Baking Paper, Multifunction Ovenproof Paper For Baking Air Fryer Kitchen Air Fryer Liners Air Fryer Paper Airfryer Air Frier","","","$2.10","1.9k+ sold recently","-50%"
"1pc Plush Sleep Faux Silk Eye Mask, Soft Breathable Light-blocking Eye Mask For Afternoon Nap And Tie-dye Style/blue Gradient","","","$1.44","100+ sold recently","-10%"
"1 Pc Compact Portable Mini Daisy Candy Air Cushion Comb,Detangling Hair Brush With Handle,Styling&Hairdressing Tool,Hair Care,Girl Gift(Green)","","","$1.90","1.0k+ sold recently","-5%"
"1pc High-Capacity Glass Cup For Female Students With Lid & Straw, Suitable For Summer Drinks And Coffee","","","$7.30","1.2k+ sold recently",""
"4pcs Tassel Decor Placemat, Woven Design Round Table Mat For Dining Table","","","$7.20","1.5k+ sold recently",""
"1pc Creative 37-inch Pink Champagne Bottle Shaped Aluminum Foil Balloon, Party Supplies, Festival Decor, Birthday Party, Room/home/scene Decoration, Wedding Decoration","#5 Best Sellers","in Playable Balloons","$0.95","","-37%"
"50pcs, Round Parchment Papers (6''/8''/9''), Non-Stick Precut Cake Pan Parchment Liners, For Baking, Grilling, Steaming, Air Fryer, Microwave, Baking Tools, Kitchen Gadgets, Kitchen Accessories, Home Kitchen Items Air Fryer Kitchen Air Fryer Liners Air Fryer Paper Airfryer Air Frier","#9 Best Sellers","in Parchment","$0.87","","-49%"
"1pc Makeup Organizer Box For Eyeshadow Palette, Transparent Cosmetic Storage Box, Suitable For Dressing Table, Vanity, Bathroom Countertop, Cabinet, 7 Compartments,Room,Home,Bedroom,Bathroom,House,Pink Room,Living Room Decor,Travel Stuff,Gift Bag,Gifts For Mom,Dad,Men,Friends,Teacher,Birthday,Wedding,Desk,Shelves,Accessories,Gift Boxes,Funny Gift,Storage","","","$3.60","2.3k+ sold recently","-8%"
"1 Set Hot Pink Glitter Birthday Banner - Hot Pink, Funny Birthday Party Decorations For Women, Photo Backdrop, 21st, 30th Birthday Decor, Birthday Gift For Her, Happy Birthday Banner","","","$3.30","600+ sold recently",""
"1bunch Plastic Artificial Flower Bouquet, Cottagecore Artificial Flower Bundle For Decoration","","","$1.90","400+ sold recently",""
"5pcs Clear Water Bag, 300ml Transparent Portable Water Bag For Outdoor","","","$1.90","200+ sold recently",""
"201pcs Glow In The Dark Luminous Pebbles, Perfect For Garden & Fish Tank Decorations, Wedding Decoration","","","$2.75","10+ sold recently","-36%"
"48pcs 3D Colored Butterfly Cake Decoration - Suitable For Butterfly Themed Birthday Party, Cake Decoration, Gift Decoration, Kindergarten Decoration, Etc! Perfect For Christmas, Halloween, Thanksgiving, Easter Gift","#1 Best Sellers","in Cake Decorating Toppers","$1.50","",""
"1pc 4 Grid Food Storage Box, Clear Meat Fresh Container Box, For Kitchen","","","$1.70","400+ sold recently","-37%"
"1Pc Black Classified Storage Large Capacity Multi-Function Travel Makeup Bag For Women Girls,Makeup Bag Makeup Pouch Skincare Bag Toiletry Bag Packing Cubes,Travel Essentials Cruise Essentials Dorm Essentials,Wedding Bridesmaid Gifts,Mom Gifts,Birthday Gifts,Gifts For Friends And Teachers,Home Decor,Bathroom Livingroom Bedroom Decor,Bathroom Organizer,Jewelry Organizer,Lip Oil Organizer,Nail Polish Organizer Storage Makeup Organizer Makeup Case","","","$14.50","2.9k+ sold recently","-4%"
"1pc Cartoon Simple Multifunctional Large Capacity Stationery Storage Bag, Pencil Case, Organizer, Comic Book Style Design, Fashionable School Supplies-Gift, Makeup Storage Gift Idea","","","$7.20","90+ sold recently",""
"1PC Smart Life Wooden Clock Alarm Clocks For Bedroom Table Clock Home Electronics Device Decoration Snooze Morning Bedside Table Clock Voice Control Desk Digital Alarm Clock","#10 Best Sellers","in Desk & Table Clocks","$8.16","","-20%"
"1pc Diamond Decorated Portrait, Landscape, Architecture Art Poster With Butterfly & Wine Glass Design Canvas Painting, Frameless, For Living Room, Bedroom, Study Room Wall Decor","","","$2.80","400+ sold recently",""
"2pcs Dandelion Print Wall Sticker, Black Self Adhesive Wall Art Decal For Home Decor","","","$1.67","100+ sold recently","-61%"
"2/4pcs Solar Waterproof Mason Jar Lights Lids, 20 LED  Fairy Firefly Jar Lids String Lights (Jars Not Included), Best For Mason Jar Decor, Great Outdoor Lawn Decor For Patio Garden, Yard (7cm/2.76inch)-Warm White","","","$4.11","50+ sold recently","-21%"
"1pc Iron Made Candy Tray, High-End Fruit Tray, Party Dining Table Supplies, Candy & Snack Storage Tray, Home Livingroom Coffee Table Decoration, Spring Festival Supplies, Table Decor","","","$14.66","100+ sold recently","-19%"
"Extra Large Beach Towel - Ultra-Soft Microfiber, Quick-Dry & Sand-Free, Perfect For Travel, Yoga, Camping & Pool Parties","#4 Best Sellers","in Beach Towels","$6.23","","-25%"
"1pc Iron Hanger, 8-layer Adjustable Clothes Hanger For Bedroom","#7 Best Sellers","in Hangers & Racks","$7.33","","-6%"
"12pcs Hawaiian Lei Necklaces, Tropical Hibiscus Flower Summer Pool Party And Hawaiian Themed Party Decorations And Supplies For Festivals, Weddings, Beach Birthdays (Random Colors)","","","$1.40","",""
"1pc LED Decoration Lantern, Vintage Kerosene Lamp Design Light For Home Decor","#1 Best Sellers","in LED Decoration Lantern","$2.50","",""
"3/4/5/6 Tiers Clear Sunglasses Eyeglasses Display Stand Rack","","","$2.90","900+ sold recently",""
"6/12/24/36/48pcs Rainbow Magic Springs Circle Children's Puzzle Toy Birthday Party Favors Guests Kids Girl Boys Pinata Fillers Funny Gift","","","$1.89","600+ sold recently","-10%"
"1pc Gray Storage Bag Non-Woven Closet Organizer Storage Bag Clothes Quilts Storage Bag  Large Capacity Moving Packaging Bags Luggage Bags Large Capacity Non-Woven Quilt Clothes Storage Bag Clothes Packaging Box Quilt Organizer Storage Bag Dustproof Fabric Clothes Storage Bag Moisture-Proof Clothes Finishing Bag Closet Organizer Zipper Portable Organizer Versatile Clothes Container For Comforter Blankets Bedding Clothing Home Storage & Organization Bedroom Clothes Organizer With Handle Bedroom Access","","","$3.90","100+ sold recently","-24%"
"6 Pieces Summer Seascape Wall Art Prints Sea Beach Print Pictures Starfish Canvas Poster Surfboard Wall Paintings Bridge Painting Poster Reed Wall Art Nordic Wall Posters Living Room Decoration No Frame","","","$5.10","200+ sold recently",""
"1 Piece Reusable Extra Large Capacity Shopping Bag With Wheels Foldable Shopping Bag Multifunctional Luggage Storage Bag Shopping Cart, Portable And Convenient Supermarket Shopping Travel Storage","#7 Best Sellers","in Other Storage","$7.20","","-24%"
"1pc Mini Kitchen Baking Coffee Food Electronic Scale I2000, Square, Suitable For Home Cooking (Without Battery)","#2 Best Sellers","in Digital Kitchen Scales","$8.30","",""
"12pcs-Hangover Gift Bag Loose Single Party Gift Drawstring Tool Bag Suitable For Wedding Bride Gifts, Hangover Survival Guests, Bridesmaids, Single Party Supplies","","","$1.70","1.0k+ sold recently",""
"1pc/Set Rectangle Tablecloth Peva Material Oil-Proof Water-Proof Dirt-Proof Table Cover, Wedding Party Decor Set","","","$2.70","1.2k+ sold recently",""
"9pcs Anti-Slip Self-Adhesive Waterproof Flower Tile Stickers With Moroccan Black & White Print, Home Decor Background Wallpaper, Available In 3 Sizes: 7.87x7.87/11.81X11.81/15.75X15.75 Inches","","","$6.60","100+ sold recently",""
"1pc, 90*180cm, Bohemian Style Tablecloth, Romantic Table Runner Long Table Cover, Wedding Birthday Party, Bridal Shower, Reception Desk Decoration","","","$3.10","1.0k+ sold recently",""
"6pcs Travel Clothes Organizer, Dorm Essentials for School Student Teacher Travel Storage Bag Set With Lingerie Bag Waterproof Dustproof With Zipper For Luggage Back to School Nylon, For Men and Women For Student Travel Essentials","#3 Best Sellers","in Travel Packing Organizers","$6.40","","-11%"
"20pcs 9x20mm Bone Shaped Acrylic Beads For Necklace, Bracelet, Earring, Pendant Diy Jewelry Making","","","$1.50","900+ sold recently",""
"1box Food Parchment Paper Air Fryer Kitchen Air Fryer Liners Air Fryer Paper Airfryer Air Frier","","","$4.37","50+ sold recently","-22%"
"1Pc Cartoon  Rice Box Cute Katie Lunch Box Jade Gui Dog Freshness Preservation Box Bento Box (Some Parts May Be Random)","","","$6.90","",""
"1pc Silicone Kitchen Mat In Luxury Style With Line Blocks & Gradient Pattern. Cushioned, Anti-Fatigue, Water Absorbent, Quick Drying, Non-Slip Mats Suitable For Kitchen, Bathroom, Entrance, Laundry Room Etc.","","","$9.30","100+ sold recently",""
"1pc Jacquard Flower Pattern Cushion Cover Without Filler, Modern Flannelette Decorative Throw Pillow Cover For Home, All Season","","","$7.50","800+ sold recently",""
"40pcs/set Invisible Non-trace Hook, Nail-free Hook, Installation Kit For Various Picture Frames","","","$3.40","40+ sold recently","-6%"
"1pc, Pink Rose Inside Wine Glasses, 6.76oz Champagne Glasses, Goblets, For Whisky, Cocktail, For Bar, Pub, Club, Restaurant And Home Use, Drinkware","#8 Best Sellers","in Wine Glasses","$6.48","","-40%"
"120/60/30/10pcs Disposable Pink Nitrile Gloves, Latex Free WaterProof Anti Static Durable Versatile Working Gloves, Kitchen Cooking Tools Pink Disposable Gloves, Nitrile  Labor Protection Gloves","#10 Best Sellers","in Household Cleaning Protections Newest Trend","$2.10","",""
"1pc/5pcs Boho Gauze 71 Inch Long Table Runner, Semi-Sheer Cheesecloth Romantic 35 Inch Wide Tablecloth For Wedding Reception Bridal Holiday Birthday Valentine's Day Party Table Dining Room Dresser Decor,Home Decor, Scene Decor","","","$1.46","200+ sold recently","-57%"
"50pcs Faux Pearl White Heart-Shaped Flowers With Five Pointed Star Beads Can Be Used As Bracelets, Necklaces, Rings, And Phone Chains. DIY Accessories, Phone Case Accessories, Small Gifts","","","$0.41","300+ sold recently","-71%"
"10m Thickened Elastic Band In 3.5cm Width, Clothing Accessory","","","$6.30","90+ sold recently",""
"[Sanrio Official]1pc Magnetic Automatic Closing Fashion Portable Glasses Bag,Zipper Bag, Protective Case Sunglasses Case Box Eyeglasses Pouch Eyewear Protector Sanrio,Sanrio Hello,Hello Kitty,Kuromi,Sanrio Hello Kitty,Sanrio Kuromi,Sanrio Officially,Sanrio Melody,Sanrio Officially Licensed,Sanrio Sakura,Sanrio Cartoon,Sanrio Characters,Sanrio Kawaii,Sanrio Cute,Women Sanrio,Sanrio Sanrio,Character Sanrio, Sanrio Stuff","","","$3.10","200+ sold recently","-21%"
