"color-count","goods-title-link--jump","goods-title-link--jump href","rank-title","rank-sub","price","discount","selling_proposition","goods-title-link"
"4","","","","","$11.90","-6%","1.4k+ sold recently","SHEIN Teen Girl's Black-Grey Distressed Denim Shorts"
"5","","","","","$10.40","-14%","1.6k+ sold recently","SHEIN Tween Boy Gamepad Print Tee & Drawstring Waist Shorts"
"","","","","","$6.40","-9%","1.1k+ sold recently","Young Boy 4th Of July Outfits Independence Day Tank Top And Shorts Set With Letter And Americana Print For Summer"
"","","","","","$4.00","-15%","300+ sold recently","SHEIN Young Boy Lion Printed Round Neck Short Sleeve T-Shirt For Toddler"
"","","","","","$5.52","-20%","100+ sold recently","SHEIN Young Girl Woven Pure Color Cute Animal Pattern Loose Casual Shirt"
"5","","","","","$10.59","-7%","600+ sold recently","SHEIN Teen Girl Summer Casual Solid Color Distressed Frayed Denim Shorts"
"","","","","","$5.30","-12%","100+ sold recently","Tween Girl Retro 90s Style Print T-Shirt, Casual American Car Graphic Short Sleeve Tee, Round Neck, Suitable For Spring/Summer Wear"
"","","","","","$1.60","-16%","800+ sold recently","5 pcs/pack Adjustable Cute & Stylish Alloy Rings With Rhinestone & Hollow Out Detail For Children"
"","","","","","$3.49","-32%","400+ sold recently","5pairs Girls' Double Layer Lace Edge Ankle Socks"
"","","","","","$12.30","-13%","300+ sold recently","Los Angeles, Car Racing, Teen Boy Casual Simple Cartoon Car Pattern Short Sleeve Crew Neck Top And Shorts 2pcs Set, Suitable For Summer"
"","","","","","$6.60","-21%","100+ sold recently","Young Girl Purple Galaxy Mermaid Print One Shoulder Long Sleeve Swimsuit"
"","","","","","$7.30","-8%","600+ sold recently","SHEIN Tween Girls' Elegant Elastic Waistband Double-Layer Ruffle Hem Textured Skirt For Summer"
"","","","","","$8.00","-7%","100+ sold recently","Tween Girl Sheer Mesh Bell Sleeve Crop Top With Ruched Detailing"
"","","","","","$1.40","-13%","100+ sold recently","Kid's Hair Ties And Elastic Rubber Bands With Good Elasticity And Without Damaging Hair"
"","","","","","$9.70","-13%","200+ sold recently","SHEIN Tween Boy 2pcs/Set Loose Summer Casual Short Sleeve Round Neck Reflective Ink Pattern T-Shirt And Shorts Neon Glow Party Outfit"
"4","","","","","$13.66","-15%","300+ sold recently","Young Girl Knitted Comfortable Solid Color Casual Leggings 6pcs/Set"
"","","","","","$3.93","-24%","600+ sold recently","SHEIN Young Girl Slogan & Heart Print Tee"
"","","","","","$3.92","-11%","500+ sold recently","Young Boy Chicago 23 Sports Printed Round Neck T-Shirt"
"","","","","","$8.90","-15%","100+ sold recently","2pcs Young Boys' Casual Badge Applique Rib-Knit Trim Round Neck Short Sleeve T-Shirt & Solid Colored Shorts Knit Two Piece Outfit"
"","","","","","$12.10","-13%","100+ sold recently","SHEIN Teen Boy Casual Pineapple Print Round Neck Short Sleeve Top And Shorts Knit 2pcs Set For Holiday"
"","","","","","$7.70","-13%","40+ sold recently","Tween Boy Casual Smiling Letter Print Round Neck Top And Shorts Set, Suitable For Summer"
"","","","","","$7.10","-7%","","Girls' Stretchy Casual Sports Skort, Yoga Skort (YY296)"
"4","","","","","$4.30","-10%","100+ sold recently","SHEIN Teen Girl 2pcs/Set Casual Summer Knit Strapless Top"
"","","","","","$8.06","-24%","900+ sold recently","Young Girl 3pack Tropical Print Bikini Swimsuit With Kimono Matching Set"
"4","","","","","$5.40","-14%","1.2k+ sold recently","Tween Boy Casual Black Round Neck Short Sleeve T-Shirt With Letter And Gesture Print For Summer"
"","","","","","$8.40","-14%","100+ sold recently","SHEIN Tween Girls' Casual Woven Solid Color Skort For Spring And Summer"
"","","","#5 Best Sellers","in Kids Waist Bags","$2.50","-7%","","Cartoon Pattern Jade Dog  Melody One Shoulder Crossbody Chest Bag Oxford Cloth Baby Accessory Bag Girls Anime Kawaii Cartoon"
"","","","","","$2.00","-9%","500+ sold recently","1pc Girls Colorful Face Hair Clip, Unique Fashion Dopamine Face Claw Clip For Daily Use Or Party Decoration"
"","","","","","$4.87","-36%","1.1k+ sold recently","SHEIN Young Girl Appliques Ruffle Hem Cami Dress"
"","","","","","$8.40","-6%","600+ sold recently","Teenage Girls' Ink Splash Print Two Piece Swimsuit Set"
"","","","#7 Best Sellers","in Teen Girls Pants","$11.80","-13%","","SHEIN Teen Girl's Woven Wide Leg Pants With Drawstring Waist & Star Patch And Braid Trimmed Side Pockets"
"","","","","","$11.90","-13%","100+ sold recently","SHEIN Teen Girl Woven Tank Top & Tropical Print Wide Leg Pants Casual Two-Piece Set"
"","","","","","$11.60","-6%","400+ sold recently","Teen Girls' Circle Print One Piece Swimsuit With Bowknot Detail And Knotted Cover Up Skirt, Bathing Suit Beach Outfit Summer Vacation"
"","","","#2 Best Sellers","in Young Boys Sweatpants","$11.25","-16%","","BOY Casual Sports Joggers Street Fashion Cute Dinosaur Print Long Pants Set Of 3 (Grey, Khaki, Navy), Suitable For Daily Wear, School, Travel, Sports, Spring And Autumn"
"","","","","","$5.50","-8%","600+ sold recently","Young Girl Casual Pompom Decor Swimsuit Cover Up Clothes"
"","","","","","$2.75","-60%","300+ sold recently","Young Girl Spring/Summer/Autumn Casual Flamingo Print Batwing Sleeve Dress"
"","","","#8 Best Sellers","in Electronic Learning & Education Toys","$3.46","-28%","","1pc 8.5 Inch Children's Drawing Board, Lcd Writing Tablet, Electronic Blackboard, Handwriting Board"
"","","","#5 Best Sellers","in Baby & Kids Socks","$3.00","-6%","","5pairs Spring/Summer Children's Socks For Boys, Basketball Style, Bright Colors, Cartoon, Breathable"
"","","","#7 Best Sellers","in Teen Shoes","$7.90","-15%","","Boys And Girls Travel Flat Sandals, Non-Slip Lightweight Stirrup Children's Slippers With Back Strap, Indoor Outdoor Comfortable Men And Women Sandal Slippers"
"","","","#8 Best Sellers","in Kids Foaming Slides","$9.70","-14%","","1pair Kids' Solid Color Round Toe Flat Eva Slippers With Anti-Slip Sole, Suitable For All Seasons, Beach, Shower, Casual"
"","","","","","$8.10","-8%","200+ sold recently","Young Girl 2pcs/Set Fashionable 3D Flower Tank Top And Shorts Set For Summer"
"","","","","","$12.00","-8%","2.5k+ sold recently","5pcs/Set Young Boy Quick-Dry Short Sleeve Sports T-Shirts"
"","","","","","$13.20","-13%","600+ sold recently","Girls' Fashionable Woven Flat Sandals"
"","","","","","$10.90","-15%","100+ sold recently","SHEIN Young Girl Cropped Woven Strapless Top And Loose Woven Casual Skirt Two-Piece Set With Floral Print"
"","","","","","$6.30","-15%","100+ sold recently","SHEIN Young Girl Woven Loose-Fit Fringed Casual Cover Up"
"","","","","","$3.30","-11%","600+ sold recently","Young Boy Comfortable Short Sleeve Solid Color Casual T-Shirt For Summer"
"6","","","","","$4.00","-15%","1.4k+ sold recently","SHEIN Young Boy's Car & Letter Print T-Shirt"
"4","","","","","$7.00","-13%","300+ sold recently","SHEIN Tween Girls' Summer Casual Knitted Round Neck Short Sleeve T-Shirt With Star Print"
"9","","","","","$9.50","-15%","2.6k+ sold recently","SHEIN Young Boy Two-Piece Set Of Daily Casual Color Matching Horse Riding Embroidered Short-Sleeved Tops And Shorts For Spring And Summer"
"","","","#7 Best Sellers","in Tween Girls Extended Size Clothing","$10.54","-15%","","SHEIN Tween Girl Extended Size Knit Ribbed Pleated T-Shirt And Bell Bottom Pants Casual Two-Piece Outfit"
"11","","","","","$4.30","-16%","1.4k+ sold recently","SHEIN Tween Boy Coconut Tree Print Marled Knit Tee"
"","","","","","$11.80","-15%","1.6k+ sold recently","SHEIN Young Girl Sweet & Simple Vintage Charm Flower Mesh Sleeves Top And Full Skirt Set"
"","","","","","$3.60","-50%","10+ sold recently","2pcs Boys' Summer Short Sleeve T-Shirt And Printed Shorts Set, Fashionable Casual Sportswear For Boys In Summer"
"","","","","","$9.20","-7%","1.1k+ sold recently","Tween Girls' Flower Bud Paisley Flower Print Beachwear Bikini Swimsuit Mommy And Me Matching Outfits (3 Sets Sold Separately)"
"","","","","","$4.10","-13%","200+ sold recently","Tween Girl Casual Simple Cartoon Horse Print Short Sleeve Round Neck T-Shirt, Suitable For Summer"
"","","","#2 Best Sellers","in Tween Girls Coats","$4.10","-13%","","SHEIN Tween Girl Holiday SpringSummer Sheer Woven Crop Sleeve Crop Open Cardigan"
"","","","","","$3.90","-9%","5.8k+ sold recently","Young Girl Virgin Mary Printing Short Sleeved T-Shirt"
"","","","","","$5.30","-13%","100+ sold recently","Tween Boys Simple & Casual Gamepad Print Round Neck Tank Top Suitable For Summer"
"","","","#8 Best Sellers","in Young Girls Sets","$9.80","-8%","","Young Girl Star Print Cold Shoulder Ruffle Trim Top & Americana Ripped Denim Shorts 4th Of July Outfits"
"","","","","","$12.90","-19%","700+ sold recently","Children's Simple Breathable Sneakers Boys Simple Slip-on Platform Sneakers"
"","","","","","$12.60","-6%","500+ sold recently","SHEIN Teen Girl Summer Washed Casual Simple All-Match Denim Shorts"
"7","","","","","$5.01","-54%","800+ sold recently","1pair Children's Purple Cartoon Princess Sandals, Water-Resistant, Anti-Slip, Breathable Home Shoes Suitable For Indoor, Outdoor, Beach In Summer"
"","","","","","$7.50","-14%","100+ sold recently","SHEIN Tween Girl Cool Street Style Knitted Tank Top And Knitted Solid Color Shorts Summer Outfits"
"","","","","","$3.60","-8%","300+ sold recently","Violet Mermaid Themed Children's Accessories Set"
"","","","","","$7.30","-8%","900+ sold recently","SHEIN Tween Girl Casual Sport Shorts With Anti-Light & Stretchy Underpants"
"","","","","","$7.40","-14%","500+ sold recently","Young Boy Cartoon Graphic Swimsuit"
"","","","#6 Best Sellers","in Teen Girls Shorts","$10.00","-13%","","SHEIN Teen Girls 2pcs Elastic Waist Track Shorts"
"","","","","","$10.50","-14%","200+ sold recently","Tween Boy Graffiti Pattern Short Sleeve T-Shirt And Cargo Shorts Set"
"","","","","","$6.90","-14%","900+ sold recently","SHEIN Tween Boy Casual Street Style Knitted Short Sleeve T-Shirt With V-Neck, Digital & Letter Print, Sporty Look"
"5","","","","","$5.28","-20%","500+ sold recently","Tween Girl Casual Dark Gray Round Neck Pullover Short Sleeve T-Shirt For Summer"
"","","","","","$7.30","-9%","400+ sold recently","Young Boy Summer Beach Coconut Tree Print Hawaiian Shirt & Shorts Set"
"","","","#8 Best Sellers","in Teen Girls Underwear","$9.20","-5%","","3pcs Teen Girls' Seamless Push-Up Bra, Comfortable And Breathable, Wire-Free, With Chest Gathers And Lifts, Prevents Sagging"
"","","","","","$12.10","-7%","200+ sold recently","SHEIN Tween Girl Summer Boho Trendy Stonewashed Roll Up Hem Ripped Denim Jeans Shorts,Girls Summer Clothes Outfits"
"","","","","","$16.30","-7%","200+ sold recently","SHEIN Tween Girl Y2K Trendy Cut Out Ripped Baggy Straight Leg Denim Jeans,Girls Summer Pants Outfits"
"","","","#6 Best Sellers","in Tween Boys Swimwear","$7.00","-8%","","Tween Boy Flamingo Print Drawstring Waist Swim Trunks"
"","","","","","$8.20","-15%","100+ sold recently","Young Boy 1set Random Tropical & Letter Graphic Round Neck Beach Swimsuit"
"","","","","","$8.80","-15%","100+ sold recently","Young Girls' Summer Beach Allover Print Layered Cami Top And Boyshorts Tankini Swimsuit Set"
"","","","","","$7.60","-15%","100+ sold recently","SHEIN Young Girl Snug Fit Butterfly & Flower Pattern Color Block Short Sleeve Long Pants Knitted Pajama Set"
"","","","","","$7.90","-11%","40+ sold recently","SHEIN Teen Girl Knitted White Waffle Textured Floral Short Sleeve Tee With Ruffle Hem"
"","","","","","$15.20","-14%","200+ sold recently","SHEIN Teen Boy 3pcs/Set Casual Loose-Fitting Short Sleeve Tops With English Letter Print, Multiple Outfits"
"","","","","","$11.40","-11%","300+ sold recently","Teen Girl Casual Simple Letter Pattern Short Sleeve Round Neck T-Shirt And Shorts Set Suitable For Summer"
"","","","","","$12.83","-12%","300+ sold recently","SHEIN Tween Boy 4pcs Casual Woven Beach Shorts Set"
"","","","","","$9.40","-15%","100+ sold recently","SHEIN Young Boy Camouflage Pattern Knitted Comfortable Breathable Boxer Briefs Four-Piece Set"
"5","","","","","$12.45","-8%","1.6k+ sold recently","SHEIN Tween Girl Summer Casual Solid Color Puff Sleeve Dress With Front Tie And Ruffle Hem"
"4","","","","","$8.20","-13%","200+ sold recently","Young Girl Solid Color Simple Casual Sports Tank Top"
"","","","","","$3.10","-9%","1.5k+ sold recently","1pc Flower Girl Headband, Korean Style Princess Forest-Style Floral Crown Headpiece, Wedding"
"","","","","","$9.40","-13%","1.8k+ sold recently","Boys Comic Pattern Hollow Out Vented Clogs For Summer"
"","","","","","$12.40","-13%","100+ sold recently","SHEIN 2pcs/Set Teen Boy Summer Casual Outfits, Plaid Bear Print Short Sleeve T-Shirt And Checkered Shorts Set"
"","","","","","$11.80","-7%","40+ sold recently","Young Girl's Summer Short Sleeve T-Shirt With Letter And Strawberry Print And Denim Skirt, Casual Outfit Set"
"","","","#2 Best Sellers","in Teen Foaming Slides","$10.70","-15%","","Cloud Pattern Boys Girls Slippers, Pillow Children Slides, Non-Slip Quick Drying Soft Lightweight Unisex Shower Sandals With Thick Sole Open Toe For Indoor Outdoor"
"","","","","","$1.70","-11%","700+ sold recently","1pc Pink Rhinestone Hair Bow For Girls,Exquisite Shining Rhinestone Bow Hair Clip,Elegant Bowknot Barrettes Alligator Clips,Holiday Wedding Party Headpiece,Kids Hair Accessories"
"","","","","","$8.90","-7%","2.0k+ sold recently","Tween Boy 2pcs Tropical Print Drawstring Swim Shorts"
"","","","","","$3.70","-14%","100+ sold recently","Toddler Boys' Casual Cute Cartoon Sunglasses Fish Pattern Round Neck Short Sleeve T-Shirt"
"","","","","","$13.60","-13%","300+ sold recently","SHEIN Teen Girl Large U-Neck Vest With Waist Drawstring And Arc Hem Cargo Pants Street Style Casual Two-Piece Set"
"","","","","","$9.50","-7%","200+ sold recently","Tween Girl Printed Bikini Swimsuit Set With Beach Skirt"
"","","","","","$3.36","-24%","3.1k+ sold recently","SHEIN Young Girl Chicken Print Tee"
"","","","","","$17.20","-15%","300+ sold recently","Young Boy 5pcs Bird Print Summer Casual Short Sleeve Tee"
"","","","","","$12.20","-19%","5.7k+ sold recently","1pair Baby's Sneakers Walking Shoes Light, Comfortable, Anti-slip, Casual"
"","","","","","$10.80","-20%","100+ sold recently","SHEIN Teen Boy Casual Loose Comfortable Basketball Themed Short Sleeve Top And Shorts Set, Versatile"
"","","","","","$11.20","-6%","90+ sold recently","Teenage Girls' One Piece Swimsuit With Random Print"
"","","","","","$5.18","-44%","400+ sold recently","SHEIN Tween Girl Breathable And Comfortable Plaid Printed Elastic Waist Wide-Leg Pants With Pockets"
"","","","","","$4.25","-42%","400+ sold recently","SHEIN Casual Red Basketball Print Knit T-Shirt For Tween Boys"
"4","","","","","$7.00","-13%","700+ sold recently","SHEIN Teen Girl Contrast Mesh Hanky Hem Tee"
"","","","","","$0.65","-66%","100+ sold recently","Children's Sunglasses For Baby Boys And Girls, Uv Protection Retro Round Frame Trendy Mirrored Lens Kids Eyewear"
"6","","","","","$3.60","-25%","200+ sold recently","SHEIN Tween Girl Lettuce Trim Rib-Knit Tee"
"","","","","","$13.30","-12%","800+ sold recently","SHEIN Teen Girls' Casual Sports White Wide Leg Pants With Drawstring Waistband And Lace Trim For Summer"
"","","","","","$5.80","-13%","300+ sold recently","Tween Boy Vacation College Style Coconut Tree & Beach Print Loose Fit Knit Short Sleeve T-Shirt"
"","","","","","$11.02","-19%","1.0k+ sold recently","2pcs Young Boy Casual Street Style Turn-Down Collar Half Zip Sweatshirt With Weaved Cuff And Shorts Knitted Outfit"
"","","","","","$9.50","-14%","100+ sold recently","SHEIN Young Girl Knitted Solid Round Neck Lamb Leg Sleeve Spliced Woven Geometric Pattern Loose Casual Jumpsuit"
"","","","","","$1.65","-50%","40+ sold recently","3Pcs Boys Girls Cute Beautiful Classic 3 Styles Flower Sunglasses Children Baby Fashion Sunglasses Protection Kids Eyewear"
"","","","","","$4.40","-10%","100+ sold recently","SHEIN Teen Girl Black And White Colorblock Camisole Top With Spaghetti Straps And Sweetheart Neckline"
"","","","","","$17.97","-33%","100+ sold recently","1pc Large Capacity Girls' Backpack, Casual & Fashionable Backpack, 15.6 Inch Laptop Backpack, Women's Double Shoulder Bag, School Backpack, With Luggage Trolley Sleeve, Outdoor Travel Bag, Suitable For Teenage Girls, School And Travel"
"","","","#3 Best Sellers","in Young Boys Tops","$10.45","-19%","","SHEIN Young Boy 4-Pack Solid Casual Tank Tops"
"","","","","","$11.40","-6%","700+ sold recently","SHEIN Teen Girl Stretchy And Washed High-Rise Denim Shorts For Casual And Fashionable Look"
"4","","","","","$11.20","-13%","200+ sold recently","SHEIN Teen Boy Casual Video Game Console English Printed T-Shirt And Shorts Set, Summer, Cotton Blend, Traceable Cotton"
"","","","","","$14.50","-16%","900+ sold recently","SHEIN Young Boy 3pcs/Set Cool Fashion Sleeveless Jacket, Short-Sleeve T-Shirt & Pants Outfit"
"","","","","","$8.60","-5%","300+ sold recently","Teen Girl Floral Print Ruffled One-Piece Swimsuit With Spaghetti Straps"
"","","","","","$15.80","-19%","3.2k+ sold recently","Kids' Chunky Sneakers Sports Shoes"
"","","","","","$9.24","-23%","400+ sold recently","SHEIN Tween Boy Paisley Print Short Sleeve And Shorts Two Piece Set For Summer"
"6","","","","","$5.80","-6%","100+ sold recently","Tween Girl Casual Palm Tree & Letter Print Round Neck Pull-Over Short Sleeve T-Shirt, Summer"
"","","","","","$16.90","-7%","800+ sold recently","SHEIN Tween Girl Zipper Fly Wide Leg Jeans"
"","","","","","$2.90","-9%","300+ sold recently","1pc 4th Of July Independence Day Headbands For Girls ,Ameicican Flag Decor Patriotic Hairbands, Kids Hair Accessories"
"","","","","","$3.20","-16%","200+ sold recently","Young Boy Casual Minimalist Vacation Themed Sleeveless Tank Top Suitable For Summer"
"10","","","#1 Best Sellers","in Teen Heeled Sandals","$15.90","-15%","","Teenage Girls' High-Heeled Sandals With Open Toe And Ankle Strap In Black, Large Size, Medium Heel"
"","","","","","$12.70","-13%","100+ sold recently","SHEIN Teenage Boys'  Character Print Cotton Short Sleeve T-Shirt And Shorts Set"
"","","","","","$8.40","-15%","2.7k+ sold recently","SHEIN Genkimix Kids Young Boy Half Button Tee & Roll Up Hem Shorts"
"","","","#9 Best Sellers","in Young Girls Denim Shorts","$11.90","-14%","","Young Girls' Basic Casual Elastic Waist Rolled Hem Multicolored Denim Shorts 2pcs/Set"
"","","","","","$7.10","-12%","800+ sold recently","Tobefonseca Dark Big Girls' Cartoon Letter Printed Short Sleeve T-Shirt For Summer"
"","","","","","$9.10","-6%","80+ sold recently","(All Accessories Are Paint And Powder Free)Kids Girls Makeup Set Girls Pretend Makeup Set, Washable Toddler Makeup Toy Set With Princess Makeup Bag Ages 3+"
"","","","","","$14.10","-6%","100+ sold recently","SHEIN Bubble Crinkled Double Layered Skirted Cami Dress For Teen Girls"
"4","","","","","$5.40","-11%","600+ sold recently","Tween Girls' American Independence Day Festival Y2K Heart Swag Cool T-Shirt"
"5","","","#6 Best Sellers","in Young Boys T-Shirts","$4.55","-16%","","SHEIN Young Boy Casual Cartoon Pattern Short Sleeve Round Neck T-Shirt, Summer"
"","","","","","$23.00","-8%","100+ sold recently","Tween Boy Patched Frayed Casual Jeans"
"","","","","","$6.20","-10%","90+ sold recently","Teen Girl Pressed Flowers T-Shirt, Boho Wildflowers Shirt, Plant Shirts, Vintage Botanical Tee, Pastel Floral Nature Shirt, Garden Lover Gift, Casual Short Sleeve Tee Suitable For Summer"
"","","","#3 Best Sellers","in Tween Boys Extended Size Clothing","$6.48","-40%","","SHEIN Tween Boys Extended Size Casual Coconut Tree Printed Short-Sleeve Shirt With Lapel And Shorts Weave Two-Piece Suit With Slanted Pockets"
"4","","","","","$11.20","-6%","1.0k+ sold recently","SHEIN Teen Girl Ditsy Floral Print Ruched Bust Cami Dress"
"","","","","","$6.80","-27%","100+ sold recently","SHEIN Young Boy 2pcs Casual Smiling Face Tie-Dye Printed Short Sleeve T-Shirt And Shorts Set, Suitable For Summer"
"","","","","","$8.50","-13%","300+ sold recently","Tween Boy Basic Round Neck Short Sleeve T-Shirt And Shorts Set For Daily Wear"
"","","","","","$20.20","-16%","50+ sold recently","Young Girl Woven Solid Color Turn-Down Collar Gigot Sleeve Cardigan And Woven Floral Elegant Skirt Set"
"","","","","","$10.99","","70+ sold recently","JNSQ Tween Girl Knitted Solid Color Sleeveless Dress With Shorts, Casual And Sporty"
"4","","","","","$2.50","-7%","7.7k+ sold recently","Cartoon Pattern Jade Dog  Melody One Shoulder Crossbody Chest Bag Oxford Cloth Baby Accessory Bag"
"","","","","","$3.80","-14%","100+ sold recently","Girls' Cartoon Cow & Letter Slogan Printed Short Sleeve T-Shirt, Casual"
"","","","","","$4.20","-14%","200+ sold recently","GARFIELD X SHEIN Young Boy Casual Cartoon Printed Funny Short Sleeve T-Shirt, Summer"
"13","","","","","$10.80","-14%","600+ sold recently","SHEIN Tween Girl Solid Cami Top & Wide Leg Pants"
"","","","","","$4.00","-39%","100+ sold recently","SHEIN Tween Girls' Full Print Alphabet & Heart Pattern Short Sleeve T-shirt"
"","","","","","$3.10","-9%","300+ sold recently","1pc Children Girls' Solid Color USA Independence Day Theme Red/Blue/White Faux Pearl & Rhinestone Decorated 6cm Wide Headband With Simple Knot, Suitable For Festivals, Runway Shows, Etc."
"","","","","","$8.60","-5%","100+ sold recently","SHEIN Teen Girl Knitted Geometric Pattern Vacation Casual Spaghetti Strap Dress"
"5","","","","","$4.00","-13%","200+ sold recently","SHEIN Young Girl Toddler Girls Solid Ruffle Hem Skirt"
"","","","","","$11.10","-15%","300+ sold recently","3pcs/Set Young Boy Casual College Style Solid Color Shorts With Elastic Waist And Decorative Rope"
"","","","#6 Best Sellers","in Streetwear","$11.20","-14%","","SHEIN Tween Boy Casual Street Cool Cartoon Bear Print Round Neck Pullover Short Sleeve T-Shirt Pure Color Shorts Knitted Two-Piece"
"","","","","","$9.60","-15%","100+ sold recently","SHEIN Young Girl Knitted Solid Color Polo Collar Bodycon Dress With Knitted Solid Color Shorts Sports Suit Set"
"","","","","","$8.69","-26%","400+ sold recently","Girls Tropical Print High Neck Bikini Swimsuit"
"","","","","","$14.10","-15%","90+ sold recently","5pcs Young Boy Casual Korean Style Plain Round Neck Short Sleeve T-Shirt, Multicolor Pack (5 Colors In Each Pack)"
"4","","","#7 Best Sellers","in Tween Boys Suits","$11.50","-7%","","SHEIN Gentleman Style 2pcs/Set Vest With Chest Pocket & Suit Pants For Tween Boys, Suitable For Formal Occasions Like Birthday Party, Evening Party, Performance, Wedding, Etc. Shirt And Accessories Are Not Included."
"6","","","","","$11.30","-14%","1.3k+ sold recently","SHEIN 3pcs/Set Knitted Color-Block Loose-Fit Shorts With Contrast Hem For Tween Girls"
"4","","","","","$11.10","-6%","1.0k+ sold recently","Teen Girls Tropical Print Wrap Bikini Swimsuit With Swim Shorts"
"12","","","","","$8.20","-15%","100+ sold recently","SHEIN Young Girl Drop Shoulder Ribbed Knit Tee & Leggings"
"","","","","","$3.40","-13%","100+ sold recently","Young Girl 3D Cartoon Dogs Graphic Tee, Casual & Simple Short Sleeve T-Shirt With Cartoon Dogs Pattern For Summer"
"","","","","","$10.70","-14%","100+ sold recently","SHEIN Young Girl Woven Floral Square Neck Ruffle Trimmed Casual Dress"
"","","","","","$11.70","-14%","60+ sold recently","Tween Boy Casual Football Printed Glow-In-The-Dark Green Round Neck Short Sleeve T-Shirt And Shorts Knitted 2pcs Outfits"
"","","","","","$10.30","-13%","200+ sold recently","Young Girl Lovely Casual Ladylike Heart-Shaped Strap Dress Set, Valentine's Day, Summer"
"","","","","","$4.21","-16%","100+ sold recently","Tween Boy Casual Simple Cartoon Animal Print Round Neck Top, Suitable For Summer"
"","","","","","$13.70","-14%","2.9k+ sold recently","SHEIN Tween Boy's Stylish Coconut Tree Printed Vest And Shorts Set For Leisure Wear"
"","","","","","$10.50","-13%","100+ sold recently","SHEIN Tween Girl Fashionable Street Style Punk Casual Short Sleeve Top And Long Pants Two-Piece Set"
"","","","","","$3.20","-30%","100+ sold recently","SHEIN Young Girl Toddler Girls Stand Collar Lettuce Trim Tee"
"9","","","","","$12.80","-6%","900+ sold recently","SHEIN Teen Girl Flutter Sleeve Square-Neck Shirred Dress"
"","","","","","$23.87","-46%","100+ sold recently","Children's Autumn And Winter Double Wheel Sneakers, Sports Shoes"
"","","","","","$13.90","-6%","100+ sold recently","Teen Girl Fashionable Summer Beach Holiday Printed Swimsuit Set"
"4","","","","","$5.70","-11%","400+ sold recently","SHEIN Teen Girls Ruched Bust Tie Front Puff Sleeve Crop Tee"
"4","","","#3 Best Sellers","in Young Girls One-Pieces","$8.30","-15%","","Young Girls' One-Piece Swimsuit With Seashell Decor & Mesh Splicing Front"
"6","","","#1 Best Sellers","in Baby & Kids Tights","$5.90","-8%","","4pcs Girls' Safety Shorts, Thin Anti-Chafing Underwear, Assorted Colors"
"4","","","","","$8.90","-7%","600+ sold recently","Tween Girls' Solid Color Textured Bikini Swimwear Set"
"","","","","","$6.30","-10%","20+ sold recently","Teen Girl's Summer Casual Dolphin Print Short Sleeve Round Neck T-Shirt"
"","","","","","$6.60","-25%","100+ sold recently","SHEIN Young Boy Snug Fit Cartoon Car Pattern Color-Block Round Neck Short Sleeve Shorts Knitted 2-Piece Homewear Pajamas Set"
"5","","","","","$10.08","-16%","700+ sold recently","Tween Girl Leaf Print Zipper Front Bikini Swimsuit"
"","","","","","$10.90","-15%","200+ sold recently","SHEIN Young Girl Solid Color Sleeveless Knitted Round Neck Casual Sports Jumpsuit Dress"
"","","","","","$1.70","-11%","600+ sold recently","1pc Zinc Alloy Ballet Dancing Girl Pendant Necklace For Little Girls, Pink Resin Inlayed Rhinestone Pendant, Size: 6x2cm; Suitable For 7-14 Years Old Girls For Daily Use"
"","","","","","$5.15","-43%","1.1k+ sold recently","SHEIN Young Boy Coconut Tree Print Tank Top & Drawstring Waist Shorts"
"","","","","","$17.10","-6%","800+ sold recently","SHEIN Teen Girls Wide Leg Jeans"
