"color-count","goods-title-link--jump","goods-title-link--jump href","rank-title","rank-sub","price","discount","selling_proposition","goods-title-link"
"","","","","","$17.20","-14%","400+ sold recently","Young Girl 3pcs/Set Fashionable Leopard Love Letter Slogan Print Short Sleeve T-Shirt And Leggings Set"
"4","","","","","$7.10","-15%","800+ sold recently","SHEIN Tween Girl Round Neck Flower Pattern Mesh T-Shirt Inside With Strap Camisole And Vest Four Pieces Set"
"","","","","","$7.22","-12%","600+ sold recently","Tween Girl 2pcs Printed Bra & Bikini Bottom 4th Of July Bikini Set, For Summer Beach"
"4","","","#4 Best Sellers","in Teen Girls Clothing","$11.80","-6%","","SHEIN Teen Girls Ripped Raw Hem Denim Shorts"
"","","","","","$6.63","-15%","100+ sold recently","Teen Girl Summer Vacation Style Plant Printed Spaghetti Strap Dress"
"11","","","#1 Best Sellers","in Kids Fashion Glasses","$4.00","-7%","","4pcs Heart Shaped Fashionable Glasses Set For Boys And Girls, Suitable For Daily Use"
"","","","#6 Best Sellers","in Tween Girls Sweaters","$8.70","-14%","","SHEIN Tween Girl Checker Print Sweater Vest Without Tee"
"","","","","","$12.80","-15%","500+ sold recently","SHEIN Tween Girl Ruffle Trim Top & Floral Print Ruffle Hem Skirt"
"","","","","","$5.70","-8%","10k+ sold recently","10 pairs/pack random color children's autumn winter summer solid color simple socks, suitable for sports and leisure daily travel the best choice"
"","","","","","$9.30","-6%","700+ sold recently","Teen Girl Twist Front Ruched Side One Piece Swimsuit"
"4","","","","","$12.77","-8%","4.0k+ sold recently","SHEIN Tween Boy Ripped Frayed Bleach Wash Denim Shorts"
"","","","#2 Best Sellers","in Tween Girls Cardigans","$9.80","-15%","","SHEIN Tween Girl 3d Flower Decorated Hollow Out Knitted Cardigan"
"","","","","","$4.48","-29%","200+ sold recently","1pc Fashionable Basketball Pattern Printed Basic Round Neck Short Sleeve T-shirt For Tween Boys"
"","","","","","$3.45","-46%","700+ sold recently","1pc Tween Boys Basic Round Neck Short Sleeve T-Shirt With Cartoon & Letter Print"
"4","","","","","$4.88","-20%","600+ sold recently","SHEIN Tween Girls' Letter & Flower Pattern Short Sleeve T-shirt"
"7","","","","","$18.30","-14%","1.3k+ sold recently","SHEIN Tween Girls' Casual Sports Streetwear Vest Top And Overalls Set"
"","","","#9 Best Sellers","in Tween Girls Pajamas","$14.00","-7%","","Tween Girl Cherry Print Short Sleeve Cardigan And Shorts Casual 2pcs/Set Homewear"
"","","","#4 Best Sellers","in Tween Girls Denim Two-piece Outfits","$20.39","-8%","","Tween Girls Fashionable Casual Sleeveless Top And Shorts Denim Set"
"","","","","","$9.20","-6%","1.1k+ sold recently","SHEIN Tween Girl Cold Shoulder Ruffle Trim Dress"
"","","","#8 Best Sellers","in Young Boys T-Shirts","$5.10","-9%","","Young Boy Street Fashion Cartoon Print Round Neck T-Shirt For Summer"
"","","","","","$4.46","-16%","400+ sold recently","GARFIELD X SHEIN Young Boy Casual Cartoon Printed Short Sleeve T-Shirt, Summer"
"","","","","","$15.50","-7%","200+ sold recently","SHEIN Tween Girl 3pcs Sleepwear Set, Including Avocado Printed Camisole, Shorts And Long Pants"
"","","","","","$7.39","-16%","100+ sold recently","Tween Girls' Round Neck Butterfly Printed Casual Dress With Cut Out Shoulder Design"
"5","","","","","$7.50","-15%","2.7k+ sold recently","SHEIN Young Girl 2pcs/Set Casual Tie Dye Letter Print Short Sleeve Round Neck T-Shirt And Shorts Summer Outfits"
"","","","","","$15.20","-7%","3.4k+ sold recently","Young Girl Letter Printed Short Sleeve T-Shirt And Shorts Set"
"","","","","","$4.00","-7%","600+ sold recently","Young Girl Slogan Printed T-Shirt"
"7","","","#2 Best Sellers","in Tween Boys Shirts","$6.80","-14%","","SHEIN Tween Boy Solid Color White Casual Basic Pocket Spring Autumn Winter Turn-Down Collar Shirt"
"","","","","","$3.90","-7%","200+ sold recently","Tween Girl 1pc Black Striped Tank Top, Casual And Simple, Spring And Summer"
"","","","","","$17.20","-14%","400+ sold recently","Young Girl 3pcs/Set Fashionable Leopard Love Letter Slogan Print Short Sleeve T-Shirt And Leggings Set"
"4","","","","","$7.10","-15%","800+ sold recently","SHEIN Tween Girl Round Neck Flower Pattern Mesh T-Shirt Inside With Strap Camisole And Vest Four Pieces Set"
"","","","","","$7.22","-12%","600+ sold recently","Tween Girl 2pcs Printed Bra & Bikini Bottom 4th Of July Bikini Set, For Summer Beach"
"4","","","#4 Best Sellers","in Teen Girls Clothing","$11.80","-6%","","SHEIN Teen Girls Ripped Raw Hem Denim Shorts"
"","","","","","$12.80","-15%","500+ sold recently","SHEIN Tween Girl Ruffle Trim Top & Floral Print Ruffle Hem Skirt"
"","","","","","$5.70","-8%","10k+ sold recently","10 pairs/pack random color children's autumn winter summer solid color simple socks, suitable for sports and leisure daily travel the best choice"
"","","","","","$9.30","-6%","700+ sold recently","Teen Girl Twist Front Ruched Side One Piece Swimsuit"
"4","","","","","$12.77","-8%","4.0k+ sold recently","SHEIN Tween Boy Ripped Frayed Bleach Wash Denim Shorts"
"","","","","","$3.45","-46%","700+ sold recently","1pc Tween Boys Basic Round Neck Short Sleeve T-Shirt With Cartoon & Letter Print"
"4","","","","","$4.88","-20%","600+ sold recently","SHEIN Tween Girls' Letter & Flower Pattern Short Sleeve T-shirt"
"7","","","","","$18.30","-14%","1.3k+ sold recently","SHEIN Tween Girls' Casual Sports Streetwear Vest Top And Overalls Set"
"","","","","","$9.20","-6%","1.1k+ sold recently","SHEIN Tween Girl Cold Shoulder Ruffle Trim Dress"
"6","","","#9 Best Sellers","in Tween Girls Pants","$14.60","-15%","","SHEIN Solid Color Casual Spring And Summer Tween Girls' Cargo Pants With Side Flap Pockets"
"","","","","","$3.90","-15%","3.5k+ sold recently","SHEIN Young Girl Skull, Bull Head And Floral Print Short Sleeve T-Shirt"
"4","","","#10 Best Sellers","in Tween Boys Sets","$10.55","-18%","","SHEIN Tween Boys' Playful Vacation Style Short Sleeve T-Shirt And Shorts"
"","","","","","$5.68","-8%","1.4k+ sold recently","Tween Boys' Casual Fun Letter Checker Print Round Neck Pullover Short Sleeve T-Shirt For Summer"
"4","","","","","$9.07","-63%","400+ sold recently","SHEIN Teen Girls Flap Pocket Wide Leg Cargo Jeans"
"","","","","","$8.70","-14%","60+ sold recently","SHEIN Teen Boy Loose Sports Hooded Top And Shorts Set With Letter Print"
"","","","","","$9.30","-12%","800+ sold recently","Teen Boy Cartoon Astronaut & Moon Printed T-Shirt And Letter Printed Shorts Set"
"","","","","","$9.90","-15%","3.0k+ sold recently","SHEIN Young Boy 3pcs Solid Tie Front Shorts"
"4","","","#2 Best Sellers","in Tween Girls Denim Jackets & Coats","$14.80","-8%","","Tween Girl Flap Pocket Raw Hem Crop Denim Jacket"
"","","","","","$11.20","-15%","600+ sold recently","SHEIN Young Girl Ribbed Tank Dress"
"","","","","","$11.65","-34%","300+ sold recently","3sets  Boy's Casual Summer Outfits, Coconut Tree Graphic Short Sleeve T-Shirt + Shorts Sets"
"4","","","","","$8.00","-5%","1.0k+ sold recently","SHEIN Teen Girl's Small Flower Printed Bikini Set With Spaghetti Straps"
"","","","#5 Best Sellers","in Tween Boys Tanks","$13.00","-13%","","Tween Boy 4pcs Summer Simple Casual Round Neck Sleeveless Tank Top"
"","","","","","$4.10","-45%","1.3k+ sold recently","SHEIN Young Girl Flying SleeveColorblock Floral Pencil Dress"
"","","","","","$5.90","-8%","10+ sold recently","Sweet Girl's Bow Decor Floral Romper, Casual Romper For Summer Holiday Outdoor Gift Party"
"","","","#4 Best Sellers","in Teen Boys Tops","$7.40","-13%","","Teen Boy Casual Simple Letter & Expression Pattern Short Sleeve T-Shirt, Suitable For Summer"
"","","","","","$5.10","-15%","1.6k+ sold recently","Young Girl Mommy And Me Matching Outfits
(2 Pieces Are Sold Separately)"
"","","","#2 Best Sellers","in Tween Girls Blouses","$6.00","-15%","","SHEIN Tween Girls' Woven Solid Color Floral Square Collar Ruffle Strap Casual Vacation Shirt"
"5","","","","","$8.80","-5%","300+ sold recently","SHEIN Teen Girl Summer Beach Swimsuit"
"8","","","","","$4.45","-46%","200+ sold recently","SHEIN Young Girl Casual Holiday Cake Tiered Ruffle Square Neck Dress"
"","","","","","$9.90","-5%","600+ sold recently","SHEIN Teen Girls' Knitted Ribbed Waist Pleated Slit Casual Dress"
"","","","","","$11.60","-15%","100+ sold recently","4pcs Young Boy Casual Loose Fit Shorts, Perfect For Travel, Schooling, Spring And Summer"
"12","","","","","$7.30","-14%","2.2k+ sold recently","SHEIN Young Girl Summer Casual Striped Short Sleeve Top And Shorts"
"","","","","","$6.20","-7%","300+ sold recently","Young Boy Summer Fashionable Short Sleeve Shirt And Shorts Set, Apricot"
"4","","","","","$8.90","-15%","600+ sold recently","SHEIN Young Girl Fresh Color Block Cute Summer Suspender Skirt"
"6","","","","","$4.10","-13%","900+ sold recently","SHEIN Tween Girl Summer Casual Solid Color Short Sleeve Lettuce Hem Ribbed Knit Tee"
"8","","","#6 Best Sellers","in Young Girls Activewear","$7.50","-14%","","Young Girl Solid Color Sleeveless Tank Top And Skorts Summer Sports Outfit"
"","","","","","$3.25","-35%","500+ sold recently","SHEIN Young Girl Fashionable Glittery Decorated Dress"
"","","","","","$9.50","-8%","300+ sold recently","Tween Boy Sportswear Two-Piece Set, Casual And Versatile USA Letter Print Set, Suitable For Older Children"
"4","","","","","$3.20","-16%","300+ sold recently","Young Boys' Casual Solid Color Summer Shorts"
"","","","","","$8.29","-44%","700+ sold recently","SHEIN Tween Boys' Casual Summer Holiday Style Striped Knitted Round Neck Tank Top"
"","","","#5 Best Sellers","in Teen Girls Dresses","$12.90","-6%","","SHEIN Teen Girls' Flower Pattern Mesh Pleated Cami Dress"
"","","","","","$9.90","-7%","1.3k+ sold recently","2pcs/Set Tween Boy Casual Letter Print Hooded Vest And Shorts Summer Outfits"
"4","","","","","$7.90","-7%","700+ sold recently","Tween Girl Solid Color Hollow Out Spaghetti Straps Bikini Separates Swimwear Set For Summer"
"","","","#5 Best Sellers","in Young Girls Dresses","$11.80","-8%","","Young Girl Summer New 3pcs Spaghetti Strap Dress Set"
"","","","","","$7.80","-6%","700+ sold recently","Tween Girl Tropical Print Bikini Swimsuit"
"4","","","","","$5.14","-33%","900+ sold recently","Young Girl's Floral Printed Cami Top & Elastic Waist Shorts Set"
"","","","","","$7.70","-7%","40+ sold recently","Tween Girl Floral Bowknot Bikini Set, 2pcs Clean And Well-Fit Swimsuit For Summer Beach Vacation"
"4","","","#9 Best Sellers","in Teen Girls One-Pieces","$11.00","-6%","","Teen Girls' One-piece Swimsuit"
"5","","","","","$6.30","-16%","1.2k+ sold recently","SHEIN Young Girl Floral Printed Cami Top And Shorts Set"
"4","","","","","$1.80","-10%","2.1k+ sold recently","1pc Back-To-School Blue Hidden Ribbon Bow Hair Clip With Long Ribbon"
"","","","#3 Best Sellers","in Teen Girls Jeans","$16.50","-6%","","SHEIN Streecool Kids Vintage Street Style Casual Loose Distressed Teen Girls' Blue Denim Wide Leg Pants"
"9","","","","","$9.80","-15%","700+ sold recently","SHEIN Young Boy Striped Print Tee & Shorts & Bag"
"","","","","","$5.40","-5%","500+ sold recently","Teen Girl 4pcs Solid Brief"
"","","","","","$10.03","-26%","2.3k+ sold recently","SHEIN Genkimix Kids Tween Girl 4pcs Round Neck Tee"
"4","","","","","$3.60","-10%","400+ sold recently","Teen Girl Round Neck Sleeveless Solid Color Tank Top Blouse"
"","","","","","$6.83","-25%","","SHEIN Tween Girls' Extended Size Tie Dye Pattern Short Sleeve T-Shirt And Pants Set With Round Neck"
"","","","#2 Best Sellers","in Tween Girls Denim Overalls & Jumpsuits","$12.80","-7%","","SHEIN Tween Girl Summer Boho Trendy Cute Knot Shoulder Ruched Bust Cami Baggy Denim Jumpsuit Romper,Girls Summer Vacation Clothes Outfits"
"","","","","","$7.30","-50%","100+ sold recently","SHEIN Tween Girl Casual Tank Top And Pants Set With Bowknot Decor"
"","","","","","$5.60","-15%","400+ sold recently","Young Girl One-Piece Swimsuit (Little Kid) With Random Digital Print"
"","","","","","$12.00","-14%","600+ sold recently","Teen Boy Color Block Patchwork T-Shirt And Shorts Set For Summer"
"","","","#6 Best Sellers","in Kids Bracelets","$1.80","-10%","","2pcs WWJD Letter Embroideried Woven Wristband Bracelets Protection Pray Bracelets Inspirational Christian Jewelry For Family Friend Boys Girls"
"8","","","","","$5.35","-37%","600+ sold recently","SHEIN Tween Girl Casual Printed Short Sleeve Car & Letter Pattern Drop Shoulder T-Shirt"
"11","","","","","$5.70","-16%","300+ sold recently","SHEIN Young Girl Summer Autumn Tropical Patterned Fresh Vacation & Casual Outdoor Play Jumpsuit"
"10","","","#4 Best Sellers","in Teen Shoes","$4.87","-58%","","Teenagers' Leisure Anti-Slip Wear-Resistant Pu Round Toe Flat Fashion Women's Slippers For Summer Vacation, Beach, Euopean And American Styles"
"5","","","#5 Best Sellers","in Young Boys Sweatpants","$13.20","-14%","","SHEIN Young Boy 3pcs Solid Tie Front Sweatpants"
"","","","#6 Best Sellers","in Tween Girls Tankinis","$9.90","-5%","","Tween Girl Color Block Ruffle Hem Bikini Swimsuit"
"","","","","","$6.00","-13%","1.1k+ sold recently","Young Girl Cute Cartoon Printed Dress, Casual And Comfortable Swing Hem Dress Suitable For Parties And Vacation"
"","","","","","$9.10","-15%","2.0k+ sold recently","SHEIN Young Boy Car & Letter Graphic Tee & Shorts"
"","","","","","$6.21","-25%","400+ sold recently","Tween Girl Slogan Graphic Thermal Lined Sweatshirt"
"4","","","","","$9.90","-13%","900+ sold recently","Tween Girl Knitted Pleated Skorts For Sports And Street Fashion"
"","","","","","$7.00","-15%","600+ sold recently","SHEIN Young Girl Knitted Solid Color Sleeveless Top With Shoulder Cutouts And Woven Loose-Fit Floral Print Casual Vacation Shorts Set"
"","","","","","$3.80","-7%","500+ sold recently","Tween Girl Vacation Casual Solid Hollow-Out Cover Up Top And Shorts"
"","","","","","$9.40","-15%","3.7k+ sold recently","SHEIN Young Girl Cartoon Graphic Tee & Overall Romper"
"","","","","","$19.50","-6%","2.3k+ sold recently","SHEIN Teen Girls Floral Print Wide Leg Jeans"
"5","","","","","$17.00","-14%","1.2k+ sold recently","SHEIN Teen Boys' Casual Woven Label Drawstring Shorts, Summer, Multi-Pack"
"","","","","","$10.95","-25%","700+ sold recently","SHEIN Teen Girls' Knitted Trim T-shirt And Flared Pants Casual Outfit Set"
"10","","","","","$4.10","-13%","1.9k+ sold recently","SHEIN Tween Girl Casual Minimalist Five-Pointed Star & Slogan Print Short Sleeve T-Shirt Suitable For Summer"
"","","","","","$1.29","-70%","100+ sold recently","SHEIN Young Girl Slogan Graphic Tee"
"6","","","","","$13.80","-15%","2.2k+ sold recently","SHEIN Tween Girl 2pcs/Set Long Sleeve Jacket And Floral Strappy Dress Set"
"","","","#1 Best Sellers","in Kids Waist Bags","$2.50","-7%","","1pc Boys And Girls Nylon Zipper Close Stylish Letter Chest Bag, All-In-One Casual Bag Suitable For Everyday Use"
"","","","","","$14.60","-13%","200+ sold recently","SHEIN Tween Girl Casual Knitted Short Sleeve Round Neck Top And Straight Pants Set For Spring/Summer"
"","","","","","$9.20","-12%","200+ sold recently","Tween Girl Casual American Flag Print Short Sleeve T-Shirt And Shorts 2pcs Outfit For Summer"
"4","","","","","$6.05","-37%","300+ sold recently","SHEIN Young Girl Top With Ruffle Trim And Paperbag Waist Pants, 2pcs/Set"
"","","","","","$6.30","-9%","1.0k+ sold recently","Young Boy Fashionable Bear Printed Short Sleeve Top And Knitted Shorts Casual Outfit"
"","","","","","$4.20","-14%","100+ sold recently","SHEIN Tween Girl Leopard Pattern Woven Short Sleeve Pullover Shirt, Perfect For Spring/Summer Vacation"
"5","","","#9 Best Sellers","in Teen Girls Bikini Sets","$8.17","-10%","","SHEIN Teen Girls Dalmatian Print Ring Linked Bikini Swimsuit"
"5","","","#7 Best Sellers","in Kids Hair Accessories","$1.73","-14%","","10Pcs/Set New Cute Ribbon Bowknot Hair Clips For Kids Handmade Baby Girls Hair Accessories"
"4","","","","","$11.20","-14%","200+ sold recently","SHEIN Teen Boys' Casual Fit Paisley  Pattern Full Print Shorts With Blue And Black Drawstring, Summer"
"","","","","","$6.70","-7%","1.2k+ sold recently","Tween Girl Floral Print Bikini Swimsuit"
"13","","","","","$11.50","-14%","4.3k+ sold recently","Tween Girl Casual Simple Cartoon Printed T-Shirt 3pcs/Set, Black, Pink & Apricot, Suitable For Summer"
"4","","","","","$5.70","-11%","900+ sold recently","SHEIN Teen Girls Ruched Bust Tie Front Tee"
"","","","","","$8.00","-13%","100+ sold recently","Tween Girl Casual Simple Cartoon Cat Pattern Short Sleeve T-Shirt And Shorts Set, Summer"
"","","","","","$7.80","-13%","100+ sold recently","Tween Girl Casual Simple Heart And Milk Print Short Sleeve T-Shirt And Shorts 2pcs Set For Summer"
"","","","","","$3.65","-43%","300+ sold recently","SHEIN Tween Boy Casual Basketball & Letter Print Short Sleeve T-Shirt"
"5","","","","","$3.70","-8%","1.3k+ sold recently","5 Pairs Expression Print Socks, Comfy & Cute Cartoon Crew Socks, Children's Stockings & Hosiery"
"","","","","","$11.40","-12%","200+ sold recently","SHEIN Teen Girl Black/White Casual Sleeveless/Short Sleeve Basic T-Shirt Tops 4-Piece Set"
"","","","","","$12.60","-14%","1.6k+ sold recently","SHEIN Tween Girl Cut Out Tank Top & Flap Pocket Cargo Pants"
"","","","","","$12.40","-12%","","Teenagers' Casual Vacation Style Cropped Knitted Cover Up, White With Wide Neckline And Flared Long Sleeves, Can Be Worn Over Inner Tank Top, Sun Protection Cover-Up, Half Mesh Crochet Design, Sassy Top"
"11","","","#2 Best Sellers","in Kids Sandals","$14.30","-13%","","Girls' Cute Beige Bow Knot Flat Sandals For Daily Casual, Holidays, Beach"
"14","","","","","$6.30","-14%","2.7k+ sold recently","SHEIN Genkimix Kids Young Boy Striped Print Tee & Shorts"
"5","","","","","$12.10","-14%","200+ sold recently","SHEIN Tween Girl Summer Solid Color Round Neck Top And Flower Printed Pleated Wide-Leg Pants Casual Loose 2-Piece Outfit"
"","","","","","$10.30","-15%","400+ sold recently","SHEIN Young Girl Ombre Puff Sleeve Pleated Hem Dress"
"","","","#9 Best Sellers","in Tween Boys Swimwear","$7.50","-7%","","Tween Boy Palm Tree Print Swim Shorts"
"5","","","","","$5.90","-16%","2.3k+ sold recently","SHEIN Young Girl Colorblock Bow Shoulder Cami Dress"
"","","","","","$7.30","-9%","5.2k+ sold recently","2pcs Young Boys' Casual Palm Tree & Waves Sunglasses Slogan Allover Print Vest And Palm Tree & Waves Patterned Shorts With Hat, Suitable For Summer, Outdoor, Casual, Beach Vacation, And Travel"
"11","","","","","$7.90","-12%","1.1k+ sold recently","SHEIN Tween Girl Mock Neck Tank Top & Paperbag Waist Shorts"
"6","","","#4 Best Sellers","in Young Boys Denim Shorts","$9.80","-15%","","Young Boy Daily Boho Street Casual Casual Destroy Raw Hem Elastic Waist Denim Shorts"
"5","","","","","$9.10","-7%","1.1k+ sold recently","Tween Girl Solid Crisscross Back Bikini Swimsuit"
"","","","","","$3.80","-10%","800+ sold recently","Young Boy Slogan Printed Casual Short Sleeve T-Shirt"
"","","","#1 Best Sellers","in Tween Boys Activewear","$13.49","-12%","","SHEIN 2pcs/Set Tween Boys' Color-Blocked Drawstring Patterned Leggings & Athletic Shorts Set"
"5","","","","","$13.90","-14%","900+ sold recently","SHEIN Tween Girl Butterfly Print Cami Top & Tee & Sweatpants Set"
"","","","","","$16.89","-34%","300+ sold recently","SHEIN Tween Boy 3pcs Letter Graphic Elastic Waist Thermal Lined Sweatpants"
"","","","","","$3.55","-50%","60+ sold recently","2pcs Boys' Summer Outfit - Cartoon Car Printed Short Sleeved T-Shirt And Shorts, Fashionable, Casual And Comfortable"
"","","","","","$10.60","-12%","300+ sold recently","SHEIN Teenage Girls' Knitted Butterfly Embroidery & Printed Casual Lettuce Trim Short Sleeve Summer T-Shirt Set Of 3"
"6","","","","","$5.60","-13%","1.5k+ sold recently","Tween Girls' Cat And Letter Printed Short Sleeve T-Shirt"
"","","","#1 Best Sellers","in Teen Girls Blouses","$7.20","-14%","","SHEIN Teen Girls Floral Print Ruffle Trim Shirred Bodice Blouse"
"6","","","","","$13.50","-15%","1.7k+ sold recently","Tween Boys' Loose Fit Casual Solid Color Notched Collar Short Sleeve Shirt And Pants 2pcs/Set"
"","","","","","$4.50","-13%","300+ sold recently","SHEIN Teen Girls Tie Dye & Butterfly Print Tee"
"","","","","","$8.93","-19%","1.4k+ sold recently","SHEIN 2pcs/Set Young Boys' Casual College Style Comfortable Fashionable Practical Versatile Soft Comfortable Cool Street Graffiti Hand-Painted Breathable & Comfortable Short Sleeve T-Shirt And Checkerboard Pattern Shorts, Suitable For Spring And Summer"
"4","","","","","$8.80","-15%","2.8k+ sold recently","SHEIN Young Boy Sailboat Printed Polo Shirt And Shorts Set"
"","","","","","$5.98","-16%","600+ sold recently","SHEIN Tween Boy Hamburger Print Short Sleeve Crew Neck T-Shirt, Casual And Simple, Suitable For Summer"
"6","","","","","$4.40","-15%","1.4k+ sold recently","SHEIN Round Neck Short Sleeve Tee For Young Girls With Bead Embellishments And Knot Detail On Hem"
"","","","","","$8.55","-19%","7.0k+ sold recently","SHEIN Tween Boy Camo Print Tee & Drawstring Waist Shorts"
"7","","","","","$5.60","-15%","1.0k+ sold recently","SHEIN Young Girl Casual And Elegant Shorts For Commuting With 3D Bow-Knots"
"","","","","","$21.30","-7%","900+ sold recently","SHEIN Tween Girls' Cute Starry Pattern Washed Straight-Leg Jeans"
"","","","","","$5.01","-48%","1.0k+ sold recently","SHEIN Tween Boy Coconut Tree Print Tee & Tropical Print Shorts"
"22","","","","","$8.80","-15%","2.8k+ sold recently","SHEIN Young Boy Solid Tee & Cartoon Graphic Shorts & Bag"
"","","","","","$8.60","-14%","400+ sold recently","Tween Boy Letter Print Hooded Short Sleeve T-Shirt And Shorts Set"
"4","","","","","$11.50","-7%","1.1k+ sold recently","SHEIN Tween Girl's Woven Floral Print Holiday Strappy Dress"
"4","","","","","$9.70","-13%","200+ sold recently","SHEIN Tween Girl Letter Graphic Cami Top & Tee & Shorts"
"5","","","","","$9.50","-15%","4.8k+ sold recently","SHEIN Young Girl Letter Graphic Cami Top & Geo Print Paperbag Waist Shorts"
"","","","","","$6.70","-7%","90+ sold recently","SHEIN Tween Girl 3pcs/Set Knitted Ribbed Comfortable And Breathable Sports Tank Tops, Light Colors"
"","","","","","$7.70","-8%","200+ sold recently","Young Boy Letter Print Short Sleeve T-Shirt And Shorts Casual Set"
"4","","","","","$8.00","-7%","400+ sold recently","Teen Girls' Tree Pattern Swimsuit Set"
"7","","","","","$8.37","-26%","300+ sold recently","SHEIN Tween Girl 4pcs Solid Color Loose Fit Casual Tank Top With Round Neck For Summer"
"","","","","","$6.00","-13%","60+ sold recently","Tween Boy Casual Simple Cartoon Bear Pattern Short Sleeve Round Neck T-Shirt Suitable For Summer"
"4","","","","","$8.40","-14%","2.9k+ sold recently","SHEIN Young Boy 2pcs/Set Casual Comfortable Color-Block Fashion T-Shirt And Shorts Outfits"
"7","","","","","$13.20","-14%","2.0k+ sold recently","SHEIN Tween Boy Letter Graphic Raglan Sleeve Hoodie & Shorts"
"","","","","","$9.40","-13%","100+ sold recently","SHEIN Tween Girl Knitted Solid Color Short Sleeve V-Neck Top And Shorts Set, Spring/Summer Outfits"
"9","","","","","$9.90","-13%","1.2k+ sold recently","SHEIN Tween Boys' Casual Comfortable Slogan Print T-Shirt And Shorts Set"
"","","","","","$3.30","-13%","400+ sold recently","SHEIN Tween Girl Simple & Elegant Solid Color Tweed Knit Strapless Top"
"","","","","","$13.00","-6%","600+ sold recently","SHEIN Tween Girls' Everyday Casual Geometric Printed Short Sleeve Dress For Spring/Summer"
"","","","","","$5.30","-13%","200+ sold recently","Tween Boy Summer Letter & Car Printed Round Neck Casual Short Sleeve T-Shirt"
"","","","","","$7.50","-15%","200+ sold recently","Young Girl Casual 2pcs/Set Ditsy Floral Spaghetti Strap Crop Top And Shorts, Summer Vacation"
"","","","","","$12.50","-6%","2.8k+ sold recently","SHEIN Teen Girls Ripped Roll Up Hem Denim Shorts"
"8","","","","","$5.40","-14%","1.6k+ sold recently","SHEIN Young Girl 2pcs Bow Front Shorts"
"","","","","","$14.10","-13%","100+ sold recently","SHEIN Tween Girls' (Large) Letter Print Sleeveless Top With Long Pants Two-Piece Set"
"4","","","#6 Best Sellers","in Tween Girls Activewear","$4.06","-8%","","SHEIN Tween Girl Knitted Crossed High Waisted Cycling Shorts, Versatile Basic Style"
"4","","","","","$9.69","-21%","1.4k+ sold recently","Tween Girl Panda & Slogan Graphic Tee & Shorts"
"","","","","","$6.75","-34%","700+ sold recently","SHEIN Tween Girl 3pcs Cotton Ribbed Knit Solid Halter Top"
"","","","","","$4.73","-22%","300+ sold recently","Teenage Boys' Stylish Street-Inspired Printed Round Neck T-Shirt, Summer"
"","","","","","$14.80","-13%","900+ sold recently","Girls Open Toe Hollow Out Gladiator Sandals For Outdoor"
"","","","","","$9.50","-13%","200+ sold recently","SHEIN Tween Girl Loose Casual Round Neck Drop Shoulder Slogan Graphic T-Shirt And Biker Shorts Set"
"11","","","","","$7.90","-13%","400+ sold recently","New Thick-Soled & Soft-Soled Anti-Skid & Comfortable & Casual & Outdoor & Lightweight & Vacation & Beach Slippers With Versatile Soft Soles For Women"
"4","","","","","$5.20","-12%","1.2k+ sold recently","SHEIN Teen Girl Sweet & Cute Contrast Lace V-Neck Camisole Tank Top For Summer"
"5","","","","","$11.50","-14%","1.3k+ sold recently","SHEIN Tween Boys' Color Block Short Sleeve T-Shirt And Shorts Set"
"","","","#10 Best Sellers","in Young Girls Underwear","$12.20","-16%","","Young Girl 7pcs Cartoon Graphic Contrast Binding Brief"
"5","","","","","$9.50","-9%","1.3k+ sold recently","Young Girl Casual Long Sleeve Shirt And Tank Top With Sports Shorts Set For Summer"
"5","","","","","$15.80","-7%","2.5k+ sold recently","Tween Girl Ripped Wide Leg Jeans"
"","","","","","$13.30","-6%","40+ sold recently","SHEIN Teenage Girls Shoulder Pad Long Sleeve T-Shirt With Shorts, Faux Two-Piece Beach Swimsuit Set"
"","","","","","$10.20","-7%","100+ sold recently","Tween Boy Fashionable Daily Casual Short Sleeve Workwear Pocket Shorts 2 Piece Set"
