"goods-title-link","rank-title","rank-sub","price","selling_proposition","discount"
"Boho Wall Baskets Decor Hanging Rustic Rattan Wicker Wall Basket For Farmhouse Living Rooms Bedrooms Kitchen Decorations","","","$2.60","400+ sold recently",""
"50pcs SweatBlock Underarm Sweat Pads - Disposable Antiperspirant Pads For Men And Women - Stay Dry And Confident All Day","#3 Best Sellers","in Sweat Pads","$2.90","",""
"Wood Pedestal Soap Stand, Farmhouse Wood Riser, Soap Dish Holder/Tray Counter Decor For Bathroom Kitchen, Rustic Candle Plant Holder, Display Rectangular Decorative","#7 Best Sellers","in Soap Dishes","$5.01","","-33%"
"Digital Camera Case Compatible With CAMKORY/For YISENCE/For VAHOIALD/For  Pixpro/For Canon PowerShot ELPH 180 190/ For  DSCW800 DSCW830 Digital Camera (Box Only)","","","$5.10","100+ sold recently","-11%"
"1pc Floral Print Cushion Cover Without Filler, Vintage Flower Design Decorative Square Shaped Cushion Cover For Bed, Sofa","","","$4.80","100+ sold recently",""
"33-Grid Plastic Ice Cube Tray With Lid, Homemade Ice Mold For Small Freezer, Freezing Ice Blocks Maker For Household Refrigerator","#2 Best Sellers","in Ice Cube Mould","$1.24","","-76%"
"1pc Colorful Chenille Embroidered 'MAMA' Letter Badge For DIY Fashionable Women's Handbags And Hats Decoration, Iron-On Patch","#4 Best Sellers","in Patches","$1.90","",""
"1branch Artificial Rose","","","$3.24","",""
"1Pc Color-Block Yarn Checkerboard Large Capacity Cosmetic Bag,Makeup Bag Makeup Pouch Skincare Bag Toiletry Bag Packing Cubes,Travel Essentials Cruise Essentials Dorm Essentials,Wedding Bridesmaid Gifts,Mom Gifts,Birthday Gifts,Gifts For Friends And Teachers,Home Decor,Bathroom Livingroom Bedroom Decor,Bathroom Organizer,Jewelry Organizer,Lip Oil Organizer,Nail Polish Organizer Makeup Bag Storage Makeup Organizer Makeup Case","","","$1.69","2.3k+ sold recently","-40%"
"10pcs Wooden Honey Dipper Stick, Ideal For Serving Syrup, Honey, Party Favors, Wedding Favors, Honey Jar Dispense, Birthdays & Celebrations","#5 Best Sellers","in Other Spoons","$2.34","","-10%"
"Waterproof Pvc Marble Long Strip Design 3d Self-Adhesive Wall Sticker, 1pc/5pcs/10pcs","","","$4.00","300+ sold recently",""
"5pcs Artificial Ginkgo Biloba Leaves For Flower Arrangements, Wedding Decoration, Party Supplies, Home & Garden Decor, Gold & Silver Faux Ginkgo Stem For Vase Filling","","","$1.64","100+ sold recently","-22%"
"Plain Cushion Cover, Simple White Polyester Throw Pillow Case, Pillow Insert Not Included, For Living Room Home Decor","","","$1.68","400+ sold recently","-30%"
"12Pcs/1Pc Green Artificial Plant Garland Plastic Artificial Ivy Leaf Garland Wall Hanging Vine Home Garden Decoration Wedding Party DIY Fake Wreath Leaf","","","$0.70","4.2k+ sold recently","-53%"
"1pc Artificial Dandelion With 5 Stems As A Simulated Flower Arrangement Living Room And Dining Table Decor","","","$2.10","1.3k+ sold recently",""
"5/10/15/20/25/30pcs Real Looking Fake Roses W/Stem For DIY Wedding Bouquets Centerpieces Arrangements Party Baby Shower Home Decorations","","","$1.70","4.7k+ sold recently",""
"Solid Color Jewelry Display Rack, Simple Black Necklace Display Rack For Home","","","$5.60","100+ sold recently",""
"Yiwd Girlcore Heart Pattern Makeup Mirror","#10 Best Sellers","in Mirrors","$2.00","",""
"1pc Coastal Ocean Swimming Painting Wall Art Sea Illustration Wall Art Print Coastal Summer Printable Wall Decor Ocean Waves Painting Print No Frame","","","$3.60","30+ sold recently",""
"1pc Creative Vintage Skull Shaped Resin Ornament, Creative Desktop Decoration, Home Decorative Figurine","","","$7.60","300+ sold recently",""
"1pc/2pcs/4pcs Multipurpose Round Portable Jewelry Earring Ring Accessory Velvet Storage Box","","","$4.16","50+ sold recently","-29%"
"5pcs Flower Wrapping Bag, Plastic Flower Bouquet Sleeve For Party","","","$1.50","2.1k+ sold recently",""
"3 Kinds Mixed Eucalyptus Leaves Stems Bulk Artificial Silver Dollar Eucalyptus Leaves Picks Dried Eucalyptus Bundle Faux Spray For Wedding Vase Bouquet Floral Arrangement Decor","","","$1.70","2.2k+ sold recently",""
"1pc Vintage Tissue Storage Box,For Festival Celebration","","","$9.70","300+ sold recently",""
"2pcs Large Black Mesh Neutral European Style Japanese Style Nordic Minimalist Modern Elegant Daily Classic Vanity Makeup Bag Travel Makeup Bag Cosmetic Bag For Women And Girls","","","$2.90","","-3%"
"1pc,True Love Wedding Congratulations Cards, Bridal Shower Cards, Engagement Congratulations Cards, Small Business Supplies, Thank You Cards, Birthday Gifts, Cards, Unusual Items, Gift Cards","#2 Best Sellers","in Invitations Cards & Letters","$1.70","",""
"1 Piece Cocktail Recipe Mixology Poster - 20 Classic Cocktails - Kitchen And Bar Living Room And Bedroom Wall Art - Frameless Home Decor","","","$0.50","200+ sold recently","-69%"
"1Pc Double Layer Waterproof Mini Handheld Cosmetic Bag With Small Size & Portable Design Black Friday,Makeup Bag Makeup Pouch Skincare Bag Toiletry Bag Packing Cubes,Travel Essentials Cruise Essentials Dorm Essentials,Wedding Bridesmaid Gifts,Mom Gifts,Birthday Gifts,Gifts For Friends And Teachers,Home Decor,Bathroom Livingroom Bedroom Decor,Bathroom Organizer,Jewelry Organizer,Lip Oil Organizer,Nail Polish Organizer Makeup Bag Storage Makeup Organizer Makeup Case","","","$3.80","1.0k+ sold recently","-5%"
"1 Unframed Customized Poster. Upload Your Image/Photo To Personalize Your Poster Printing For Home Decoration And Create Your Own Wall Art Print.","#8 Best Sellers","in Customized Home Decor Supplies","$2.42","","-22%"
"Happiness Collections Gold Thank You Tags — Perfect For: Wedding Favors, Baby Shower, Bridal Shower, Birthday Or Special Event, 50 Pcs","#9 Best Sellers","in Gift Wrap Tags","$1.84","","-20%"
"5pcs Mandala Pattern Self-adhesive Kitchen Sticker","","","$1.70","10+ sold recently",""
"1Pc Blue And White Plaid Knitted Soft Classic Plaid Pattern Waterproof Large Capacity Travel Portable Classic Octagonal Bag Makeup Bag For Women Girls Black Friday,Makeup Bag Makeup Pouch Skincare Bag Toiletry Bag Packing Cubes,Travel Essentials Cruise Essentials Dorm Essentials,Wedding Bridesmaid Gifts,Mom Gifts,Birthday Gifts,Gifts For Friends And Teachers,Home Decor,Bathroom Livingroom Bedroom Decor,Bathroom Organizer,Jewelry Organizer,Lip Oil Organizer,Nail Polish Organizer Storage Makeup Organizer Makeup Case","","","$1.92","6.5k+ sold recently","-20%"
"1pc/6/10pcs Exquisite Drawer Cosmetic Organizer Makeup Storage Box For Vanity Lipstick Eyeshadow Desktop Skincare Sorting Container Acrylic Storage Box","","","$1.90","200+ sold recently",""
"1pc Flower Embroidered Tablecloth, Mesh Table Cover For Dining Room","#6 Best Sellers","in Tablecloths","$4.10","",""
"20pcs Mixed Size Wedding & Party Celebration Cake Decoration Foam Balls","","","$2.40","500+ sold recently",""
"Laser Gold Wire Shower Curtain Waterproof, High-Grade Shower Curtain, Waterproof And Mildewproof","","","$3.57","100+ sold recently","-62%"
"1pc Ghost With Phone And Knife Printed Fluorescent Tapestry, With Blue Light Uv Lamp Response, Fabric Wall Decoration","#2 Best Sellers","in Tapestry","$3.80","",""
"1pc Disco Ball Swirl Straws, Reusable Plastic Straws For Birthday Party Supplies Disco Bachelorette Party Decorations Bar Straws","","","$1.40","200+ sold recently",""
"1pc Cute Flower Print Oval Fluffy Rug, Polyester Soft Absorbent Floor Mat For Household","","","$9.45","100+ sold recently","-29%"
"1pc 50*100cm Artificial Lawn Carpet, Thick Synthetic Grass Mat For Pets, Indoor & Outdoor, Suitable For Garden, Lawn, Landscape","","","$10.80","200+ sold recently","-10%"
"1Pc Pink Bible Verse I Am A Daughter Of The Most High King Wall Art Prints Canvas Painting For Living Room&Bedroom Home Decoration Festival Gift For Her Him","","","$1.80","90+ sold recently",""
"2pcs Artificial Flowers Bougainvillea Branches Faux Floral Stems Long Plant Branches For Party, WeddingCenterpieces Home Garden Wall Decoration","","","$2.30","300+ sold recently",""
"1pc Cherry Petal Pillow Girl Heart Floating Window Bedroom TatamiLiving Room Pillow Flower Back Cushion Christmas, Halloween.Thanksgiving Gift","","","$12.10","300+ sold recently",""
"30pcs mix color tulip and 30pcs leaf glass beads","","","$2.00","1.2k+ sold recently",""
"6pcs Mixed Wave & Dot & Stripe Pattern Popcorn Box French Fries Container Snack Favor For Festival Birthday Party","","","$2.80","200+ sold recently",""
"1pc Jacquard Plain Stretchy Sofa Seat Cushion Cover, Modern Polyester Sofa Cushion Cover For Home","","","$3.15","100+ sold recently","-10%"
"Jacquard Pattern Single Panel Curtain, European Retro Polyester Curtain For Home Decor","","","$8.50","100+ sold recently",""
"Balloon Stand Set, Balloon Sticks With Cups And Base, Desk Tabletop Centerpieces Holder, Balloon Accessories For Wedding, Christmas, Thanksgiving, Spring Festival, Birthday Party Decoration Supplies","#8 Best Sellers","in Event & Party Supplies","$2.26","","-6%"
"1Pc Artificial Flower Candle Ring Holder For Table Decoration , Candlestick Wreath,Party Decor And Home Decor,Dining Table Festival Party Decoration,Wedding Party Decor, Indoor Shooting Props,Living Room,Bedroom Decor","#9 Best Sellers","in Centerpieces","$3.00","",""
"1pc/Set Casual Women's Large Capacity Blue Flower Cosmetic Bag Set, Handheld With Small/Medium/Large Pouches, Portable And Sewed With Cute Flower INS Travel, Suitable For Storing Cosmetics, Toiletries And For Leisure Travel","","","$2.30","2.5k+ sold recently","-4%"
"Metatarsal Pads Women | Heel Inserts For Women | Ball Of Foot Cushions (1 Pair Foot Pads) All Day Pain Relief And Comfort One Size Fits Shoe Inserts For Women","","","$0.95","900+ sold recently","-59%"
"50PCS US State Stickers Vinyl Waterproof Stickers  Scrapbook,Journaling,Laptop,Bumper,Skateboard,Water Bottles,Computer,Phone,Cartoon,Hard Hat,Car Stickers And Decals","","","$1.46","600+ sold recently","-19%"
"1/2pcs Boho Gauze 71 Inch Long Table Runner, Semi-Sheer Cheesecloth Romantic 35 Inch Wide Tablecloth For Wedding Reception Bridal Holiday Birthday Valentine's Day Party Table Dining Room Dresser Decor,Home Decor, Scene Decor","","","$3.00","1.0k+ sold recently",""
"One Piece Stainless Steel Integrated Stove Disinfection Cabinet Drainage Rack With Built-in Bowl Rack For Kitchen Utensil, Dishes, Bowl","","","$3.82","300+ sold recently","-22%"
"50pcs Slogan Graphic Gift Sticker, Modern Color Block Paper Gift Decal For Party","","","$1.80","200+ sold recently",""
"1pc Cartoon Animal Print Wall Sticker, Cute PVC Waterproof Wall Art Deal For Kids Bedroom Living Room","","","$2.80","200+ sold recently",""
"8/16/24/32 Sheets Make A Face Stickers, 8 Different Blue Dog Designs Stickers Birthday Party Favor Supplies Craft","","","$2.30","1.2k+ sold recently",""
"Sunflower Pillow Living Room Sofa Decoration Cushion Bed Headrest Seat Cushion Plush Tatami Bay Window Pillow","#5 Best Sellers","in Decorative & Throw Pillows","$3.77","","-55%"
"1PC 1x2m Black Metallic Foil Fringe Tinsel Curtain Happy Birthday Proposal Party Wedding Decoration Fiestas Cortinas","","","$1.90","1.7k+ sold recently",""
"1 PC Kitchen Drain Rack, Sponge Rack, Household Sink Cloth Rack, Countertop Cloth Rack, Sponge Drain Rack, Storage Rack, Suitable For Kitchen Storage And Cleaning Tools, Making The Kitchen Clean And Tidy","#3 Best Sellers","in Racks & Holders","$5.90","","-17%"
"Faux Pearl Decor Tablecloth","#1 Best Sellers","in Tablecloths","$4.00","",""
"4pcs Cookie Scented Candles Wholesale Fragrance Gift Box Handmade Wax Candle Set With Ins Style Novelty Shape For Decor And Gift","#3 Best Sellers","in Candles","$1.97","","-64%"
"1pc Abstract Cartoon Font Flower Poster For Room Living Room Study Stairs Bookstore Shop Wall Decoration, Printed On Canvas","","","$1.80","1.2k+ sold recently",""
"1pc White Plastic Flower Vase Pot, Nordic Modern Creative Home Living Room Decoration, Minimalist Desktop Ornament For Artificial/Dried Flowers And Flower Arrangements","","","$1.68","20+ sold recently","-40%"
"1pc/3pcs Artificial Flowers Silk 5-Head Lotus Faux Long Stem Peony Flowers For Wedding Party, Ceremony Decoration, Diy Floral Arrangement, Home Living Room Bedroom Dining Room Decoration","","","$2.90","700+ sold recently",""
"1pc 550ml Or 400ml Clear Straw Bottle, Modern Glass Coffee Cup For Home, Office","#4 Best Sellers","in Water Bottles","$2.80","",""
"1pc Bridesmaid Makeup Bag, Bridesmaid Gift Bag Wedding Travel Toiletry Bag With Zipper Bride Bridesmaid Bag For Wedding Bridal Shower Bachelorette Proposal Party Favor Present","","","$2.40","500+ sold recently","-11%"
"1PC Artificial Flowers, Rose Bouquets, Valentine's Day Gifts, Birthday Party Decorations, Wedding Flower Baskets, Bride Holding Flowers, Home Furnishings, Dining Rooms, Bedrooms, Windowsills, Vases, Decorations, New Year Decorations, Outdoor Gardens, Start Of School Season","","","$2.90","100+ sold recently",""
"1PC Oversize Stripped Design With Tassel Beach Towels For Travel, Microfiber Quick Dry Towel For Swimmers Sand Proof Beach Towels For Women Men Girls Kids","","","$7.35","100+ sold recently","-25%"
"1 Set Mr&Mrs Wooden Wedding Decoration Set, Reception Ceremony Table Decor With Letter Ornaments","","","$4.20","60+ sold recently",""
"7/12/17/22/27Pcs Fake Foam Rose Flowers With Stems Lavender For DIY Wedding Bridesmaid Bridal Bouquets Centerpieces Party Home Decoration","","","$1.70","1.6k+ sold recently",""
"1pc 35 Inch Artificial Palm Plants Banana Leaves Faux Platic Turtle Leaf Fake Tropical Large Bird Of Paradise Tree Leaves Imitation Leaf For Indoor Outside Home Decor","","","$5.50","100+ sold recently",""
"Clear Makeup Bags, 1Pc Cosmetic Makeup Bags Clear Pvc With Zipper Handle Portable Travel Black Friday,Makeup Bag Makeup Pouch Skincare Bag Toiletry Bag Packing Cubes,Travel Essentials Cruise Essentials Dorm Essentials,Wedding Bridesmaid Gifts,Mom Gifts,Birthday Gifts,Gifts For Friends And Teachers,Home Decor,Bathroom Livingroom Bedroom Decor,Bathroom Organizer,Jewelry Organizer,Lip Oil Organizer,Nail Polish Organizer Storage Makeup Organizer Makeup Case","","","$1.90","2.0k+ sold recently","-5%"
"1pc Thicken Jacquard Floral Curtain,European Style, Ideal For Living Room, Bedroom, Balcony, Dining Room, Decorated By Rod","","","$3.50","100+ sold recently",""
"SONGMICS 10 Tier Shoe Rack, Stand Shoe Shelf, Shoes Storage Organizer, Space-Saving, 13 x 13 x 68.1 Inches, Metal Frame, Non-Woven Fabric Shelves, for Entryway, Bedroom, Black, Gray","","","$20.99","200+ sold recently","-58%"
"Arched Floor Mirror 59""X16""/64""X21""  Full Length Mirror With Stand  Free Standing Full Body Mirror Black Aluminum Frame Dressing Mirror Hanging Leaning Mirror Wall-Mounted","","","$59.99","400+ sold recently","-78%"
"1PC 1x2m White Metallic Foil Fringe Tinsel Curtain Happy Birthday Proposal Party Wedding Decoration Fiestas Cortinas","","","$2.10","1.2k+ sold recently",""
"1pc Refrigerator Magnet Clip, Heavy Duty Memo Clip, Displaying Notes Or Photos, Perfect For Home And Kitchen","","","$1.30","2.7k+ sold recently",""
"1pc/3pcs Romantic Rose & Peony Bouquet Artificial Flowers Handheld Flower Arrangement For Wedding/Home/Bedroom/Living Room/Table Decoration/Bride's Bouquet","","","$2.11","900+ sold recently","-22%"
"1pc/84 Slots 160 Slots Photo Album Card For 3-Inch Album, Star Idol Idol Card, Name Card Collection Book","#8 Best Sellers","in Art Supplies","$2.70","",""
"Solid Double Layer Single Panel Curtain","","","$10.26","600+ sold recently","-38%"
"1pc Indoor Decorative Vase, Dried Flower Container, Creative Flower Insert Ornament, PE Vase","","","$3.20","1.5k+ sold recently",""
"1pc Artificial Turf Grassland Simulation Fake Moss Lawns Artificial Grass Carpet Plant Courtyard Garden Outdoor Decor Turf Grass Mat","#1 Best Sellers","in Artificial Lawn","$5.20","",""
"96pcs Decorative Balloon Garland, Colorful Balloon For Birthday Party","","","$6.80","",""
"24 Pcs, 5.9""X 7.9""X 2.8"" Clear Plastic Gift Bag With Handle, Reusable Clear PVC Gift Wrap Tote Bag For Halloween Christmas Retail Boutique Wedding Birthday Party Gifts, Shopping Bag, Party Bag, Party Gift Bag, Craft Tote, Party Favor","","","$3.00","600+ sold recently",""
"1pc Trendy Art, Black And White Wall Art, Prints Newspaper News Prints, Retro Bar Cart Decor, Girly Aesthetic Art, Women Print, Gift For Her","","","$1.80","800+ sold recently",""
"1 Roll Of Gray Wood Grain Floor Sticker, Waterproof And Non-Slip","#10 Best Sellers","in Floor Stickers","$4.00","",""
"1pc Yellow Plaid Picnic Mat Non-woven Outdoor Moisture-proof Pad Spring Outing, Camping, Beach Mat","#1 Best Sellers","in Picnic Mats","$4.28","","-25%"
"1 Pc Sweet Cheeks Text Art, Orange Poster, Beige Bathroom Retro Wall Decor, Cute Vibrant Trendy Fun Quote Layout, Home Decor, Canvas Wall Poster","","","$1.80","500+ sold recently",""
"Artificial Flowers For Outdoor Fake Plants 1 No Fade Faux Outside Greenery Boxwood Plastic Shrubs Silk Flowers For Home Garden Window  Fireplace Decoration(Yellow)","","","$1.23","300+ sold recently","-32%"
"24Pcs Set Kitchen Oven Baking Pans. صينية خَبز من السيليكون Silicone Bakeware Set With Baking Pan, Silicone Cake Mold  السيليكون S, Baking Sheet, Donut Pan, Silicone Muffin Pan, Cake Pan, And 18Pack Silicone Cupcake Mold Baking Cups","","","$2.00","300+ sold recently",""
"18Pack/Set Fake Ivy Vines 7.05FT 12 Pack Artificial Ivy Leaf Plants Vine With 6Pcs 20 LED String Light,Green Vines Garland Hanging For Home Kitchen Office Wedding Wall Decor, For Living Room Classroom Decor","","","$1.90","200+ sold recently",""
"1pc Vintage Handmade Crochet Lace Tablecloth, Hollow Out Home Decoration Dustproof Cover For Coffee Table In Living Room","","","$3.00","1.2k+ sold recently",""
"1pc Pvc Doormat In Plant Pot Design With Silk Circle, Fresh Style, Durable, Mud Scraping, Easy To Clean, Doorway Mat Suitable For Restaurant, Outdoor","","","$18.50","100+ sold recently",""
"10pcs Kraft Carton Black Packaging Carton Festival party Gift Box Soap Carton Supports Customized Size And Logo Printing","","","$1.81","200+ sold recently","-33%"
"1pc Artificial Flower","","","$2.90","1.0k+ sold recently",""
"Le freak c est chic Retro Street Black Twisted Line Pattern Waterproof Shower Curtain","","","$11.00","700+ sold recently",""
"1pc Solid Outdoor Waterproof Curtain, White Polyester Curtain For Party, Wedding , Holiday","#2 Best Sellers","in Curtains","$10.70","",""
"Double-Layer Makeup Bag With Handle, Large Capacity Cosmetic Storage Case, Travel Toiletry Nail Tool Organizer Travel Accessories Travel EssentialsStorage BagNail Polish Carrying Case Bag Organizers Nail Polish StorageNail Dryer Case Valentines Gifts For Valentines Day Women Gifts Girl Gifts Girlfriend Gifts","","","$11.80","900+ sold recently","-31%"
"52pcs Jesus Phrases Sticker","","","$1.76","2.2k+ sold recently","-20%"
"1PCS Sand Remover For Beach, Sand Removal Bag,Powder Pouch Sand Remover Brush Beach Vacation Camping Essentials (Talc-Free)","#2 Best Sellers","in Beach Towels & Bath sheets","$2.40","",""
"9pcs Travel Portable Luggage Packing Cubes College Dorm Essentials, Stuff Bag Storage Bag Clothes Storage Clothes Organizer Travel Bag Set Travel Organizer Set For Travel College Dorm School Vacation Holiday Suitcase Luggage Back to School Travel Essentials Travel Accessories Dorm Essentials","#5 Best Sellers","in Travel Packing Organizers","$13.97","","-14%"
"1pc Printed Peva Shower Curtain, Waterproof With Green Leaves Pattern And Including Hooks","#3 Best Sellers","in Shower Curtains & Accessories","$1.49","","-70%"
"5pcs-Artificial Faux Plants Flowers Outdoor Spring Summer Decoration, Fake Silk Colorful Daisy Eucalyptus Realistic UV Resistant For Outside Home Planter Porch Patio Window Yard Decor (Mix)","","","$2.00","200+ sold recently",""
"1/2/4/6 Pack 35 X 120 Inches Sage Green Boho Table Runner, Cheesecloth Table Runner, Sheer Rustic Table Runner, Vintage Long Tablecloth For Christmas New Year Wedding Bridal Shower Birthday Party Holidays Home Decor","#5 Best Sellers","in Disposable Table Covers","$3.50","",""
"7pcs Set Pretty Party Heart Shaped Sunglasses Cat Eye Sunglasses Vintage Heart Glasses For Wedding Costume Party Bridal Shower Party Bach Party Favors Bride To Be Valentines Day Prop","","","$1.90","1.8k+ sold recently",""
"Forever Postage Stamps Freedom Self-Stick 2023 Awareness Vinyl For  First Class Letter","#2 Best Sellers","in Stamps & Wax Seals","$5.36","","-20%"
"1pc Mini Fan With One Wind Speed And Lanyard, Party Gift (Batteries Not Included, Need To Be Purchased Separately)","","","$1.13","1.7k+ sold recently","-62%"
"2pcs Stainless Steel Wall Hook, Silver Self Multifunction Adhesive Hook For Home","","","$1.60","80+ sold recently",""
"1Pc Wine Red Artificial Hydrangea Real-looking Silk Hydrangea Flower Arrangements Fake Floral Brunch for DIY Wedding Bouquet Party Home Living Room Kitchen Garden Hotel Office Baby Shower Decoration","","","$1.90","500+ sold recently","-27%"
"6pcs/Set Vintage Planets And Universe Posters,Space Mars Venus Moon Art Print Poster, Retro Kraft Paper Wall Art Paintings, Astronomy Artwork Wall Painting For Living Room Bedroom Bathroom Office Kitchen Bar Cafe Home Wall Decors, No Frames","","","$4.70","800+ sold recently",""
"Transparent Pvc Cosmetic Purse For Women,Bohemia Stylish Storage Bag With Waterproof Clear Pvc For Beach,Summer Vacation,Swimming.Birthday Gift. Cute Makeup Bag For Girls","","","$4.50","600+ sold recently","-10%"
"1pc Round Polyester Satin Tablecloth, Silk Table Cover, Smooth Fabric Tablecloth, Bright Silk Satin Tablecloth, For Wedding, Banquet And Large Events","","","$5.90","90+ sold recently",""
"1pc Natural Curls Ultimate Soft Brush, Wet And Dry Brush, For 3C To 4C Hair","","","$2.50","100+ sold recently",""
"1pc Vintage Quote Poster Canvas Wall Art Without Frame, For Bedroom, Living Room, Study, Staircase, Cafe, Restaurant, Office Home Decor","","","$1.80","900+ sold recently",""
"50 Summer Inspirational Macaron Colored Posters And Stickers","","","$2.20","100+ sold recently",""
"5pcs Daisy Cake Topper, Wedding Party Decor, Spring Birthday Wedding Supplies Cake Decoration","","","$1.62","200+ sold recently","-10%"
"48pcs Hollow Out Butterfly Sticker","#3 Best Sellers","in Home Stickers","$2.60","",""
"2pcs Bear Shaped Decorative Object","","","$1.80","90+ sold recently","-10%"
"3 Kinds Mixed Eucalyptus Leaves Stems Bulk Artificial Silver Dollar Eucalyptus Leaves Picks Dried Eucalyptus Bundle Faux Spray For Wedding Vase Bouquet Floral Arrangement Decor","","","$1.70","2.2k+ sold recently",""
"1pc Vintage Tissue Storage Box,For Festival Celebration","","","$9.70","300+ sold recently",""
"2pcs Large Black Mesh Neutral European Style Japanese Style Nordic Minimalist Modern Elegant Daily Classic Vanity Makeup Bag Travel Makeup Bag Cosmetic Bag For Women And Girls","","","$2.90","","-3%"
"1pc,True Love Wedding Congratulations Cards, Bridal Shower Cards, Engagement Congratulations Cards, Small Business Supplies, Thank You Cards, Birthday Gifts, Cards, Unusual Items, Gift Cards","#2 Best Sellers","in Invitations Cards & Letters","$1.70","",""
"1 Piece Cocktail Recipe Mixology Poster - 20 Classic Cocktails - Kitchen And Bar Living Room And Bedroom Wall Art - Frameless Home Decor","","","$0.50","200+ sold recently","-69%"
"1Pc Double Layer Waterproof Mini Handheld Cosmetic Bag With Small Size & Portable Design Black Friday,Makeup Bag Makeup Pouch Skincare Bag Toiletry Bag Packing Cubes,Travel Essentials Cruise Essentials Dorm Essentials,Wedding Bridesmaid Gifts,Mom Gifts,Birthday Gifts,Gifts For Friends And Teachers,Home Decor,Bathroom Livingroom Bedroom Decor,Bathroom Organizer,Jewelry Organizer,Lip Oil Organizer,Nail Polish Organizer Makeup Bag Storage Makeup Organizer Makeup Case","","","$3.80","1.0k+ sold recently","-5%"
"1 Unframed Customized Poster. Upload Your Image/Photo To Personalize Your Poster Printing For Home Decoration And Create Your Own Wall Art Print.","#8 Best Sellers","in Customized Home Decor Supplies","$2.42","","-22%"
"Happiness Collections Gold Thank You Tags — Perfect For: Wedding Favors, Baby Shower, Bridal Shower, Birthday Or Special Event, 50 Pcs","#9 Best Sellers","in Gift Wrap Tags","$1.84","","-20%"
"5pcs Mandala Pattern Self-adhesive Kitchen Sticker","","","$1.70","10+ sold recently",""
"1Pc Blue And White Plaid Knitted Soft Classic Plaid Pattern Waterproof Large Capacity Travel Portable Classic Octagonal Bag Makeup Bag For Women Girls Black Friday,Makeup Bag Makeup Pouch Skincare Bag Toiletry Bag Packing Cubes,Travel Essentials Cruise Essentials Dorm Essentials,Wedding Bridesmaid Gifts,Mom Gifts,Birthday Gifts,Gifts For Friends And Teachers,Home Decor,Bathroom Livingroom Bedroom Decor,Bathroom Organizer,Jewelry Organizer,Lip Oil Organizer,Nail Polish Organizer Storage Makeup Organizer Makeup Case","","","$1.92","6.5k+ sold recently","-20%"
"Solid Double Layer Single Panel Curtain","","","$10.26","600+ sold recently","-38%"
"52pcs Jesus Phrases Sticker","","","$1.76","2.2k+ sold recently","-20%"
"7pcs Set Pretty Party Heart Shaped Sunglasses Cat Eye Sunglasses Vintage Heart Glasses For Wedding Costume Party Bridal Shower Party Bach Party Favors Bride To Be Valentines Day Prop","","","$1.90","1.8k+ sold recently",""
"1pc Mini Fan With One Wind Speed And Lanyard, Party Gift (Batteries Not Included, Need To Be Purchased Separately)","","","$1.13","1.7k+ sold recently","-62%"
"2pcs Stainless Steel Wall Hook, Silver Self Multifunction Adhesive Hook For Home","","","$1.60","80+ sold recently",""
"1Pc Wine Red Artificial Hydrangea Real-looking Silk Hydrangea Flower Arrangements Fake Floral Brunch for DIY Wedding Bouquet Party Home Living Room Kitchen Garden Hotel Office Baby Shower Decoration","","","$1.90","500+ sold recently","-27%"
