"goods-title-link","rank-title","rank-sub","price","selling_proposition","discount"
"1000pcs Gold Diamond Shaped Resin, High Definition Shiny Loose Beads, Ideal For Diy Phone Case Decor, Bottle & Vase Decoration, Wedding Table Ornament, Makeup Holder Filling","","","$2.10","600+ sold recently",""
"1/3/5/10packs Under The Sea Transparent Bubble Garlands Birthday Wedding Party Decorations Bubble Garland Under Water Bday Hanging Streamer Banner Backdrop Kids Ocean Party Supplies","","","$2.10","400+ sold recently",""
"1pc Foldable Hanging Eyeglasses Storage Box With Multiple Layers, Gift For Valentine's Day","","","$5.54","400+ sold recently","-22%"
"Silicone Toe Protector For High Heels, Soft Cushion Pads Adjust Shoe Size, Prevent Blisters And Corn (for Toes Big Or Small)","","","$1.70","8.1k+ sold recently","-32%"
"5/10/20pcs Home Kitchen Dishcloth Set In Light Grey, Quick-Drying, Absorbent And Soft","#3 Best Sellers","in Dish Cloths & Dish Towels","$2.62","","-3%"
"1pc Acrylic DIY Trapezoidal Display And Storage Shelf","","","$6.24","5.2k+ sold recently","-20%"
"1pc Large Silicone Ice Cube Trays - Easy-Release, No Leakage, Perfect For Whiskey, Cocktails, Juice, And Parties","","","$3.26","200+ sold recently","-46%"
"4Pcs Designed For  Cup Accessories 30&40 Oz, 2Pcs Silicone Straw Cover,  Initial Name ID Letter Handle Charm, Glitter Rhinestone Alphabet Self-Adhesive Letter,Sweet Lovely Personality A-Z Initial Name ID Charm (Pink)","","","$3.30","100+ sold recently",""
"111pcs Water Balloons Set: Quick Fill For Bouncy Fun In Pools, Parties And Outdoor Activities!","#1 Best Sellers","in Party Games & Activities","$1.40","",""
"1pc Thickened Portable Foldable Multi-Functional Outdoor Travel Carrying Water Bucket","#5 Best Sellers","in Buckets","$2.36","","-59%"
"50pcs Laser Reflective Gift Bag, Various Sizes Reusable Seal Bag With Laser Rainbow Design, Suitable For Small Business Candy Bag And Self-sealing Bag For Sample Display, Holiday Gift Bag","","","$2.60","500+ sold recently",""
"100pcs Cartoon Graphic Sticker","","","$1.80","30+ sold recently",""
"1pc  Hair Filter, Sink Anti-Clog Filter, Tub Shower Floor Drain Plug, Silicone Kitchen Deodorizer Plug, Floor Drain Cover Kitchen sink filter sewage pool filter bathroom silicone hair hair to collect chuck floor drain cover","#7 Best Sellers","in Hair Stoppers & Catchers","$1.80","",""
"1set 6pcs Garden Fairy Combo Micro Landscape Ornaments For Flower Pot Decoration","","","$8.16","100+ sold recently","-20%"
"1pc Thickened Silicone Oven Mitt,Daily Solid Washable Insulated Glove For Baking","","","$5.10","200+ sold recently",""
"Disco Cherries For Wall And Home Decor,Can Hang On The Wall Cherry Disco Balls ,Pink Fruit Disco Decor (Small, PINK)","","","$12.20","1.4k+ sold recently",""
"12pcs Ring & Pendant Wine Glass Charms For Party, Gathering","","","$2.60","100+ sold recently",""
"1pc-4th Of July Tablecloth, American Flag Plastic Table Covers For Patriotic Party Supplies, Decorations For Independence, Memorial, Veterans Day","#4 Best Sellers","in Festival Decor","$3.00","",""
"1pc Large Compartment New Style Makeup Bag, High-End Cosmetics Organizer, Portable Travel Toiletry Bag, Gift For Valentine's Day","#7 Best Sellers","in Toiletry Bags","$5.60","",""
"6pcs Plastic Coffee Scoop","","","$1.80","100+ sold recently",""
"10pairs Sweat Absorbent Odor Resistant Breathable Barefoot Ultra Thin Foot Pad For Male & Female, Summer, Wood Pulp Insole For High-Heel Shoes","#9 Best Sellers","in Daily Shoe Accessories","$2.80","",""
"1pc Gray Storage Bag, Large Capacity Moving Bag, Camping Picnic Sundries Bag, Wardrobe Storage Organizing Bag, Seasonal Clothes Storage Bag, Foldable Portable Storage Bag","#4 Best Sellers","in Foldable Storage Bags","$3.23","","-5%"
"1pc Couple Design Decorative Object, Gold Polyresin Art Decoration For Home Decor","","","$3.84","3.0k+ sold recently","-20%"
"1/2Pcs Refrigerator Meat Frozen Box With Lids, Plastic Storage Containers For Food, Meat, Fruit, Ginger Garlic Green Onion, Airtight Leak-Proof For Kitchen, Home Kitchen Utensil","","","$1.50","60+ sold recently",""
"2pcs/set Flower Shaped Hollow Placemat & Coaster, Minimalist PVC Hollow Out Design Table Mat & Coaster For Dinner Table","","","$1.90","300+ sold recently","-37%"
"SOS Meme Flag Tapestry Wall Hanging Modern Music Art Banner Vintage Blanket Tapestries Aesthetic Room Decor","#1 Best Sellers","in Banners & Pennants","$2.50","",""
"1pc Punch Free Transparent Two Tone Storage Drawer, White PS Swab Storage Box For Household","#8 Best Sellers","in Storage Drawers","$2.90","",""
"10pcs Replacement Vacuum Bags Compatible With Kenmore Canister Type C/Q. 5055, 50557 And 50558 Panasonic Type C-5 Vacuums","","","$8.28","300+ sold recently","-10%"
"1pc Zinc Alloy Wax Melting Spoon","#5 Best Sellers","in Scrapbooking & Stamping","$1.40","",""
"1pc Hairdressing Hollow Comb, Transparent Glitter Massage Comb, Dry And Wet Hair Smoothing, Grid Comb For Fluffy, Styling Massage Comb Suitable For Women Hair Brush","#3 Best Sellers","in Combs","$1.90","","-5%"
"Orthopedic Sport Insoles for Shoes Soft Sweat Absorbing Cropable Size Deodorant Insoles For Feet Care Massage Insole","#1 Best Seller","In Grey Shoe Accessories","$2.00","","-31%"
"4pcs Travel Toothbrush Head Cover With Handle, Plastic Teeth Brush Cap For Home, Camping, School, Office Use (gray/blue/red/green)","","","$0.95","1.0k+ sold recently","-59%"
"1Pc Type-C Plasma Windproof Kitchen Charging Lighter For Candle Gas Stove Arc Barbecue Aromatherapy Lighter, Indoors And Outdoors Igniter Black","#2 Best Sellers","in Electric Lighters","$2.80","","-20%"
"Bible Verses In Jar - Read Me When Bible Verses Gift Prayer Jar Scripture Jar Bible Jar Bible Verses Blessings Jar For Notes Color Coded Bible Christian Bible Gifts Christian Gift-Plastic Cans","","","$4.40","200+ sold recently",""
"Coconut Tree Decorative Object","","","$4.60","300+ sold recently",""
"1pc Adult Minimalist Envelope Style Semi-Transparent PU Cosmetic Bag, Organizer, Gift Packaging (Products Not Included), Suitable For Daily Use, Festivals, Vacation, Business Trips, Parties","","","$4.70","2.1k+ sold recently","-4%"
"Electronics Organizer Travel Case, Carrying Pouch Bag For Travel Essentials, For Cable, Charging Cord, External Hard Drive, Portable Power Bank(Zipper Random)Storage Case Cable Bag Digital Bag Charger Case For Business,Travel,School,College,Office","","","$7.50","700+ sold recently","-12%"
"100Pcs Strong Luminous Beads Glow In The Dark Acrylic Loose Spacer Beads Round Ball Beads Candy Color For Jewelry Marking DIY Necklace Bracelet","#7 Best Sellers","in Jewelry Making Beads","$1.36","","-15%"
"Personal Portable Blender,Mini Juice Blender, USB Rechargeable Small Size Blender For Smoothies And Shakes,Mini Juicer Cup Travel 380ml, Juice, Milk,5Colors Available","#1 Best Sellers","in Personal Size Blenders","$8.80","",""
"1pc Creative Cartoon Desktop Storage Box, Office Pen Holder, Makeup Brush Organizer, Rotating Drawer Desk Storage Box For Stationery/Accessories/Bathroom","#5 Best Sellers","in Pencil Cases","$5.30","",""
"1pc Dust-Proof Clothing Cover Waterproof Clothes Dust Cover Tote Bag Black Garment Bag For Travel And Storage With Zipper For Suits Tuxedos Dresses And Coats 24 Inch X 40 Inch,For Travel Hanging Clothes Suit Bag For Suits, Coats, T-Shirts, Jackets","","","$2.84","300+ sold recently","-34%"
"1pc Stainless Steel Hooks Adhesive Robe Towel Hook Wall Key Hangers Bathroom Kitchen Accessories Holders Coat Clothers Racks Rustproof Shower Hanging Door Strong Nail Free Small Hook Organizer","","","$2.00","200+ sold recently",""
"6pcs Cartoon Cat Design Random Clothespin","","","$3.30","","-45%"
"1pc Handmade Funny Wooden Spoon, To Stir Some Poop, Laser Engraved Wooden Spoon, Gift For Mom, Gift For Grandma","","","$1.04","1.6k+ sold recently","-57%"
"1PC Academy Style Nylon Towel Embroidered Letter Makeup Bag Valentine's Day Gift Indoor Toilet Bag Lipstick Cosmetics Travel Vacation Storage Bag Key Card Miscellaneous Storage Change Bag","","","$2.86","600+ sold recently","-23%"
"1pc Floss And Makeup Pad Storage Box With Lid, Dust-Proof Transparent Desktop Storage Box, Multifunctional Cosmetic Storage Device, Home Accessories","","","$1.55","","-50%"
"1pc English Bathroom Butterfly Wall Sticker Home Decoration Decal","","","$1.89","1.7k+ sold recently","-10%"
"1pc 24 Grids Random Color Ice Cube Tray, Simple Silicone Ice Cube Mold For Kitchen","","","$1.96","100+ sold recently","-32%"
"Bohemian Style Gender Neutral Rainbow Educational Poster, Printed Canvas Wall Art, Self-encouragement, Positive Psychological Message, It's Okay To..., Teaching Supplies For Kindergarten, Children's Bedroom Decor, 1pc-unframed","","","$1.96","500+ sold recently","-11%"
"Slogan Graphic Microwave Oven Cover","","","$3.20","20+ sold recently",""
"50pcs Neon Stickers, Cool Neon Light Brand Stickers For Suitcase, Water Bottle, Motorcycle, Graffiti Stickers","","","$1.80","2.1k+ sold recently",""
"6-Layer Multifunctional Clothes Hanger With Clips For Pants And Skirts, Black, 1pc","#6 Best Sellers","in Good Quality Laundry Products","$8.06","","-4%"
"5pcs/Set Stainless Steel Mixing Bowl Salad Mixing Bowl Set, For Food Storage, Meal Preparation, Salad, Etc., Kitchen Gadget, Kitchen Accessories","#2 Best Sellers","in Mixing Bowls","$14.80","",""
"1pc Transparent Pvc Anti-stain Tablecloth, Anti-skid, Anti-stain, Anti-oil, Multi-purpose Dining Room, Living Room, Study Room Table Mat, Suitable For Dining Table","","","$6.20","400+ sold recently",""
"100pcs/5 Packs Thickened Portable Garbage Bags, Multi-Purpose Small Trash Bags, Suitable For Home, Office And Outdoor Use - Convenient And Durable Plastic Bags, Easy To Discard","#1 Best Sellers","in Trash Bags","$5.80","",""
"1pc 3 Layer Plastic Storage Cart, Multifunctional Storage Basket, Storage Rack With Lockable Wheels, Used In Bathrooms, Laundry Rooms, Living Rooms, With Classified Stickers","","","$12.75","5.1k+ sold recently","-58%"
"1pc Cooking oil sprayer, olive oil sprayer, 140 ml (4.73 oz) olive oil spray bottle, olive oil spray for salad, barbecue, kitchen baking, baking (Rose Gold)","#1 Best Sellers","in Seasoning & Spice Tools","$2.80","",""
"2000ml, 800ml, 300ml Portable Outdoor Water Bottle, Large Capacity Straw Water Bottle, Gradient Color Water Bottle, Sports Water Bottle, Suitable For Boys And Girls Color Water Bottle","","","$1.38","200+ sold recently","-40%"
"Preppy Makeup Bag For Women Travel Toiletry Bag Chenille Letter Cosmetic Bag PU Leather Waterproof Pouch Cute Zipper Organizer, Skin, Hair And Face","","","$3.75","1.3k+ sold recently","-32%"
"Moving Sand Art Picture,Quicksand Painting Round Glass Sandscapes 3D Deep Sea Sand Art (7 Inch, Green)","#4 Best Sellers","in Painting & Calligraphy","$2.11","","-78%"
"1pc Y2K Style Rainbow Letter Print Colorful Letter Design Funny Makeup Pouch Portable Toiletry Bag For Travel Makeup Bag Make Up Organizer Makeup Storage Cosmetic Bag Wash Bag Bathroom College Dorm ,Travel Stuff  Multifunctional Cosmetic Organizer Cute Handbag Wallet Pouch Case Portable Cosmetics Brush Storage Clutch With Zipper Closure For Lipstick, Brush, Skincare, Mobile Phone, Coin, Small Items, For Home, Travel, Beach,Pool Party,Vacation And School Use,Home Decor,Bathroom Livingroom Bathroom Organizer,Jewelry Organizer,Lip Oil Organizer,Nail Polish Organizer,Travel Essentials Cruise Essentials Dorm Essentials,Wedding Bridesmaid Gifts,Nurse Gifts,Sisters Gift,Mom Gifts,Birthday Gifts,Gifts For Friends And Teachers","","","$1.74","200+ sold recently","-40%"
"Floral Pattern Toilet Lid Decal","","","$0.87","100+ sold recently","-28%"
"4Pcs Waterproof Text Printed Wood Grain Pattern Linen Table Mats, Modern Style Printed Fabric Kitchen Cup Coasters, Heat Resistant Linen Western Table Mat, Suitable For Home, Hotels, Restaurants, Festive Occasions, Party Dining Table Decoration","","","$4.52","90+ sold recently","-22%"
"Rainbow Happy Mail Teacher's Classroom Note Cards For Parents, Used For Positive Behavior Encouragement, 50pcs/Pack, Universal Paper Labels For Preschool And Primary School","","","$2.60","80+ sold recently","-4%"
"6-layer simple shoe rack with dustproof cloth, multi-layer steel pipe assembly shoe cabinet","#8 Best Sellers","in Shoe Organizers","$11.40","","-25%"
"1 Rechargeable 1800 MAh Portable Handheld Mini Fan N15 Five Wind Mute Foldable Suitable For Outing Play Desktop Office Use","","","$8.10","7.1k+ sold recently",""
"1pc Pink 500ml Manual Garlic Masher For Home Use, Hand-held Garlic Press For Cutting Vegetables, Suitable For Chopping Garlic, Ginger, Chili, Onion And Other Foods","#7 Best Sellers","in Blenders","$3.46","","-48%"
"1pc Acrylic Cupcake Stand Round Jewelry Display Stand, Cake Dessert Stand Party Decoration Essentials, Suitable For Rings And Earrings, Miniature Statues, Black And Clear Wedding Accessories","#5 Best Sellers","in Cupcake Stands","$4.10","",""
"1pc Multi-functional Strap Hanger, Underwear & Vest Storage Rack, Traceless Clothes Drying Rack","#1 Best Sellers","in Household Cleaning Best Quality","$4.50","",""
"1pc Multi-Purpose Clear Plastic Storage Box With Fixed 10/15/24/28 Compartments, 36 Adjustable Compartments And 28/56 Removable Compartments For Earrings, Rings, Jewellery Organizing, Nail Art Supplies Sorting","#4 Best Sellers","in Jewelry Boxes & Organizers","$1.37","","-9%"
"1 Pair, Long Sleeve Rubber Gloves, Reusable Dishwashing Gloves, Kitchen Oven Pet Cleaning Gloves,Kitchen,Kitchen Items,Cleaning,Kitchen Towel","#2 Best Sellers","in Household Gloves","$0.93","","-68%"
"11Pcs/35Pcs Random Color Long  Rainbow Color Reusable Polymer Plastic Replacement Straws For 20oz (About 591.4ml) 30oz (About 850.5ml) Tumblers, With Cleaning Brush","","","$1.15","300+ sold recently","-57%"
"1pc Stainless Steel Soap Holder, Wall Mounted Soap Storage Rack For Bathroom","","","$2.30","1.6k+ sold recently",""
"1pc Flower-shaped Jewelry Tray, Jewelry Plate, Jewelry Storage Tray, Jewelry Holder, Creative Household Jewelry Storage Decoration, 4.13inch","","","$3.70","8.9k+ sold recently",""
"10pcs, Refrigerator Magnets, Mixed Large Bear Refrigerator Magnets, Kawaii Refrigerator Magnets, Whiteboard Magnets Sticker, Decorative Refrigerator Magnets, Cute Office Kitchen Magnets, Kitchen Utensils, Kitchen Gadgets","#6 Best Sellers","in Fridge & Decorative Magnets","$3.00","",""
"1pc Car Sun Visor Glasses Holder","#8 Best Sellers","in Accessory Organizers","$1.01","","-22%"
"50/100pcs 9x12mm Gold, Silver, Colored Hollow Acrylic Letter Beads, DIY Letter Bracelet Necklace Handmade Jewelry Accessory Pendant (Random Mix A-Z)","","","$1.20","200+ sold recently",""
"1pc Foldable Cartoon Mini Reusable Lint Roller, Compact & Portable, Washing Machine Friendly, Clothing Fuzz Remover, Randomly Shaped Like 3 Kinds Of Ears","","","$3.10","9.1k+ sold recently",""
"1pc 2.5L Transparent Plastic Sealed Grain Canister, Moisture-Proof And Dustproof Food Storage Box. Material: PP","","","$2.77","3.4k+ sold recently","-51%"
"1pc Multifunctional Strap Hanger For Clothes Storage, No Trace Drying Rack For Underwear And Vest","","","$2.16","2.6k+ sold recently","-50%"
"10 Pcs Anti-Chafing Thigh Bands","","","$2.10","1.0k+ sold recently",""
"1Pc Wooden Butterfly Right Corner Hollow-Out Creative Shape Crystal Shelf Decorative Wall Shelf","","","$4.34","1.5k+ sold recently","-45%"
"Minimalist Corduroy Functional Storage Bag,Multifunctional Sanitary Napkin Storage Bag Small Square Bag Ins Japanese Sweet Corduroy Square Makeup Toiletry Storage Bag.","","","$4.00","3.4k+ sold recently","-13%"
"50pcs Cupcake Liners, High Temperature Resistant Baking Tool, Suitable For Making Small Cakes, Breads And Pastries. With Various Patterns Including Muffin Cups And Baking Cups, These Kitchen Utensils Are Great For Family Gatherings, Birthday Parties, Picnics, Camping And Other Occasions.","","","$1.92","70+ sold recently","-31%"
"1 Cosmetic Storage Box, Multi-Layer Drawer, Skin Care Product Transparent Shelf, Lipstick Facial Mask Storage","","","$11.60","4.7k+ sold recently","-4%"
"8pcs Portable Travel Storage Bag Set - Organize Your Clothing, Shoes, and Underwear with Ease - Perfect for Luggage and Suitcase Packing 8pcs Slogan Graphic Travel Storage Bag Portable With Shoe Toiletry and Laundry Bags School Supplies Room Decor Bedroom Decor Dorm Essentials for School Student Teacher Packing Cubes Clothes Storage Clothes Organizer Travel Bag Set Travel Organizer Set Travel Essentials","#7 Best Sellers","in Travel Storage","$14.20","","-11%"
"5pcs DIY Coaster Silicone Mold","","","$7.90","40+ sold recently",""
"Foot Soak Callus Remover Gel Extra Strength Callus Remover Gel Foot Soak With Epsom Salts For Calluses, Dry Cracked Heels,Odor - Pedicure For Tired Feet","#4 Best Sellers","in Foot & Hand Care Tools","$6.10","","-8%"
"Crystal Epoxy Resin Molds For DIY Photo Frame Making, Featuring Hearts And Squares In Different Sizes","","","$5.70","200+ sold recently",""
"33-Grid Plastic Ice Cube Tray With Lid Homemade Ice Maker Small Quick-Freezing Freezer Ice Box Mold For Home Refrigerator","","","$1.08","100+ sold recently","-78%"
"Funny Best Friend Birthday Card For Women - Hilarious BFF Gift Idea With Humorous Friendship Quotes","","","$1.28","400+ sold recently","-33%"
"12pcs/set Drawer Organizer, 4 Different Sizes Kitchen & Bathroom Drawer Storage Organizers, Clear Plastic Storage Bins For Makeup, Jewelry, Utensils And Tools","#4 Best Sellers","in Storage Drawers","$7.77","","-57%"
"Portable Cosmetic Facial Pads Holder/Organizer, 1pc Pink Small Makeup Organizer/Cosmetic Storage Organizer, Portable Hair Clip Organizer, Multifunctional Storage Case With Push Switch, Storage Box For Facial Pads, Clips, Jewelry Rings, Earrings,Room,Home,Bedroom,Bathroom,House,Pink Room,Living Room Decor,Travel Stuff,Gift Bag,Gifts For Mom,Dad,Men,Friends,Teacher,Birthday,Wedding,Desk,Shelves,Accessaries,Gift Boxes,Funny Gift,Storage","","","$1.80","700+ sold recently","-5%"
"3pcs/Set Luxury Canvas Print Posters, Golden And White Leaves Canvas Wall Art Paintings, Artwork Wall Painting For Living Room Bedroom Bathroom Office Hallway Wall Decors, No Frames","","","$3.10","500+ sold recently",""
"1pc Solid Color PU Leather Square Tissue Box Cover With Buckle Design, Suitable For Bedroom, Living Room, Dining Table, Bar Counter And Office Desk","","","$2.28","10+ sold recently","-40%"
"100pcs Disposable Small Mesh Kitchen Sink Strainer, White Elastic Sink Filter Net For Sink Drain","","","$2.00","90+ sold recently",""
"1pc Cartoon Graphic Random Sticker","","","$0.90","","-40%"
"Inspirational Bible Verse Wooden Hanging Sign Plaque With Rope - Jesus He'll Be There For You, Rustic Style Retro Wall Art Wood Hanging Wall Plaque Christian Scripture Sign Decor","","","$1.40","300+ sold recently","-30%"
"50Pcs Cute Boba Stickers for Water Bottle, Vinyl Aesthetic Drink Stickers for Laptop Skateboard Phone, Waterproof Stickers Bulk for Teens Girls Adults","","","$1.50","600+ sold recently",""
"1/3pcs Removable Stainless Steel Wire Ball Cleaning Brush, Non-Shedding, Non-Sticking, Non-Damaging Scrubber For Dishwashing And Kitchen Cleaning, Handy And Clean Kitchen Tool, Suitable For Dish, Oil And Bathroom Cleaning, Dish Brush, Pot Brush, Pot Cleaning Ball Brush, Non-Stick Pan Cleaning Brush, User-Friendly Design With Handle, New Steel Ball Brush, Pot Brush, Kitchen Utensils","#2 Best Sellers","in Household Cleaning Under $0.99","$1.40","",""
"1pc Mesh Makeup Bag Black Friday","","","$2.00","3.9k+ sold recently","-5%"
"1pc Clear Plastic Jewelry Storage Box With Grids And Lid. Large Capacity, Convenient And Portable For Storing Earrings, Rings, And Other Ornaments. Detachable Box With Options Of 10, 15, Or 24 Grids, Gift For Valentine's Day","#6 Best Sellers","in Jewelry Boxes","$1.50","",""
"1 Portable Mini Transparent Zipper Storage Bag, Multifunctional Jewelry Storage Bag, Suitable For Headphones, Charging Case, Keychain, Ring, Transparent Travel Accessory Bag","","","$1.70","90+ sold recently","-6%"
"Reusable K-cups, 3-pack Universal Refillable Coffee Filters","#1 Best Sellers","in Permanent Coffee Filters","$1.80","","-10%"
"4pcs/Set  Three-Color Stripe Pattern Water-Absorbent Towels/Facial Towels","#2 Best Sellers","in Towels","$10.30","",""
"Cosmetics Storage Box, Drawer Desktop Storage Cabinet, Dressing Makeup Box, Multifunctional Storage, Large Capacity Skin Care And Perfume Storage Box, Suitable For Bathroom, Study And Bedroom","","","$7.60","100+ sold recently","-4%"
"1pc Pink Bedside Carpet With Modern Simplicity Nordic Ins Style, Suitable For Bedroom, Living Room, Tatami, Cute And Full Carpeted Cushion","","","$4.80","2.3k+ sold recently",""
"1 Set/6pcs Creative Cartoon Vinyl Wall Sticker: Decorative Artistic Style, Self-Adhesive Paper Easy To Install, Matte Plastic Surface - Adding Some Fun To Your Home Decor!","","","$0.69","1.2k+ sold recently","-59%"
"A Cowboy Boot Matchstick Holder, Match Storage Box, Ceramic Boot Holder, Cute Bathroom, Bedroom, Kitchen Interior Decoration Accessories (Excluding Matches)","#3 Best Sellers","in Doll Ornaments","$4.17","","-24%"
"10pcs Reusable Drawstring Soup Bags, Natural Muslin Drawstring Bags, Natural Unbleached Spice/Tea/Herbs Bags, Straining Cheesecloth Bags, Spice Bags For Cooking, Muslin Bags, Bone Broth Brew Bags, Kitchen Accessaries, Dorm Essentials","#2 Best Sellers","in Kitchen Bags","$1.47","","-41%"
"Double-layer Desktop Organizer Shelf For Dormitory Bedroom Office Desk Storage With Foldable Solid Wood Rack","","","$16.10","300+ sold recently",""
"Cloud Pillow Cosmetic Bag,1Pc Beige Letter Graphic Zipper Design Makeup Bag Reusable Cosmetic Bag,Makeup Bag Makeup Pouch Skincare Bag Toiletry Bag Packing Cubes,Travel Essentials Cruise Essentials Dorm Essentials,Wedding Bridesmaid Gifts,Mom Gifts,Birthday Gifts,Gifts For Friends And Teachers,Home Decor,Bathroom Livingroom Bedroom Decor,Bathroom Organizer,Jewelry Organizer,Lip Oil Organizer,Nail Polish Organizer Storage Makeup Organizer Makeup Case","","","$4.42","10k+ sold recently","-10%"
"Bathroom Black Hand Towel And Face Towel Set, Super Soft, Quick-Drying, Absorbent And Thick","#1 Best Sellers","in Face Towels","$3.00","",""
"1pc/6pcs Diamond Silicone Straw Cover, Cute Straw Dustproof Cap, Reusable Straw Protection Cover For Cup Accessories, Straw Decoration","","","$1.60","1.8k+ sold recently",""
"1pack DIY 8mm Solid Bead","","","$2.00","",""
"1pc Shower Basket Bath Toiletries Storage Bag For Bathroom","#8 Best Sellers","in Bath Baskets","$3.80","",""
"1pc Mini Manual Sewing Machine","","","$4.20","10k+ sold recently",""
"1set Cartoon Graphic Random Sticker","","","$3.10","20+ sold recently",""
"Simple Solid Color Umbrella With Capsule Box, Capsule Sun Umbrella Small And Portable Umbrellla, Sunscreen Sunshade UV Protection Umbrella Sunny And Rainy Dual-Use Umbrella, Men Women Mini Folding Pocket Umbrella","","","$1.90","2.9k+ sold recently",""
"4pcs/10pcs-Artificial Calla Lily Flowrer, Fake Flower Bouquet Suitable For Edding Party Garden Decor, Real Touch Faux Flower For Living Room Bedroom Dining Table Office Decor,Spring Decoration","","","$1.70","500+ sold recently",""
"Christian Gifts For Women, Birthday Gifts, Inspirational Gifts, Gifts, Spiritual Gifts, Catholic Gifts For Women, Mother, Friends, Female Colleagues, Sisters, For Christian Home Or Office Decorations Signage","","","$1.56","1.9k+ sold recently","-50%"
"3pcs Non-Stick Gas Stove Top Protector - Reusable, Oil And Dirt Resistant, Washable Pad For Easy Cleaning - Protect Your Stove And Keep Your Kitchen Clean","#3 Best Sellers","in Cool Tool Surface Protectors","$1.40","",""
"1 Pc, Fishing Net Beach Theme Decor For Party Home Living RoomBedroom 78 Inch Mediterranean Style Decor Wall Decoration, Nausical Fishing Net Shell Coastal Design Seaside Wall Hanging Home PartyDecoration","","","$5.20","40+ sold recently",""
"9pcs Artificial Pampas Grass Valentine'S Day Decoration, Pink, White, And Camel-Colored Fake Reeds, 55cm/21.65in Faux Bohemian Fluffy Flowers, Halloween, Christmas Decorations, Artificial Plush Grass Filler For Large Faux Pompous Tree Branch Floor Vase, Used For Flower Arrangements, Bohemian Decoration, Autumn Decoration, Bushy Reed Grass Vase Filler For Farmhouse Family Wedding Decor (Pink, White, And Camel-Colored)","","","$2.80","2.9k+ sold recently",""
"Jesus Door Frame Decoration","#1 Best Sellers","in Decorative Hanging Ornaments","$1.90","",""
"1pc Grilled Chicken Rack, Silver Stainless Steel Chicken Roaster Rack, Turkey Stand Holder For Kitchen","","","$5.40","90+ sold recently",""
"60pcs/Pack Bible Verse Graffiti Stickers,Guitar Skateboard Bottles Bumper Helmet Snowboard Laptop Phone Case Fridge Door Luggage Motorcycles Car DIY Doodle Stickers,Perfect Gifts","#7 Best Sellers","in Assorted Stickers","$1.80","",""
"8pcs Random Color Measuring Cup, Stainless Steel Handle Measuring Spoon For Baking","#2 Best Sellers","in Measuring Tools","$3.60","","-20%"
"6pcs Frameless Sea Ocean Canvas Wall Art Poster, Pink Bus Print Painting Vibrant Summer Picture Nordic Home Decoration, No Frame","","","$4.50","200+ sold recently",""
"1pc/3pcs Durable Honeycomb Mesh Laundry Bags For Delicates, 125gsm Net Fabric Durable And Reusable Delicate Wash Bag,Travel Organization Bag For Lingerie, Clothes, Jeans, Bath Towel, Sock","","","$2.20","400+ sold recently","-12%"
"Simple Tissue Box Desktop Tissue Holder Tissue Storage Box For Bathroom Living Room Bedroom Vanity Countertop Home Decor Bathroom Accessories","#10 Best Sellers","in Bathroom Storage","$1.19","","-79%"
"10pcs, Butterfly Stakes Plastic Butterflies On A Stick Plant Flower Pot Vase Arrangement Home Garden Decoration","#6 Best Sellers","in Outdoor Decor","$1.26","","-40%"
"4pcs Stainless Steel Napkin Ring, Modern Leaf Design Napkin Ring For Home","","","$2.97","100+ sold recently","-10%"
"Sequin Decor Table Runner","","","$3.70","200+ sold recently",""
