"goods-title-link","rank-title","rank-sub","price","selling_proposition","discount"
"30pcs Food Dispenser, Reusable Food Storage Container With Labels, Pen And Lid, Portable And Stackable Food Sealed Box, For Spice, Cheese, Biscuit And Snack, Kitchen Organizers And Storage, Kitchen Accessories","#1 Best Sellers","in Food Storage Packaging Tape & Stickers & Labels","$1.50","",""
"1pc Soft Plush Long Pile Washable Pv Rugs, Suitable For Children's Room, Living Room, Decorative Square Entrance Door Mat For Bedroom, Living Room, Dormitory, Kids' Playroom, Nursery","","","$5.50","1.9k+ sold recently",""
"5Ml Bottom Refillable Perfume Bottle With Pump Spray, Portable Aluminum Fragrance Container, Cosmetic Spray Bottle Dispenser Black Friday,Makeup Bag Makeup Pouch Skincare Bag Toiletry Bag Packing Cubes,Travel Essentials Cruise Essentials Dorm Essentials,Wedding Bridesmaid Gifts,Mom Gifts,Birthday Gifts,Gifts For Friends And Teachers,Home Decor,Bathroom Livingroom Bedroom Decor,Bathroom Organizer,Jewelry Organizer,Lip Oil Organizer,Nail Polish Organizer Makeup Bag Storage Makeup Organizer Makeup Case","","","$1.50","5.3k+ sold recently","-12%"
"1pc Mini USB Air Humidifier With High Fog Output, Household Tabletop Smart Car Essential Oil Aromatherapy Diffuser","#1 Best Sellers","in Electric Air Fresheners","$1.12","","-75%"
"1pc Creative Toilet Sticker, Please Rinse, Funny Cartoon Turtle Pattern Self-Adhesive Wall Stickers, Bathroom Home Decoration Stickers, Removable Stickers","","","$0.33","700+ sold recently","-76%"
"Set Of 12 Pieces Sealed Containers (Can Be Purchased Individually), Square & Round Lunch Box, Refrigerator Storage For Food,  Container","#6 Best Sellers","in Kitchen Storage & Organization","$1.90","",""
"1 Bottle Of 100ml Yara Indoor Household Air Spray, Indoor Fragrance, Lasting Fragrance","#1 Best Sellers","in Liquid/Solid Aromatherapy","$13.30","",""
"Simple Large Capacity Portable Transparent Travel Toiletry Bag, PU Waterproof Cosmetic Bag, Makeup Organizer Pouch","","","$2.00","70+ sold recently","-5%"
"Shampoo Brush With Soft Silicone Bristles, 1pc, Shower Scalp Exfoliator Suitable For Dandruff, Dry And Wet Dual Use, Suitable For Men And Women, Household Use Hair Brush Comb","","","$1.40","2.5k+ sold recently","-7%"
"20pcs/set 13 MM Sunflower Acrylic Beads Matter Mix Color Spacer Acrylic Beads For Making Bracelet Earrings","#1 Best Sellers","in Beads","$0.87","","-33%"
"10Pcs Silicone Earring Backs For Droopy Ears, Invisible Lifters For Heavy Earrings, Secure Earring Support For Studs","#1 Best Sellers","in Party Earrings","$2.10","",""
"1 Pair Heel Grips Liner Cushions Inserts For Loose Shoes, Heel Pads Snugs For Shoe Too Big Men Women, Filler Improved Shoe Fit And Comfort, Prevent Heel Slip And Blister","#1 Best Seller","In Beige Inserts & Insoles","$1.40","","-33%"
"1pc Simple Wall-Mounted Storage Rack For Hair Curler, Comb, And Hair Straightener, Bathroom Organizer Without Drilling","","","$2.70","300+ sold recently","-4%"
"2pcs Silicone Straw Covers Cap Letter Charms, For  Cup, For  Cup Letter Charms, Tumbler Accessories, (1pc Straw Covers Cap + 1pc Letter )","#7 Best Sellers","in Water Bottles for Outdoor","$0.85","","-53%"
"1pc Scalp Massager,Scalp Brush, Scalp Massage Brush Comb Shampoo Hair Washing Comb Shower Brush Bath Spa Slimming Massage Brush Shampoo Brush Silicone Hair Scalp Massager Shampoo Brush, Scalp Scrubber With Ultra-Soft Bristles, Integrated Design Scalp Exfoliator For Deep Cleanse, Dandruff Removal And Hair Growth Hair Brush","","","$0.32","400+ sold recently","-81%"
"1pc Multifunctional 9-hole Hanger For Home Wardrobe, Rotatable Clothes Hanger, Storage Rack, Magic Clothes Hanger","","","$0.86","10k+ sold recently","-55%"
"1pc Portable Hanging Neck Fan","#4 Best Sellers","in Top rated in Portable Fans","$6.48","","-20%"
"1pc Curling Iron Storage Rack Wall-Mounted Punch-Free Bathroom Wall Bedroom Table Storage Straight Hair Plate Curling Iron Anti-Scalding Rack With Hook","","","$10.50","","-4%"
"1roll Clear Double-sided Tape","#1 Best Sellers","in Tapes","$0.44","","-73%"
"16pcs/Set, Vegetable Chopper, Multifunctional Fruit Slicer, Manual Food Grater, Vegetable Slicer, Cutter With Container, Onion Mincer Chopper, Household Potato Shredder, Kitchen Stuff, Kitchen Gadgets, Dorm Essentials","#10 Best Sellers","in Shredders & Slicers","$1.44","","-20%"
"1pc Soft Ring Sizer Measuring Tool, Finger Ring Size, Ring Size Measuring Tape, Jewelry Measure Belt, US Size 1-17 4.48 X 0.19 Inch / 11.4 X 0.5 CM","#2 Best Sellers","in Decorative Growth Charts","$0.45","","-65%"
"1pc Car Interior Dust Remover, Gel Slime Cleaning Magic Dust Remover, Glue Car Vent Computer Keyboard Dirt Cleaner, Auto Cleaning Gel Accessories, Cleaning Supplies Car Accessories, Men Gift","#2 Best Sellers","in Household Cleaning Gel","$1.64","","-29%"
"5pcs/Set Professional Hair Styling Comb Set For Curly, Consist Of Edges Brush, Tail Comb, Gel Brush Denman Brush Edge Control Brush,Hair Brush Detangling Barber Comb Parting Comb Hair Picks Rat Tail Comb Rat Tail Combs For Parting,Hair Styling Comb Decorative Tail Comb, Edge Control Brush And Shampoo Brush Hair Comb Set, Anti-Static Braiding Combs Hair Combs For Salon,Braiding Combs Rat Tail Comb,Wide Tooth Comb Teasing Hair Brsuh Brush Hair Brush Scalp Massage,Straight, Wet, Dry, Long, And Shor","#8 Best Sellers","in Combs","$1.10","",""
"1pc Portable Mini Transparent Zipper Storage Bag, Multifunctional Jewelry Organizer For Earphones, Charging Case, Keychain, Ring, Transparent Travel Accessory Pouch","#3 Best Sellers","in Makeup Bags","$1.60","","-11%"
"1pc,white,5-Hook Door Hanger - Non-Trace, Multifunctional Wall Hanger for Hanging Bags, Hooks & More - Perfect for Home & Office!","#6 Best Sellers","in Hooks","$0.37","","-79%"
"5pcs/10pcs Assorted Thickened Wavy Ion Kitchen Dish Cloth, Stripe Coral Fleece Cleaning And Degreasing Non-Stick Cleaning Cloth","","","$0.47","300+ sold recently","-64%"
"Silicone Soap Holder, Slope Soap Drain Tray, Free Punching No Water Accumulation Sink Tray, Kitchen Accessories, Bathroom Accessories","#5 Best Sellers","in Bathroom Storage","$1.15","","-52%"
"5 Pack Purse Hanger Hook Acrylic Bag Hanger Handbag Tote Bag Rack Holder Closet Organizer Storage for Backpacks Satchels Purses Handbags Tote Holder","#3 Best Sellers","in Other Accessory Organizers","$0.85","","-29%"
"4 Pcs Holder Dispenser For Cleaning Stick, Round Pad, Dental Floss Pick - 10 Oz Clear Plastic Jar Set For Bathroom Organization, Dressing Table Makeup Container In Pink","#4 Best Sellers","in Storage Boxes , Bottles & Jars","$2.60","",""
"1 Piece Multifunctional Elegant Silicone Vanity Tray, Body Cleaning Tool Organiser, Bathroom Countertop Organiser For Toiletries, Perfumes And Jewellery","","","$2.80","100+ sold recently","-3%"
"1pc/4pcs Microfiber Mop Cloth, Replacement Mop Heads, Washable And Durabel Mop Cloth, Flat Mop Cloth, Coral Fleece Mop Cloth, Replacement Mop Pads, Useful Tool, Cleaning Supplies, Cleaning Gadgets, Apartment Essentials, Ready For","#8 Best Sellers","in Cleaning Tool Accessories","$1.80","",""
"12pcs Artificial Vine With Light String Green Leaf Fairy Vine Suitable For Wall Bedroom Garden Home Decoration Wedding Birthday Valentine's Day Mother's Day Spring Festival New Year Party Decoration","#6 Best Sellers","in Artificial Vertical Vines","$1.80","",""
"Absorbent Microfiber Dish Cloths, Kitchen Dishwashing Cloth, Oil-Free And Absorbent Stain Removal Towels, Lint Free Dishwashing Towels, Scouring Pads, And Cleaning Rags - Kitchen Accessories And Cleaning Tools,Kitchen,Kitchen Items,Cleaning,Kitchen Towel","","","$1.20","2.6k+ sold recently",""
"36pcs Window Screen Repair Patches, Cut-To-Size And Self-Adhesive, Anti-Stick For Door/Window Screens, Curtain Repair Tapes, Self-Adhesive Patch For Fixing Common Issues Such As Worn Out Holes And Tears In Window Screens, Anti-Mosquito Screen Patches.","#10 Best Sellers","in Adhesives & Sealers","$0.96","","-49%"
"1pc Plastic 4-Claw Rotatable Hook, Color Random, For Bag And Tie","","","$0.55","2.7k+ sold recently","-61%"
"1pc Knife Sharpener 4 Stages Professional Kitchen Sharpening Stone Tungsten Diamond Ceramic Sharpener Tool","#2 Best Sellers","in Sharpeners","$0.64","","-84%"
"3pcs Bath Sponge Soft Shower Flower, Bubble Bath Ball, Random Color","","","$0.88","600+ sold recently","-69%"
"1pc Black Multifunctional Mosquito Coil Holder, For Home Use, Wall Mounted Or Desktop, With Ash Receiver And Fireproof Incense Burner Decoration","#6 Best Sellers","in Incense Burners","$1.06","","-52%"
"1pc Small Item Storage Box, Transparent Flip Cover Snap-On Plastic Box, For Storing Cosmetics, Toothpicks, And Other Small Items","#3 Best Sellers","in Desktop Storage & Display Box","$0.56","","-65%"
"1pc Portable Mini Heat Sealer For Food Bags - Thermal Plastic Bag Closure For Freshness - Easy To Use Packing Kitchen Accessory ( Batteries Not Included )","#9 Best Sellers","in Daily Home Essentials","$1.72","","-22%"
"36 Pieces Invisible Anti-Slip Stickers, Seamless Double-Sided Adhesive Waterproof Transparent Stickers For Shirt Necklines, Women's Underwear And Underwear Accessories","","","$0.46","300+ sold recently","-62%"
"1pc  Candle Aromatherapy Mini Ball Smokeless Fragrance Candle Household Bedroom Decoration Bubble Aromatherapy","","","$2.10","4.4k+ sold recently",""
"40pcs Glass Jar Bottle Stickers, Kitchen Organizer Labels, Chalkboard Blackboard Shape Tag, Home DIY Chalk Board Sign, Bottle Sticker, Home Kitchen Supplies","#6 Best Sellers","in Labeling Supplies","$0.29","","-82%"
"4pcs Random Color Data Cord Organizer, Cable Winder, Silicone Straps, Earphone Wire Ties, Soft Rubber Cable Clip","#10 Best Sellers","in Storage and Organizer Bins","$0.45","","-68%"
"1pc Multi-layer Foldable Hanging Eyeglasses Storage Box","","","$5.46","700+ sold recently","-22%"
"Desktop Transparent Frosted Pen Holder, Slanted Makeup Brush & Lipstick Organizer, Multifunctional Stationery Storage Tube","#4 Best Sellers","in Pencil Cases","$0.96","","-64%"
"3pcs Drain Hair Catcher, Efficient Anti-Clogging Drain Strainer For Kitchen, Bathroom, Toilet","#6 Best Sellers","in Sewer Dredging Tools","$0.67","","-65%"
"3pcs Clothing Anti-Exposure Brooch With Detachable Faux Pearl Button For Jeans, Skirts, Dresses, Shirts, Etc.","","","$0.65","100+ sold recently","-66%"
"20pcs/10pcs Disposable Toilet Cleaning Wand Refills, Toilet Wand Disinfecting Refills, Toilet Brush Heads, Disposable Wand Heads, Apartment Essentials, College Dorm Essentials, Off To College, Ready For School, Back To School Supplies","#9 Best Sellers","in Toilet Accessories","$2.97","","-26%"
"1/4/8pcs Black Gas Stove Oil-Proof Mat, Washable Cleaning Mat, Burner Protection Mat, Dirt Resistant Heat Resistant Mat, Teflon Material Gas Stove Mat, Suitable For Household Gas Stoves.","","","$1.20","6.9k+ sold recently",""
"Massage Shampoo Brush,Scalp Anti Itching Scratch Brush, Shower BrushSilicone Head Massager, Soft Shampoo And Hair Care Brush","#3 Best Sellers","in Rubbing & Bathing Tools","$1.25","","-43%"
"12 Pcs Travel Hangers - Cruise Ship Essentials Portable Folding Clothes Hangers Travel Accessories Foldable Clothes Drying Rack For Travel","","","$1.32","500+ sold recently","-65%"
"1pc Led Light-up Plastic Strawberry Straw Cup With Strawberry Shaped Cute Pendant Included","","","$1.85","1.0k+ sold recently","-36%"
"1pc Portable Multifunction Cleaning Scraper","#1 Best Sellers","in Squeegees","$1.50","",""
"1pc Silicone Sand Ice Cup, Pinched Sand Ice Cup, Crushed Ice Cup, Summer Shaker Cup, Home Ice Sand Cup,Milkshake Bottle ,Summer Cooling Bottle Ice Maker Cup","#8 Best Sellers","in Cups","$7.92","","-33%"
"1set, Long Handle Tub And Tile Cleaning Brush With 1/3 Brush Heads Set/ Only 1 Replacement Head, Multifunctional Bathroom Floor Wall Tile Cleaning Brush, Removable Tub Tile Scrub Brush, Wall Scrubber Brush, Household Sponge Brush, Cleaning Supplies","","","$1.10","100+ sold recently",""
"1pc Portable Toiletry Travel Bag","#1 Best Sellers","in Toiletry Bags","$2.85","","-44%"
"1pc Flip Cover Cheese Slices Organizer Box, Fridge Storage Container For Cheese, Coffee And Tea Bags With Lid, Desk Sorting Box","#5 Best Sellers","in Desktop Storage & Display Box","$0.66","","-69%"
"1pc Led Mirror Table Alarm Clock Digital Alarm Snooze Display Time Desktop Electronic Table Clocks Snooze Display Time Night Light Desktop USB Alarm Clock Home Decor Smart Clock Home Furnishings For Bedroom Office Table Clock","#1 Best Sellers","in Clocks","$5.84","","-20%"
"1pc Random Color Window Cleaning Brush, Glass Wiper Cleaning Tool, Outside Window Cleaner","#5 Best Sellers","in Squeegees","$1.13","","-53%"
"1PC DIY Hair Cutting Cloak Umbrella Cape Salon Barber Cutting Cloak Wrap Home Hairdressing Cape Cover Cloth Hair Cutting Apron Creative Household Cleaning Protector","","","$1.17","4.6k+ sold recently","-51%"
"1pc Solid Color Non-Stick High Temperature Resistant Square Baking Paper For Food, Portable Air Fryer Kitchen Air Fryer Liners Air Fryer Paper Airfryer Air Frier","#8 Best Sellers","in Bakeware","$1.85","","-60%"
"1pc Foldable Anti-Fly Mesh Food Cover Dust-Proof Grease-Proof Camping Picnic Food Umbrella With Garden Plant Protector","#10 Best Sellers","in Household Merchandises","$1.31","","-48%"
"1pc Wall-Mounted Mouthwash Dispenser, Manual Press HandSanitizer Soap Dispenser, Shampoo Shower Gel Soap Dispenser, LotionContainer For Bathroom, Bathroom Accessories","","","$3.55","400+ sold recently","-30%"
"1pc Stainless Steel Baseball Cap Hanger - Wall Mounted Hat Organizer With Punch-Free Design","","","$3.12","1.5k+ sold recently","-11%"
"55pcs Stainless Steel Needle, Embroidery Needles For Hand Sewing, Easy Side Threading, Stitching Tools","#4 Best Sellers","in Arts,Crafts & Sewing","$1.50","",""
"1pc Herb Stripper With 8 Holes - Kitchen Tool For Stripping Thyme, Rosemary, Oregano Leaves Of Stem With Ease","","","$0.35","2.1k+ sold recently","-73%"
"1pc Watermelon Cutter, Watermelon Slicer, Watermelon Tool","","","$4.84","400+ sold recently","-27%"
"Set Of 10 Non-Woven Fabric Shoe Bags, Drawstring Storage Bags, Bundle Mouth Dustproof, Anti-Yellowing, Drying And Travel Shoe Covers.","#9 Best Sellers","in Shoe Dust Covers","$0.51","","-73%"
"1pc Thickened Manual Shaver Storage Box, Business Travel Portable Shaver Travel Case","#5 Best Sellers","in Personal Care Items & Storage","$0.67","","-52%"
"10/3/1pc Pack Reusable Colorful Food Storage Bags, Silicone Leak Proof Freezer Bags, Travel/Home Storage Reusable Bags, Gallon Bags, Sandwich Bags, Snack Bags (Random Colors)","","","$1.90","900+ sold recently","-27%"
"1pc Transparent Shoe Storage Bag, Travel Shoe Dustproof Bag, Home Moisture-proof Waterproof Boot Organizer","","","$1.96","600+ sold recently","-25%"
"1pc multifunctional wooden hanger for underwear, belts, ties and vest storage, drying, hanging and organizing wardrobes, student dormitories and homes","#7 Best Sellers","in Accessories Storage","$2.17","","-51%"
"1pc Stainless Steel French Fry Cutter, Two Tone Potato Wave Cutter For Kitchen","#2 Best Sellers","in French Fry Cutters","$1.45","","-19%"
"1/2/3pcs, Face Wash Headband Korean Super Fairy Sweet Big Bow Headband Super Wide High Elastic Sports Headband","","","$0.77","600+ sold recently","-41%"
"14-piece Drawer Organizer Set With Anti-slip Silicone Mat, 4 Size Tabletop Drawer Organizer Tray For Makeup, Jewelry, Bedroom Vanity, Office And Kitchen Utensils Storage, Transparent","#5 Best Sellers","in Storage & Organization","$7.65","","-63%"
"20pcs Single Layer Water Soluble Disposable Toilet Seat Pad, Neutral Packaging 10pcs/Pack Toilet Seat Paper","#3 Best Sellers","in Toilet Seat Covers","$0.96","","-44%"
"1pc/2pcs Non-Stick Oven Liner Mat, Heavy Duty Reusable Oven Bottom Mat For Electric & Gas Ovens And BBQ Grills, Party Gift BBQ Accessory And Essential Item For Cedar Resorts, Kitchen Carpet","#7 Best Sellers","in Kitchen Mats & Rugs","$1.80","",""
"1pc Apple-Shaped Plastic Wrap Storage Box With Adhesive Hanger, Wall-Mounted Plastic Wrap Holder, Self-Sealing Food Storage Bags, Bathroom Shower Cap Storage Box, Kitchen Accessories!","#1 Best Sellers","in Tableware Storage","$0.81","","-69%"
"1pc PP Knife, Cute Cloud Design Cutter For Home","","","$0.79","800+ sold recently","-44%"
"25/50/100/200pcs Disposable Air Fryer, Paper Air Fryer Liner, Paper Basket Bowl, Baking Pan, Oven Accessories, Baking Tools, Kitchen Gadgets, Kitchen Accessories","","","$2.00","90+ sold recently",""
"1Pc Waterproof Transparent Pu Cosmetic Bag With Embroidered Letters And Large Capacity, Perfect For Daily Use, Business Trips, And Vacations Black Friday,Makeup Bag Makeup Pouch Skincare Bag Toiletry Bag Packing Cubes,Travel Essentials Makeup Bag Storage Makeup Organizer Makeup Case","","","$4.87","2.3k+ sold recently","-38%"
"1 Pc Cute Transparent Women Pink Preppy Chenille Letter Patches Clear PVC SWIM BEACH Tote Bag Handle Cosmetic Bag Makeup Bag With Strap Handles Cosmetic Pouch Large Capacity Swimming Beach Travel  Stuff Toiletry Make Up Tote Bag For Swimmer Teens Girls Gifts Storage Makeup Organizer Makeup Case","","","$7.66","900+ sold recently","-26%"
"10pcs Face Cleaning Sponge Pad For Exfoliator Mask Facial SPA Massage Makeup Removal Thicker Compress Natural Cellulose Reusable","#2 Best Sellers","in Compressed Towels","$2.30","",""
"Daughter Gift From Mom To My Daughter Makeup Cosmetic Bag Birthday Graduation Gift For Daughter Wedding Gift Adult Daughter Gift Travel Toiletry Bag Daughter Bridal Shower Gift Make Up Pouch Makeup Bag Gift For Make Up Organizer For Makeup Tools Wash Bag For Girl Women","","","$0.86","500+ sold recently","-69%"
"1pc PVC Wall Decal, Modern Letter Graphic Wall Sticker For Home Wall Decor","#4 Best Sellers","in Decorative Mirrors","$1.40","",""
"5/10 Pieces Multi-Purpose Cleaning Microfiber Cloth Set Rags Window Cleaning Towels Car, Kitchen Furniture Towels,Kitchen,Kitchen Items,Cleaning,Kitchen Towel","#9 Best Sellers","in Cleaning Cloth","$1.82","","-33%"
"3pcs Exfoliating Bath Towel Set, Exfoliating Gloves, Bath Flower, Back Scrubber, Bath Shower Loofah Sponge, Bathroom Accessories","","","$0.93","200+ sold recently","-56%"
"1pc Wall Mounted Sweet Home Decorative Key Holder, Key Wall Hook, Creative Key Holder For Front Door","#1 Best Sellers","in Hooks & Rails","$3.44","","-20%"
"1pc Soft, Thick And Water-absorbing Bathrobe With Borders For Women, Wearable And Towel-like","#1 Best Sellers","in Bathrobe","$3.65","","-49%"
"1pc Stainless Steel Onion Needle, Multifunction Onion Holder Slicer For Kitchen","#4 Best Sellers","in Shredders & Slicers","$1.60","",""
"1pc Foundation 26 Golden-Letter Printed Cosmetic Bag For Storage, Handheld Wash Bag, Gift For Valentine's Day","","","$1.37","60+ sold recently","-45%"
"1pc Lace Mesh Food Cover, Dustproof Pop Up Umbrella Food Tent, Decorative Reusable Collapsible Food Covers For Table, Food Nets, Kitchen Tools","#9 Best Sellers","in Food Covers","$1.26","","-48%"
"1pc, Lemon Zester, Cheese Grater, Multifunctional Stainless Steel Garlic Grater, Manual Ginger Shredded, Household Creative Cheese Grater, Vegetable Grater, Kitchen Stuff, Kitchen Gadgets","","","$1.96","700+ sold recently","-46%"
"100pcs Bamboo Disposable Fruit Fork,Cocktail Pick,Cake Fork,Fruit Stick","#1 Best Sellers","in Disposable Fruit Stick","$1.90","",""
"100pcs Multicolor Self-Locking Nylon Cable Ties With Security Stops, Strong Load Bearing Capacity, High Tensile Strength, Durable And Convenient For Organizing Wires Or Cords In Home, Garden, Garage, Workshop And More","#2 Best Sellers","in Gardening Tools","$0.28","","-81%"
"Self-Inking Stamp Roller For Identity Theft Protection, Refillable And Automatic Ink Filling, Used For Privacy And Confidentiality Of Personal Information","#1 Best Sellers","in Stamps","$2.40","",""
"1pc Upgrade Collapsible Microwave Lid, 10.5 inches with Hook Hole, Vented Folding Microwave Plate Cover, Microwave Splatter Cover, Vegetable Fruit Cleaning Basket, Multi-function Kitchen Tool","#8 Best Sellers","in Food Covers","$2.80","","-53%"
"1pc 360° Degree Rotating Pen Holder For Desk, Multi-Purpose Stationery Office Supplies Storage Box For Office, School, Home, Bathroom Vanity Countertop Cosmetics Organizer Makeup Brush Holder","#1 Best Sellers","in Filing Products","$3.06","","-41%"
"Magnetic Mesh Pen Holder 1 Basket, Powerful Magnet For Whiteboard, Refrigerator And Locker, Metal Iron Mesh Pen Holder Square Minimalist Clutter Storage Iron Magnetic Pen Holder For Office Literature And Creativity","#8 Best Sellers","in Pencil Cases","$2.70","",""
"1pc Portable Sewing Kit Household Sewing Tools 10pcs/Set Thread Box Patching Needle Threader Hand Stitching Supplies","","","$3.30","1.8k+ sold recently",""
"45ml Card Shaped Spray Bottle For Hand Sanitizer, Portable Perfume Shower Gel Sprayer","","","$2.00","600+ sold recently",""
"1pc Triangle Floor Drain, Home Sink Deodorization Blockage-Proof Filter, Bathtub Sewer Drain, Bathroom Product, Bathroom Accessories, Kitchen Sink Anti-Blocking And Deodorization Mesh, Bathtub Drain, Bathroom Drainage Filter And Drain Cover","","","$1.06","400+ sold recently","-38%"
"1pc, Semi-Automatic Flour Sifter, Sifter With Hand Press Design, Flour Sieve, Baking Tools, Kitchen Gadgets, Kitchen Accessories","","","$3.57","100+ sold recently","-30%"
"10pcs, Disposable Duster Refills, Electrostatic Duster Heads Replacement - Effortless Dust Removal For Electronics, Furniture, Blinds, And Ceiling Fans – (Handle Not Included) - Cleaning Supplies, Cleaning Accessories","#7 Best Sellers","in Househole Brushers Newest Trend","$1.15","","-4%"
"1pc Letter Series 3 Black Base Colorful Letters & Holographic Flower Pattern Cute Heart Printed Apron, Perfect For Parties And Weddings, Made Of Peach Skin Fabric","#7 Best Sellers","in Aprons","$2.42","","-22%"
"1/One Size 4pcs Mini Portable Sauce Bottles, Salad Dressing And Ketchup Dispenser Plastic Squeeze Bottle Seasoning Container, Random Pattern Color","#3 Best Sellers","in Squeeze Bottles","$0.37","","-69%"
"1pc Multifunctional Hanger Pants Hanger Scarf Storage Hanger","#2 Best Sellers","in Accessories Storage","$2.30","","-4%"
"111pcs Water Bomb Balloons Summer Toys Waterballonnen Games Party Balloons","#3 Best Sellers","in Home Life","$2.50","","-4%"
"1pc Black Remote Control Desktop Storage Rack, Simple Multifunction Storage Holder For Desk","","","$2.80","",""
"57pcs Piping Nozzle & Pastry Bag & Piping Gun Set","","","$2.59","500+ sold recently","-48%"
"7pcs Gap Cleaning Brush, Mini Plastic White Crevice Brush, Keyboard Brush For Home","","","$1.70","700+ sold recently",""
"1pc Luxury Metal Curtain Tieback, Easy Installation & No Drilling Required, Curtain Decoration Buckle","","","$3.30","200+ sold recently",""
"Portable Mini Refillable Perfume Spray Bottle, Suitable For Travel And Outdoor Activities, Multicolor 5ml Perfume Atomizer","#8 Best Sellers","in Storage Boxes , Bottles & Jars","$0.82","","-45%"
"Forefoot Pads,2Pcs Fan-Shaped Shock-Absorbing Anti-Slip Self-Adhesive Heel Protector Tool","#2 Best Sellers","in Foot & Hand Care Tools","$1.65","","-13%"
"1pc Small Item Compartment Storage Box, Multifunctional, Waterproof, Detachable; Suitable For Storing Jewelry, Nail Art Accessories, Screws And Tools","#9 Best Sellers","in Desktop Storage & Display Box","$0.52","","-73%"
"One Independence Day Welcome Garden Flag, Minimalist Style Faux Linen Printed Double-Sided Banner, No Flagpole, Perfect For Festival, Cottage, Yard, Outdoor Lawn And Garden Decor","#10 Best Sellers","in Yard & Garden Decor","$1.77","","-26%"
"1pc Black Metal Home Garden Iron Art Decoration","","","$5.50","400+ sold recently",""
"1pc Multi-Function Soft-Bristled Shoe Brush For Household Use, Mint Green, With Liquid Dispensing Function","","","$0.35","300+ sold recently","-78%"
"Fresh Stretch Pod For Avocado Onion Lemon Tomato Saver And Storage Keeper Reusable Avocado Stretch Storage Containers Food Storage Box For Fruit And Vegetable Storage 4pcs Set/ 1pc","","","$1.05","200+ sold recently","-66%"
"1pc Large Cabbage Shredder Peeler, Purple Cabbage Broccoli Lettuce Slicer, Wide-Mouthed Vegetable Peeler,Vegetable Fruit Tools,Kitchen Items,Cutter,Food,Salad,Decor,Storage,Party,Birthday,Camping,Summer Beach.","","","$1.40","60+ sold recently",""
"1pc Educational Clock Pattern Stamp Toy For Teaching Time Telling, Ideal For Teachers And Students","","","$1.96","100+ sold recently","-22%"
"24 Grids Over-The-Door Shoe Organizer Foldable Fine Mesh Hanging Bag","#1 Best Sellers","in Shoe Organizers","$6.02","","-27%"
"DEFINICE 1pc Tea Bag Organizer Tea Bag Storage Tea Bag Holder Tea Box Clear Storage Bins For Sugar Packet, Coffee, Condiment, Spice Pouches In Kitchen, Cabinet, Countertop, Pantry","","","$3.48","100+ sold recently","-36%"
"1pc Foldable Sunglasses Storage Box, Gift For Valentine's Day","","","$3.12","500+ sold recently","-54%"
"1pc  Beach Towel Windproof Clips For Beach Chairs Patio And Pool Accessories Cartoon Glasses Cocktail Glasses Towel Clips Funny Decorative Clothespins For Home (Cute Style)","","","$2.70","30+ sold recently",""
"4/10pcs Round Fridge Magnet To Decorate Fridge And Fixed Photos/Messages/Notes","#2 Best Sellers","in Fridge & Decorative Magnets","$1.57","","-35%"
"1 Pcs Waterproof Waist Pack - Waterproof Cell Phone Pouch With Waist Strap - Voyage Essentials Waterproof Pouch Dry Bag Keeps Cell Phone And Valuables Safe For Kayaking Boating Fishing On The Beach (Clear)","#4 Best Sellers","in Multifunctional Storage Bags","$1.83","","-24%"
"1/5/10Pcs Super Strong Drain Cleaner To Drain Your Kitchen Sink, Toilet And Pipe In Seconds","","","$1.12","10k+ sold recently","-7%"
"1pc Kitchen Hanging Organizer, Refrigerator Egg Fruit Storage Box Drawer Type Food Crisper Box Kitchen Accessories Refrigerator Organizer Shelf","#8 Best Sellers","in Food Storage","$4.60","",""
